index,account_name,date,amount,currency,message,tx_type,vs,ss
0,creo,2024-07-23,-32290.0,EUR,Kreativa a dizajn / zaver kampan,Okamžitá platba (EB),232407008.0,
1,creo,2024-07-18,-24890.0,EUR,Volebne noviny - dotlac,Okamžitá platba (EB),232407007.0,
2,creo,2024-07-18,-16150.0,EUR,Tlac plagatov pre obecne tabule,Okamžitá platba (EB),232407009.0,
3,creo,2024-07-18,-24500.0,EUR,PR spolupraca s print mediami 2,Okamžitá platba (EB),232407006.0,
4,creo,2024-07-18,-19500.0,EUR,"Distribucia a lepenie plagatov,obce",Okamžitá platba (EB),232407010.0,
5,creo,2024-07-18,-22300.0,EUR,Organizovanie podujatia 1. máj,Okamžitá platba (EB),232407011.0,
6,creo,2024-07-18,-49900.0,EUR,PR spolupraca s online mediami 2,Okamžitá platba (EB),232407005.0,
7,creo,2024-07-15,-72000.0,EUR,Eurovolebny merkantil druha cast,Okamžitá platba (EB),232407004.0,
8,creo,2024-07-15,-15800.0,EUR,EP kampanovy transfer / doprava,Okamžitá platba (EB),232407003.0,
9,creo,2024-07-15,-11850.0,EUR,Reklama v obecnych rozhlasoch,Okamžitá platba (EB),232407002.0,
10,NOTPROVIDED,2024-07-15,-55400.0,EUR,Prieskum a analyza politickych tem,Okamžitá platba (EB),232407001.0,
11,HLAS - sociálna demokracia,2024-07-10,10000.0,EUR,vklad za účelom úhrady faktúr za kampaň,Bezhotovostný vklad,,
12,HLAS - sociálna demokracia,2024-07-10,170000.0,EUR,vklad za účelom úhrady faktúr za kampaň,Bezhotovostný vklad,,
13,HLAS - sociálna demokracia,2024-07-10,170000.0,EUR,vklad za účelom úhrady faktúr za kampaň,Bezhotovostný vklad,,
14,"Lukačovič Viliam, Ing.",2024-07-08,-85.0,EUR,"Viliam Lukacovic, vrátenie daru",Okamžitá platba (EB),61009701.0,
15,"Lukačovič Viliam, Ing.",2024-07-04,85.0,EUR,Viliam Lukacovic,Bezhotovostný vklad - okamžitá platba,61009701.0,
16,,2024-07-02,-0.25,EUR,Poplatok za platbu kartou,Poplatok za kartovú transakciu,,
17,,2024-07-02,-2801.11,EUR,"B1846053124-44544 17** **** 6401;GOOGLE *ADS2821367403 ,G.CO/HELPPAY# ,IE ;01.07.2024 16:25:41 ;CashBack:0 EUR",Platba kartou,,
18,,2024-06-30,-5.0,EUR,Zverejňovanie účtu,Poplatok,,
19,,2024-06-30,-5.0,EUR,Poplatok za vedenie účtu,Poplatok,,
20,,2024-06-27,-4.0,EUR,Poplatok za zmeny na Účte,Poplatok,,
21,,2024-06-21,-0.25,EUR,Poplatok za platbu kartou,Poplatok za kartovú transakciu,,
22,,2024-06-21,-508.62,EUR,"B1835741258-44544 17** **** 6401;FACEBK *GUERH5GCE2 ,fb.me/ads ,IE ;19.06.2024 10:09:33 ;CashBack:0 EUR",Platba kartou,,
23,creo,2024-06-19,-49560.0,EUR,Za ooh kampan v mesiaci maj,Okamžitá platba (EB),232406004.0,
24,creo,2024-06-19,-34680.0,EUR,za strategiu a dizajn v mesiaci maj,Okamžitá platba (EB),232406005.0,
25,,2024-06-17,-0.25,EUR,Poplatok za platbu kartou,Poplatok za kartovú transakciu,,
26,,2024-06-17,-788.28,EUR,"B1833096956-44544 17** **** 6401;FACEBK *6ZQJD5QCE2 ,fb.me/ads ,IE ;16.06.2024 11:35:42 ;CashBack:0 EUR",Platba kartou,,
27,,2024-06-06,-0.25,EUR,Poplatok za platbu kartou,Poplatok za kartovú transakciu,,
28,,2024-06-06,-800.0,EUR,"B1823631029-44544 17** **** 6401;FACEBK *YN34X4GCE2 ,fb.me/ads ,IE ;05.06.2024 20:38:49 ;CashBack:0 EUR",Platba kartou,,
29,,2024-06-06,-0.25,EUR,Poplatok za platbu kartou,Poplatok za kartovú transakciu,,
30,,2024-06-06,-800.0,EUR,"B1823549971-44544 17** **** 6401;FACEBK *BVPP65LCE2 ,fb.me/ads ,IE ;05.06.2024 06:51:21 ;CashBack:0 EUR",Platba kartou,,
31,,2024-06-06,-0.25,EUR,Poplatok za platbu kartou,Poplatok za kartovú transakciu,,
32,,2024-06-06,-800.0,EUR,"B1823541122-44544 17** **** 6401;FACEBK *4ZXHW4QCE2 ,fb.me/ads ,IE ;05.06.2024 19:40:37 ;CashBack:0 EUR",Platba kartou,,
33,,2024-06-06,-0.25,EUR,Poplatok za platbu kartou,Poplatok za kartovú transakciu,,
34,,2024-06-06,-800.0,EUR,"B1823547831-44544 17** **** 6401;FACEBK *FFDMW4QCE2 ,fb.me/ads ,IE ;05.06.2024 21:25:56 ;CashBack:0 EUR",Platba kartou,,
35,,2024-06-06,-0.25,EUR,Poplatok za platbu kartou,Poplatok za kartovú transakciu,,
36,,2024-06-06,-800.0,EUR,"B1823538843-44544 17** **** 6401;FACEBK *ZY6TT58CE2 ,fb.me/ads ,IE ;05.06.2024 12:57:04 ;CashBack:0 EUR",Platba kartou,,
37,,2024-06-06,-5000.0,EUR,"B1823528022-44544 17** **** 6401;GOOGLE *ADS2821367403 ,G.CO/HELPPAY# ,IE ;05.06.2024 14:39:08 ;CashBack:0 EUR",Platba kartou,,
38,,2024-06-06,-0.25,EUR,Poplatok za platbu kartou,Poplatok za kartovú transakciu,,
39,,2024-06-06,-800.0,EUR,"B1823523307-44544 17** **** 6401;FACEBK *CDS8Z54DE2 ,fb.me/ads ,IE ;05.06.2024 16:57:56 ;CashBack:0 EUR",Platba kartou,,
40,,2024-06-06,-0.25,EUR,Poplatok za platbu kartou,Poplatok za kartovú transakciu,,
41,,2024-06-06,-0.25,EUR,Poplatok za platbu kartou,Poplatok za kartovú transakciu,,
42,,2024-06-06,-800.0,EUR,"B1823516033-44544 17** **** 6401;FACEBK *WR7G454CE2 ,fb.me/ads ,IE ;05.06.2024 15:03:04 ;CashBack:0 EUR",Platba kartou,,
43,,2024-06-06,-0.25,EUR,Poplatok za platbu kartou,Poplatok za kartovú transakciu,,
44,,2024-06-06,-800.0,EUR,"B1823514777-44544 17** **** 6401;FACEBK *UZ6MD4UCE2 ,fb.me/ads ,IE ;05.06.2024 18:30:38 ;CashBack:0 EUR",Platba kartou,,
45,,2024-06-06,-0.25,EUR,Poplatok za platbu kartou,Poplatok za kartovú transakciu,,
46,,2024-06-06,-800.0,EUR,"B1823518643-44544 17** **** 6401;FACEBK *KTFHW4GCE2 ,fb.me/ads ,IE ;05.06.2024 10:54:17 ;CashBack:0 EUR",Platba kartou,,
47,,2024-06-06,-0.25,EUR,Poplatok za platbu kartou,Poplatok za kartovú transakciu,,
48,,2024-06-06,-800.0,EUR,"B1823503594-44544 17** **** 6401;FACEBK *5D5475LCE2 ,fb.me/ads ,IE ;05.06.2024 13:03:12 ;CashBack:0 EUR",Platba kartou,,
49,,2024-06-06,-0.25,EUR,Poplatok za platbu kartou,Poplatok za kartovú transakciu,,
50,,2024-06-06,-800.0,EUR,"B1823487324-44544 17** **** 6401;FACEBK *HRCC25CCE2 ,fb.me/ads ,IE ;05.06.2024 08:33:35 ;CashBack:0 EUR",Platba kartou,,
51,Freedom factory,2024-06-06,-74483.76,EUR,"Zabezpečenie podujatia 1.6. Snem,KE",Okamžitá platba (EB),20240009.0,
52,,2024-06-06,-0.25,EUR,Poplatok za platbu kartou,Poplatok za kartovú transakciu,,
53,,2024-06-06,-800.0,EUR,"B1823414291-44544 17** **** 6401;FACEBK *2EBBY54DE2 ,fb.me/ads ,IE ;05.06.2024 01:16:38 ;CashBack:0 EUR",Platba kartou,,
54,,2024-06-06,-0.25,EUR,Poplatok za platbu kartou,Poplatok za kartovú transakciu,,
55,,2024-06-06,-800.0,EUR,"B1822815009-44544 17** **** 6401;FACEBK *BHTG95YCE2 ,fb.me/ads ,IE ;04.06.2024 20:54:02 ;CashBack:0 EUR",Platba kartou,,
56,,2024-06-06,-800.0,EUR,"B1822824452-44544 17** **** 6401;FACEBK *YDN4V4QCE2 ,fb.me/ads ,IE ;04.06.2024 22:05:48 ;CashBack:0 EUR",Platba kartou,,
57,,2024-06-06,-0.25,EUR,Poplatok za platbu kartou,Poplatok za kartovú transakciu,,
58,,2024-06-06,-0.25,EUR,Poplatok za platbu kartou,Poplatok za kartovú transakciu,,
59,,2024-06-06,-800.0,EUR,"B1822768104-44544 17** **** 6401;FACEBK *W3TC354CE2 ,fb.me/ads ,IE ;04.06.2024 19:27:15 ;CashBack:0 EUR",Platba kartou,,
60,,2024-06-06,-0.25,EUR,Poplatok za platbu kartou,Poplatok za kartovú transakciu,,
61,,2024-06-06,-800.0,EUR,"B1822752836-44544 17** **** 6401;FACEBK *4BY2C4UCE2 ,fb.me/ads ,IE ;04.06.2024 15:08:02 ;CashBack:0 EUR",Platba kartou,,
62,,2024-06-06,-0.25,EUR,Poplatok za platbu kartou,Poplatok za kartovú transakciu,,
63,,2024-06-06,-5000.0,EUR,"B1822730116-44544 17** **** 6401;GOOGLE *ADS2821367403 ,G.CO/HELPPAY# ,IE ;04.06.2024 13:49:52 ;CashBack:0 EUR",Platba kartou,,
64,,2024-06-06,-0.25,EUR,Poplatok za platbu kartou,Poplatok za kartovú transakciu,,
65,,2024-06-06,-800.0,EUR,"B1822740396-44544 17** **** 6401;FACEBK *5BYY85YCE2 ,fb.me/ads ,IE ;04.06.2024 12:27:57 ;CashBack:0 EUR",Platba kartou,,
66,,2024-06-06,-0.25,EUR,Poplatok za platbu kartou,Poplatok za kartovú transakciu,,
67,,2024-06-06,-800.0,EUR,"B1822740225-44544 17** **** 6401;FACEBK *5479S58CE2 ,fb.me/ads ,IE ;04.06.2024 09:12:31 ;CashBack:0 EUR",Platba kartou,,
68,,2024-06-06,-0.25,EUR,Poplatok za platbu kartou,Poplatok za kartovú transakciu,,
69,,2024-06-06,-800.0,EUR,"B1822695648-44544 17** **** 6401;FACEBK *LS4QS58CE2 ,fb.me/ads ,IE ;04.06.2024 17:26:45 ;CashBack:0 EUR",Platba kartou,,
70,HLAS - sociálna demokracia,2024-06-06,150000.0,EUR,prevod na transparetny volby do ep,Bezhotovostný vklad,9.0,
71,,2024-06-04,-0.25,EUR,Poplatok za platbu kartou,Poplatok za kartovú transakciu,,
72,,2024-06-04,-800.0,EUR,"B1822596903-44544 17** **** 6401;FACEBK *Q7E5U4QCE2 ,fb.me/ads ,IE ;04.06.2024 05:40:19 ;CashBack:0 EUR",Platba kartou,,
73,,2024-06-04,-0.25,EUR,Poplatok za platbu kartou,Poplatok za kartovú transakciu,,
74,,2024-06-04,-800.0,EUR,"B1822019019-44544 17** **** 6401;FACEBK *MG7ZA4UCE2 ,fb.me/ads ,IE ;03.06.2024 21:47:06 ;CashBack:0 EUR",Platba kartou,,
75,,2024-06-04,-0.25,EUR,Poplatok za platbu kartou,Poplatok za kartovú transakciu,,
76,,2024-06-04,-800.0,EUR,"B1821944132-44544 17** **** 6401;FACEBK *7DDTA4UCE2 ,fb.me/ads ,IE ;03.06.2024 18:37:38 ;CashBack:0 EUR",Platba kartou,,
77,,2024-06-04,-0.25,EUR,Poplatok za platbu kartou,Poplatok za kartovú transakciu,,
78,,2024-06-04,-5000.0,EUR,"B1821942946-44544 17** **** 6401;GOOGLE *ADS2821367403 ,G.CO/HELPPAY# ,IE ;03.06.2024 09:33:06 ;CashBack:0 EUR",Platba kartou,,
79,,2024-06-04,-0.25,EUR,Poplatok za platbu kartou,Poplatok za kartovú transakciu,,
80,,2024-06-04,-800.0,EUR,"B1821925452-44544 17** **** 6401;FACEBK *RY95T4QCE2 ,fb.me/ads ,IE ;03.06.2024 12:24:01 ;CashBack:0 EUR",Platba kartou,,
81,,2024-06-04,-0.25,EUR,Poplatok za platbu kartou,Poplatok za kartovú transakciu,,
82,,2024-06-04,-800.0,EUR,"B1821918103-44544 17** **** 6401;FACEBK *FLULX4CCE2 ,fb.me/ads ,IE ;03.06.2024 11:50:06 ;CashBack:0 EUR",Platba kartou,,
83,,2024-06-03,-0.25,EUR,Poplatok za platbu kartou,Poplatok za kartovú transakciu,,
84,,2024-06-03,-800.0,EUR,"B1821839569-44544 17** **** 6401;FACEBK *GS85Z44CE2 ,fb.me/ads ,IE ;03.06.2024 05:05:02 ;CashBack:0 EUR",Platba kartou,,
85,,2024-06-03,-0.25,EUR,Poplatok za platbu kartou,Poplatok za kartovú transakciu,,
86,,2024-06-03,-800.0,EUR,"B1821440228-44544 17** **** 6401;FACEBK *FB5US4GCE2 ,fb.me/ads ,IE ;02.06.2024 19:45:23 ;CashBack:0 EUR",Platba kartou,,
87,,2024-06-03,-0.25,EUR,Poplatok za platbu kartou,Poplatok za kartovú transakciu,,
88,,2024-06-03,-800.0,EUR,"B1821408703-44544 17** **** 6401;FACEBK *ZC26S4GCE2 ,fb.me/ads ,IE ;02.06.2024 07:20:25 ;CashBack:0 EUR",Platba kartou,,
89,,2024-06-03,-0.25,EUR,Poplatok za platbu kartou,Poplatok za kartovú transakciu,,
90,,2024-06-03,-800.0,EUR,"B1821409104-44544 17** **** 6401;FACEBK *GK6WU54DE2 ,fb.me/ads ,IE ;02.06.2024 13:44:02 ;CashBack:0 EUR",Platba kartou,,
91,,2024-06-02,-0.25,EUR,Poplatok za platbu kartou,Poplatok za kartovú transakciu,,
92,,2024-06-02,-800.0,EUR,"B1820712178-44544 17** **** 6401;FACEBK *9WDUZ4LCE2 ,fb.me/ads ,IE ;01.06.2024 20:32:22 ;CashBack:0 EUR",Platba kartou,,
93,,2024-06-02,-0.25,EUR,Poplatok za platbu kartou,Poplatok za kartovú transakciu,,
94,,2024-06-02,-800.0,EUR,"B1820715099-44544 17** **** 6401;FACEBK *NTP2U54DE2 ,fb.me/ads ,IE ;01.06.2024 20:14:38 ;CashBack:0 EUR",Platba kartou,,
95,,2024-06-02,-0.25,EUR,Poplatok za platbu kartou,Poplatok za kartovú transakciu,,
96,,2024-06-02,-800.0,EUR,"B1820703982-44544 17** **** 6401;FACEBK *SZWRW44CE2 ,fb.me/ads ,IE ;01.06.2024 06:56:26 ;CashBack:0 EUR",Platba kartou,,
97,,2024-06-02,-5000.0,EUR,"B1820705176-44544 17** **** 6401;GOOGLE *ADS2821367403 ,G.CO/HELPPAY# ,IE ;01.06.2024 15:25:32 ;CashBack:0 EUR",Platba kartou,,
98,,2024-06-02,-0.25,EUR,Poplatok za platbu kartou,Poplatok za kartovú transakciu,,
99,,2024-06-02,-0.25,EUR,Poplatok za platbu kartou,Poplatok za kartovú transakciu,,
100,,2024-06-02,-800.0,EUR,"B1820678251-44544 17** **** 6401;FACEBK *S8U855YCE2 ,fb.me/ads ,IE ;01.06.2024 13:49:31 ;CashBack:0 EUR",Platba kartou,,
101,,2024-06-02,-0.25,EUR,Poplatok za platbu kartou,Poplatok za kartovú transakciu,,
102,,2024-06-02,-697.71,EUR,"B1820618408-44544 17** **** 6401;GOOGLE *ADS2821367403 ,G.CO/HELPPAY# ,IE ;01.06.2024 18:24:27 ;CashBack:0 EUR",Platba kartou,,
103,,2024-06-02,-0.25,EUR,Poplatok za platbu kartou,Poplatok za kartovú transakciu,,
104,,2024-06-02,-800.0,EUR,"B1819831273-44544 17** **** 6401;FACEBK *2H69W44CE2 ,fb.me/ads ,IE ;31.05.2024 20:18:45 ;CashBack:0 EUR",Platba kartou,,
105,,2024-06-02,-0.25,EUR,Poplatok za platbu kartou,Poplatok za kartovú transakciu,,
106,,2024-06-02,-0.25,EUR,Poplatok za platbu kartou,Poplatok za kartovú transakciu,,
107,,2024-06-02,-800.0,EUR,"B1819756304-44544 17** **** 6401;FACEBK *APCXP4GCE2 ,fb.me/ads ,IE ;31.05.2024 13:23:09 ;CashBack:0 EUR",Platba kartou,,
108,,2024-06-02,-800.0,EUR,"B1819755776-44544 17** **** 6401;FACEBK *QJDZR54DE2 ,fb.me/ads ,IE ;31.05.2024 06:16:33 ;CashBack:0 EUR",Platba kartou,,
109,,2024-06-02,-0.25,EUR,Poplatok za platbu kartou,Poplatok za kartovú transakciu,,
110,,2024-06-02,-800.0,EUR,"B1819741714-44544 17** **** 6401;FACEBK *LPAEP4QCE2 ,fb.me/ads ,IE ;31.05.2024 14:43:07 ;CashBack:0 EUR",Platba kartou,,
111,,2024-06-01,-0.25,EUR,Poplatok za platbu kartou,Poplatok za kartovú transakciu,,
112,,2024-06-01,-800.0,EUR,"B1819008685-44544 17** **** 6401;FACEBK *2KWZW4LCE2 ,fb.me/ads ,IE ;30.05.2024 19:02:58 ;CashBack:0 EUR",Platba kartou,,
113,,2024-06-01,-0.25,EUR,Poplatok za platbu kartou,Poplatok za kartovú transakciu,,
114,,2024-06-01,-800.0,EUR,"B1818959404-44544 17** **** 6401;FACEBK* ,fb.me/ads ,IE ;30.05.2024 09:51:39 ;CashBack:0 EUR",Platba kartou,,
115,,2024-05-31,-5.0,EUR,Zverejňovanie účtu,Poplatok,,
116,,2024-05-31,-5.0,EUR,Poplatok za vedenie účtu,Poplatok,,
117,creo,2024-05-31,-61200.0,EUR,tlač a distribúcia novín celá SR,Okamžitá platba (EB),232405012.0,
118,redpost,2024-05-31,-2135.33,EUR,"Distribúcia letákov NR, PO",Okamžitá platba (EB),2024025.0,
119,,2024-05-31,-0.25,EUR,Poplatok za platbu kartou,Poplatok za kartovú transakciu,,
120,,2024-05-31,-800.0,EUR,"B1818147844-44544 17** **** 6401;FACEBK* ,fb.me/ads ,IE ;29.05.2024 20:33:58 ;CashBack:0 EUR",Platba kartou,,
121,,2024-05-31,-0.25,EUR,Poplatok za platbu kartou,Poplatok za kartovú transakciu,,
122,,2024-05-31,-800.0,EUR,"B1818038825-44544 17** **** 6401;FACEBK* ,fb.me/ads ,IE ;29.05.2024 11:52:14 ;CashBack:0 EUR",Platba kartou,,
123,,2024-05-31,-0.25,EUR,Poplatok za platbu kartou,Poplatok za kartovú transakciu,,
124,,2024-05-31,-800.0,EUR,"B1818040542-44544 17** **** 6401;FACEBK *VQURM4GCE2 ,fb.me/ads ,IE ;29.05.2024 21:00:59 ;CashBack:0 EUR",Platba kartou,,
125,,2024-05-30,-0.25,EUR,Poplatok za platbu kartou,Poplatok za kartovú transakciu,,
126,,2024-05-30,-800.0,EUR,"B1817216864-44544 17** **** 6401;FACEBK* ,fb.me/ads ,IE ;28.05.2024 21:15:45 ;CashBack:0 EUR",Platba kartou,,
127,,2024-05-30,-0.25,EUR,Poplatok za platbu kartou,Poplatok za kartovú transakciu,,
128,,2024-05-30,-800.0,EUR,"B1817172873-44544 17** **** 6401;FACEBK* ,fb.me/ads ,IE ;28.05.2024 07:57:28 ;CashBack:0 EUR",Platba kartou,,
129,,2024-05-30,-0.25,EUR,Poplatok za platbu kartou,Poplatok za kartovú transakciu,,
130,,2024-05-30,-800.0,EUR,"B1817180042-44544 17** **** 6401;FACEBK *CA78S44CE2 ,fb.me/ads ,IE ;28.05.2024 18:20:05 ;CashBack:0 EUR",Platba kartou,,
131,profiekonet,2024-05-29,-720.0,EUR,"Reklama vo vytahoch maj , Prešov",Okamžitá platba (EB),20240086.0,0.0
132,,2024-05-29,-0.25,EUR,Poplatok za platbu kartou,Poplatok za kartovú transakciu,,
133,,2024-05-29,-800.0,EUR,"B1816327730-44544 17** **** 6401;FACEBK* ,fb.me/ads ,IE ;27.05.2024 14:08:43 ;CashBack:0 EUR",Platba kartou,,
134,redpost,2024-05-28,-2825.47,EUR,Disteibúcia letákov Prešov,Okamžitá platba (EB),2024023.0,
135,,2024-05-27,-0.25,EUR,Poplatok za platbu kartou,Poplatok za kartovú transakciu,,
136,,2024-05-27,-5000.0,EUR,"B1816215979-44544 17** **** 6401;GOOGLE *ADS2821367403 ,G.CO/HELPPAY# ,IE ;27.05.2024 03:03:35 ;CashBack:0 EUR",Platba kartou,,
137,,2024-05-27,-0.25,EUR,Poplatok za platbu kartou,Poplatok za kartovú transakciu,,
138,,2024-05-27,-800.0,EUR,"B1815820169-44544 17** **** 6401;FACEBK* ,fb.me/ads ,IE ;26.05.2024 19:56:53 ;CashBack:0 EUR",Platba kartou,,
139,,2024-05-26,-0.25,EUR,Poplatok za platbu kartou,Poplatok za kartovú transakciu,,
140,,2024-05-26,-800.0,EUR,"B1815093966-44544 17** **** 6401;FACEBK* ,fb.me/ads ,IE ;25.05.2024 23:25:40 ;CashBack:0 EUR",Platba kartou,,
141,,2024-05-26,-0.25,EUR,Poplatok za platbu kartou,Poplatok za kartovú transakciu,,
142,,2024-05-26,-800.0,EUR,"B1815089609-44544 17** **** 6401;FACEBK *NNT2E58CE2 ,fb.me/ads ,IE ;25.05.2024 21:22:54 ;CashBack:0 EUR",Platba kartou,,
143,,2024-05-26,-0.25,EUR,Poplatok za platbu kartou,Poplatok za kartovú transakciu,,
144,,2024-05-26,-798.74,EUR,"B1814916370-44544 17** **** 6401;FACEBK* ,fb.me/ads ,IE ;25.05.2024 07:57:37 ;CashBack:0 EUR",Platba kartou,,
145,,2024-05-25,-0.25,EUR,Poplatok za platbu kartou,Poplatok za kartovú transakciu,,
146,,2024-05-25,-800.0,EUR,"B1814092789-44544 17** **** 6401;FACEBK* ,fb.me/ads ,IE ;24.05.2024 17:45:52 ;CashBack:0 EUR",Platba kartou,,
147,,2024-05-25,-0.25,EUR,Poplatok za platbu kartou,Poplatok za kartovú transakciu,,
148,,2024-05-25,-800.0,EUR,"B1814015527-44544 17** **** 6401;FACEBK *HGQ8H54DE2 ,fb.me/ads ,IE ;24.05.2024 10:46:35 ;CashBack:0 EUR",Platba kartou,,
149,,2024-05-24,-0.25,EUR,Poplatok za platbu kartou,Poplatok za kartovú transakciu,,
150,,2024-05-24,-800.0,EUR,"B1813324067-44544 17** **** 6401;FACEBK* ,fb.me/ads ,IE ;23.05.2024 23:05:12 ;CashBack:0 EUR",Platba kartou,,
151,,2024-05-24,-0.25,EUR,Poplatok za platbu kartou,Poplatok za kartovú transakciu,,
152,,2024-05-24,-800.0,EUR,"B1813259072-44544 17** **** 6401;FACEBK* ,fb.me/ads ,IE ;23.05.2024 12:02:18 ;CashBack:0 EUR",Platba kartou,,
153,,2024-05-23,-0.25,EUR,Poplatok za platbu kartou,Poplatok za kartovú transakciu,,
154,,2024-05-23,-800.0,EUR,"B1812259018-44544 17** **** 6401;FACEBK* ,fb.me/ads ,IE ;22.05.2024 17:20:06 ;CashBack:0 EUR",Platba kartou,,
155,,2024-05-23,-0.25,EUR,Poplatok za platbu kartou,Poplatok za kartovú transakciu,,
156,,2024-05-23,-800.0,EUR,"B1811576873-44544 17** **** 6401;FACEBK* ,fb.me/ads ,IE ;21.05.2024 21:33:01 ;CashBack:0 EUR",Platba kartou,,
157,,2024-05-20,-0.25,EUR,Poplatok za platbu kartou,Poplatok za kartovú transakciu,,
158,,2024-05-20,-493.89,EUR,"B1809940904-44544 17** **** 6401;FACEBK* ,fb.me/ads ,IE ;19.05.2024 07:27:32 ;CashBack:0 EUR",Platba kartou,,
159,,2024-05-17,-0.25,EUR,Poplatok za platbu kartou,Poplatok za kartovú transakciu,,
160,,2024-05-17,-231.62,EUR,"B1807330215-44544 17** **** 6401;FACEBK* ,fb.me/ads ,IE ;16.05.2024 07:12:31 ;CashBack:0 EUR",Platba kartou,,
161,,2024-05-17,-0.25,EUR,Poplatok za platbu kartou,Poplatok za kartovú transakciu,,
162,,2024-05-17,-800.0,EUR,"B1806185370-44544 17** **** 6401;FACEBK* ,fb.me/ads ,IE ;15.05.2024 17:55:15 ;CashBack:0 EUR",Platba kartou,,
163,,2024-05-16,-800.0,EUR,"B1805418147-44544 17** **** 6401;FACEBK* ,fb.me/ads ,IE ;14.05.2024 22:57:14 ;CashBack:0 EUR",Platba kartou,,
164,,2024-05-16,-0.25,EUR,Poplatok za platbu kartou,Poplatok za kartovú transakciu,,
165,,2024-05-16,-0.25,EUR,Poplatok za platbu kartou,Poplatok za kartovú transakciu,,
166,,2024-05-16,-800.0,EUR,"B1805344765-44544 17** **** 6401;FACEBK* ,fb.me/ads ,IE ;14.05.2024 06:02:42 ;CashBack:0 EUR",Platba kartou,,
167,Creo,2024-05-14,-37068.0,EUR,PR spolupraca printove media,Okamžitá platba (EB),232405009.0,
168,Creo,2024-05-14,-53052.0,EUR,PR spolupraca v online mediach,Okamžitá platba (EB),232405008.0,
169,,2024-05-13,-0.25,EUR,Poplatok za platbu kartou,Poplatok za kartovú transakciu,,
170,,2024-05-13,-800.0,EUR,"B1804275708-44544 17** **** 6401;FACEBK* ,fb.me/ads ,IE ;13.05.2024 05:33:56 ;CashBack:0 EUR",Platba kartou,,
171,marek dinis design,2024-05-13,-783.0,EUR,Letak A5 tlac Presov,Platobný príkaz na úhradu / FIT 2.0 (EB),2024041.0,
172,redpost,2024-05-13,-1136.62,EUR,Distribucia letakov Prešov,Okamžitá platba (EB),2442024.0,
173,profiekonet,2024-05-13,-720.0,EUR,"Reklama vo vytahoch , Prešov",Okamžitá platba (EB),20240072.0,0.0
174,,2024-05-12,-0.25,EUR,Poplatok za platbu kartou,Poplatok za kartovú transakciu,,
175,,2024-05-12,-800.0,EUR,"B1802955664-44544 17** **** 6401;FACEBK* ,fb.me/ads ,IE ;11.05.2024 13:34:24 ;CashBack:0 EUR",Platba kartou,,
176,,2024-05-12,-0.25,EUR,Poplatok za platbu kartou,Poplatok za kartovú transakciu,,
177,,2024-05-12,-800.0,EUR,"B1802568427-44544 17** **** 6401;FACEBK* ,fb.me/ads ,IE ;11.05.2024 05:24:31 ;CashBack:0 EUR",Platba kartou,,
178,,2024-05-10,-0.25,EUR,Poplatok za platbu kartou,Poplatok za kartovú transakciu,,
179,,2024-05-10,-800.0,EUR,"B1800909946-44544 17** **** 6401;FACEBK* ,fb.me/ads ,IE ;09.05.2024 07:00:26 ;CashBack:0 EUR",Platba kartou,,
180,Creo,2024-05-10,-10200.0,EUR,Kampanovy tim a sprava soc. Sieti,Okamžitá platba (EB),232405003.0,
181,Creo,2024-05-10,-22512.0,EUR,Dizajn a produkcia merkantilu,Okamžitá platba (EB),232405007.0,
182,Creo,2024-05-10,-82680.0,EUR,"VS:232405006,ooh kamp.marec + april",Okamžitá platba (EB),232405006.0,
183,NOTPROVIDED,2024-05-10,-92280.0,EUR,VS:232405005 prieskum a analyza tem,Okamžitá platba (EB),232405005.0,
184,Creo,2024-05-10,-34200.0,EUR,"VS232405004, strategia kampane",Okamžitá platba (EB),232405004.0,
185,,2024-05-09,-0.25,EUR,Poplatok za platbu kartou,Poplatok za kartovú transakciu,,
186,,2024-05-09,-800.0,EUR,"B1800546561-44544 17** **** 6401;FACEBK* ,fb.me/ads ,IE ;08.05.2024 06:56:26 ;CashBack:0 EUR",Platba kartou,,
187,,2024-05-07,-0.25,EUR,Poplatok za platbu kartou,Poplatok za kartovú transakciu,,
188,,2024-05-07,-800.0,EUR,"B1799402525-44544 17** **** 6401;FACEBK* ,fb.me/ads ,IE ;07.05.2024 00:47:05 ;CashBack:0 EUR",Platba kartou,,
189,,2024-05-06,-0.25,EUR,Poplatok za platbu kartou,Poplatok za kartovú transakciu,,
190,,2024-05-06,-800.0,EUR,"B1798182828-44544 17** **** 6401;FACEBK* ,fb.me/ads ,IE ;05.05.2024 22:45:27 ;CashBack:0 EUR",Platba kartou,,
191,,2024-05-05,-800.0,EUR,"B1796588231-44544 17** **** 6401;FACEBK* ,fb.me/ads ,IE ;03.05.2024 19:15:21 ;CashBack:0 EUR",Platba kartou,,
192,,2024-05-05,-0.25,EUR,Poplatok za platbu kartou,Poplatok za kartovú transakciu,,
193,,2024-05-05,-0.25,EUR,Poplatok za platbu kartou,Poplatok za kartovú transakciu,,
194,,2024-05-05,-800.0,EUR,"B1796525522-44544 17** **** 6401;FACEBK* ,fb.me/ads ,IE ;03.05.2024 18:14:03 ;CashBack:0 EUR",Platba kartou,,
195,,2024-05-02,-0.25,EUR,Poplatok za platbu kartou,Poplatok za kartovú transakciu,,
196,,2024-05-02,-234.62,EUR,"B1795157629-44544 17** **** 6401;GOOGLE *ADS2821367403 ,G.CO/HELPPAY# ,IE ;01.05.2024 18:22:24 ;CashBack:0 EUR",Platba kartou,,
197,,2024-05-02,-0.25,EUR,Poplatok za platbu kartou,Poplatok za kartovú transakciu,,
198,,2024-05-02,-720.0,EUR,"B1795154372-44544 17** **** 6401;FACEBK *RCM5P3LCE2 ,fb.me/ads ,IE ;01.05.2024 12:53:18 ;CashBack:0 EUR",Platba kartou,,
199,,2024-05-02,-0.25,EUR,Poplatok za platbu kartou,Poplatok za kartovú transakciu,,
200,,2024-05-02,-800.0,EUR,"B1795147019-44544 17** **** 6401;FACEBK* ,fb.me/ads ,IE ;01.05.2024 08:07:42 ;CashBack:0 EUR",Platba kartou,,
201,,2024-04-30,-5.0,EUR,Zverejňovanie účtu,Poplatok,,
202,,2024-04-30,-5.0,EUR,Poplatok za vedenie účtu,Poplatok,,
203,,2024-04-30,-0.25,EUR,Poplatok za platbu kartou,Poplatok za kartovú transakciu,,
204,,2024-04-30,-480.0,EUR,"B1793366452-44544 17** **** 6401;FACEBK *DX4GC3GCE2 ,fb.me/ads ,IE ;29.04.2024 12:30:23 ;CashBack:0 EUR",Platba kartou,,
205,,2024-04-29,-0.25,EUR,Poplatok za platbu kartou,Poplatok za kartovú transakciu,,
206,,2024-04-29,-800.0,EUR,"B1792827085-44544 17** **** 6401;FACEBK* ,fb.me/ads ,IE ;28.04.2024 20:38:06 ;CashBack:0 EUR",Platba kartou,,
207,,2024-04-29,-0.25,EUR,Poplatok za platbu kartou,Poplatok za kartovú transakciu,,
208,,2024-04-29,-320.0,EUR,"B1792752765-44544 17** **** 6401;FACEBK *8HQKR2UCE2 ,fb.me/ads ,IE ;28.04.2024 04:36:10 ;CashBack:0 EUR",Platba kartou,,
209,,2024-04-28,-210.0,EUR,"B1792092459-44544 17** **** 6401;FACEBK *FHL593QCE2 ,fb.me/ads ,IE ;27.04.2024 09:06:43 ;CashBack:0 EUR",Platba kartou,,
210,,2024-04-28,-0.25,EUR,Poplatok za platbu kartou,Poplatok za kartovú transakciu,,
211,,2024-04-28,-0.25,EUR,Poplatok za platbu kartou,Poplatok za kartovú transakciu,,
212,,2024-04-28,-140.0,EUR,"B1791232528-44544 17** **** 6401;FACEBK *LK75F34CE2 ,fb.me/ads ,IE ;26.04.2024 18:28:35 ;CashBack:0 EUR",Platba kartou,,
213,,2024-04-28,-0.25,EUR,Poplatok za platbu kartou,Poplatok za kartovú transakciu,,
214,,2024-04-28,-90.0,EUR,"B1791064020-44544 17** **** 6401;FACEBK *36E7A44DE2 ,fb.me/ads ,IE ;26.04.2024 08:55:44 ;CashBack:0 EUR",Platba kartou,,
215,,2024-04-26,-0.25,EUR,Poplatok za platbu kartou,Poplatok za kartovú transakciu,,
216,,2024-04-26,-70.0,EUR,"B1790615875-44544 17** **** 6401;FACEBK *FUYVB3CCE2 ,fb.me/ads ,IE ;25.04.2024 22:58:47 ;CashBack:0 EUR",Platba kartou,,
217,,2024-04-26,-0.25,EUR,Poplatok za platbu kartou,Poplatok za kartovú transakciu,,
218,,2024-04-26,-40.0,EUR,"B1790198744-44544 17** **** 6401;FACEBK *BXPDB3CCE2 ,fb.me/ads ,IE ;25.04.2024 14:08:09 ;CashBack:0 EUR",Platba kartou,,
219,,2024-04-26,-0.25,EUR,Poplatok za platbu kartou,Poplatok za kartovú transakciu,,
220,,2024-04-26,-33.0,EUR,"B1790194180-44544 17** **** 6401;FACEBK *QK58B3CCE2 ,fb.me/ads ,IE ;25.04.2024 10:53:22 ;CashBack:0 EUR",Platba kartou,,
221,,2024-04-26,-0.25,EUR,Poplatok za platbu kartou,Poplatok za kartovú transakciu,,
222,,2024-04-26,-33.0,EUR,"B1790193567-44544 17** **** 6401;FACEBK *NBMWM2UCE2 ,fb.me/ads ,IE ;25.04.2024 08:30:53 ;CashBack:0 EUR",Platba kartou,,
223,,2024-04-26,-0.25,EUR,Poplatok za platbu kartou,Poplatok za kartovú transakciu,,
224,,2024-04-26,-70.0,EUR,"B1790162410-44544 17** **** 6401;FACEBK *CYY7448CE2 ,fb.me/ads ,IE ;25.04.2024 19:52:06 ;CashBack:0 EUR",Platba kartou,,
225,,2024-04-26,-0.25,EUR,Poplatok za platbu kartou,Poplatok za kartovú transakciu,,
226,,2024-04-26,-33.0,EUR,"B1790162299-44544 17** **** 6401;FACEBK *QNDLJ3YCE2 ,fb.me/ads ,IE ;25.04.2024 06:39:31 ;CashBack:0 EUR",Platba kartou,,
227,,2024-04-25,-0.25,EUR,Poplatok za platbu kartou,Poplatok za kartovú transakciu,,
228,,2024-04-25,-33.0,EUR,"B1789774946-44544 17** **** 6401;FACEBK *G78F844DE2 ,fb.me/ads ,IE ;25.04.2024 01:49:07 ;CashBack:0 EUR",Platba kartou,,
229,,2024-04-25,-0.25,EUR,Poplatok za platbu kartou,Poplatok za kartovú transakciu,,
230,,2024-04-25,-30.0,EUR,"B1789774939-44544 17** **** 6401;FACEBK *UHHSC34CE2 ,fb.me/ads ,IE ;25.04.2024 00:09:42 ;CashBack:0 EUR",Platba kartou,,
231,,2024-04-25,-0.25,EUR,Poplatok za platbu kartou,Poplatok za kartovú transakciu,,
232,,2024-04-25,-22.0,EUR,"B1789774930-44544 17** **** 6401;FACEBK *N396J3YCE2 ,fb.me/ads ,IE ;24.04.2024 22:06:02 ;CashBack:0 EUR",Platba kartou,,
233,,2024-04-25,-12.0,EUR,"B1789486527-44544 17** **** 6401;FACEBK *53WP53QCE2 ,fb.me/ads ,IE ;24.04.2024 19:21:55 ;CashBack:0 EUR",Platba kartou,,
234,,2024-04-25,-0.25,EUR,Poplatok za platbu kartou,Poplatok za kartovú transakciu,,
235,,2024-04-25,-10.0,EUR,"B1789486522-44544 17** **** 6401;FACEBK *J7LN53QCE2 ,fb.me/ads ,IE ;24.04.2024 18:40:50 ;CashBack:0 EUR",Platba kartou,,
236,,2024-04-25,-0.25,EUR,Poplatok za platbu kartou,Poplatok za kartovú transakciu,,
237,,2024-04-25,-9.0,EUR,"B1789486519-44544 17** **** 6401;FACEBK *D7EDE3LCE2 ,fb.me/ads ,IE ;24.04.2024 18:20:30 ;CashBack:0 EUR",Platba kartou,,
238,,2024-04-25,-0.25,EUR,Poplatok za platbu kartou,Poplatok za kartovú transakciu,,
239,,2024-04-25,-9.0,EUR,"B1789486514-44544 17** **** 6401;FACEBK *XCMZ744DE2 ,fb.me/ads ,IE ;24.04.2024 18:10:22 ;CashBack:0 EUR",Platba kartou,,
240,,2024-04-25,-0.25,EUR,Poplatok za platbu kartou,Poplatok za kartovú transakciu,,
241,,2024-04-25,-9.0,EUR,"B1789486512-44544 17** **** 6401;FACEBK *J4LWH3YCE2 ,fb.me/ads ,IE ;24.04.2024 18:00:13 ;CashBack:0 EUR",Platba kartou,,
242,,2024-04-25,-0.25,EUR,Poplatok za platbu kartou,Poplatok za kartovú transakciu,,
243,,2024-04-25,-9.0,EUR,"B1789486510-44544 17** **** 6401;FACEBK *MSQAA3CCE2 ,fb.me/ads ,IE ;24.04.2024 17:21:41 ;CashBack:0 EUR",Platba kartou,,
244,,2024-04-25,-0.25,EUR,Poplatok za platbu kartou,Poplatok za kartovú transakciu,,
245,,2024-04-25,-9.0,EUR,"B1789485807-44544 17** **** 6401;FACEBK *Q55R248CE2 ,fb.me/ads ,IE ;24.04.2024 16:59:10 ;CashBack:0 EUR",Platba kartou,,
246,,2024-04-25,-0.25,EUR,Poplatok za platbu kartou,Poplatok za kartovú transakciu,,
247,,2024-04-25,-9.0,EUR,"B1789485801-44544 17** **** 6401;FACEBK *BPNV744DE2 ,fb.me/ads ,IE ;24.04.2024 16:03:41 ;CashBack:0 EUR",Platba kartou,,
248,,2024-04-25,-0.25,EUR,Poplatok za platbu kartou,Poplatok za kartovú transakciu,,
249,,2024-04-25,-20.0,EUR,"B1789486553-44544 17** **** 6401;FACEBK *APM4J3YCE2 ,fb.me/ads ,IE ;24.04.2024 21:13:21 ;CashBack:0 EUR",Platba kartou,,
250,,2024-04-25,-0.25,EUR,Poplatok za platbu kartou,Poplatok za kartovú transakciu,,
251,,2024-04-25,-20.0,EUR,"B1789486542-44544 17** **** 6401;FACEBK *YSF3J3YCE2 ,fb.me/ads ,IE ;24.04.2024 20:33:47 ;CashBack:0 EUR",Platba kartou,,
252,,2024-04-25,-0.25,EUR,Poplatok za platbu kartou,Poplatok za kartovú transakciu,,
253,,2024-04-25,-15.0,EUR,"B1789486537-44544 17** **** 6401;FACEBK *EZS4844DE2 ,fb.me/ads ,IE ;24.04.2024 19:51:33 ;CashBack:0 EUR",Platba kartou,,
254,,2024-04-25,-0.25,EUR,Poplatok za platbu kartou,Poplatok za kartovú transakciu,,
255,,2024-04-25,-12.0,EUR,"B1789486533-44544 17** **** 6401;FACEBK *L5M8M2UCE2 ,fb.me/ads ,IE ;24.04.2024 19:35:42 ;CashBack:0 EUR",Platba kartou,,
256,,2024-04-25,-0.25,EUR,Poplatok za platbu kartou,Poplatok za kartovú transakciu,,
257,,2024-04-25,-0.25,EUR,Poplatok za platbu kartou,Poplatok za kartovú transakciu,,
258,,2024-04-25,-331.79,EUR,"B1788501984-44544 17** **** 6401;FACEBK WJR453GCE2 ,fb.me/ads ,IE ;23.04.2024 17:31:16 ;CashBack:0 EUR",Platba kartou,,
259,HLAS - sociálna demokracia,2024-04-10,500000.0,EUR,prevod na voľby EP 2024,Bezhotovostný vklad,,