index,account_name,date,amount,currency,message,tx_type,vs,ss
0,MUW / SAATCHI & SAATCHI,2024-07-09,-31500.0,EUR,návrh a realizácia eurokampane,Platobný príkaz na úhradu / FIT 2.0 (EB),20240328.0,
1,,2024-07-02,-0.25,EUR,Poplatok za platbu kartou,Poplatok za kartovú transakciu,,
2,,2024-07-02,-369.05,EUR,"B1846051431-44544 17** **** 4298;GOOGLE *ADS4501982046 ,cc@google.com ,IE ;01.07.2024 15:51:06 ;CashBack:0 EUR",Platba kartou,,
3,,2024-06-30,-5.0,EUR,Zverejňovanie účtu,Poplatok,,
4,,2024-06-30,-5.0,EUR,Poplatok za vedenie účtu,Poplatok,,
5,,2024-06-30,-3.5,EUR,"Vedenie Platobnej karty embosovanej,2315,5,Karta č. 4544 17** **** 5827Poplatok za Platobnú kartu",Kartový poplatok,,
6,CityRent s.r.o.,2024-06-24,-138.0,EUR,výlep plagátov,Platobný príkaz na úhradu / FIT 2.0 (EB),4240047.0,
7,DomaReal s.r.o.,2024-06-24,-205.0,EUR,výlep plagátov,Platobný príkaz na úhradu / FIT 2.0 (EB),20240603.0,
8,SOZA,2024-06-20,-924.0,EUR,licencia,Platobný príkaz na úhradu / FIT 2.0 (EB),,
9,AVANK s.r.o.,2024-06-20,-225.0,EUR,marketingové služby,Platobný príkaz na úhradu / FIT 2.0 (EB),102024.0,
10,Ing. Zuzana Paverová,2024-06-20,-180.0,EUR,výlep plagátov,Platobný príkaz na úhradu / FIT 2.0 (EB),324.0,
11,Mesto Košice,2024-06-19,-300.0,EUR,daň za zabratie priestranstva,Platobný príkaz na úhradu / FIT 2.0 (EB),3324000607.0,
12,M.E.G.A. Solution,2024-06-19,-125.1,EUR,propagačné práce,Platobný príkaz na úhradu / FIT 2.0 (EB),1020240072.0,
13,GeCom s.r.o.,2024-06-19,-90.0,EUR,distribúcia letákov,Platobný príkaz na úhradu / FIT 2.0 (EB),2024400031.0,
14,Edumood s.r.o.,2024-06-19,-468.0,EUR,výlep plagátov,Platobný príkaz na úhradu / FIT 2.0 (EB),20240007.0,
15,WIDGET s.r.o.,2024-06-19,-75.0,EUR,reklamné služby,Platobný príkaz na úhradu / FIT 2.0 (EB),2024011.0,
16,"Josef Zbořil, Ing.",2024-06-19,-200.0,EUR,"konzultácie, prezentácia",Platobný príkaz na úhradu / FIT 2.0 (EB),,
17,New School Communications,2024-06-14,-3750.0,EUR,správa online kampane,Platobný príkaz na úhradu / FIT 2.0 (EB),2024265.0,
18,Enforb s.r.o.,2024-06-14,-1200.0,EUR,moderovanie,Platobný príkaz na úhradu / FIT 2.0 (EB),240100018.0,
19,HYPO REAL SERVIS s.r.o.,2024-06-14,-240.0,EUR,propagačná činnosť,Platobný príkaz na úhradu / FIT 2.0 (EB),202401.0,
20,sound area s.r.o.,2024-06-14,-150.0,EUR,výlep plagátov,Platobný príkaz na úhradu / FIT 2.0 (EB),22400002.0,
21,Mesto Banská Bystrica,2024-06-14,-750.0,EUR,daň za zabratie priestranstva,Platobný príkaz na úhradu / FIT 2.0 (EB),5010309892.0,2403051054.0
22,,2024-06-13,-0.25,EUR,Poplatok za platbu kartou,Poplatok za kartovú transakciu,,
23,,2024-06-13,-751.74,EUR,"B1828465006-44544 17** **** 4298;FACEBK *63UQU2CB92 ,fb.me/ads ,IE ;11.06.2024 15:42:48 ;CashBack:0 EUR",Platba kartou,,
24,,2024-06-13,-0.25,EUR,Poplatok za platbu kartou,Poplatok za kartovú transakciu,,
25,,2024-06-13,-17.0,EUR,"B1828459721-44544 17** **** 4298;FACEBK *JJAJ43UB92 ,fb.me/ads ,IE ;11.06.2024 15:40:21 ;CashBack:0 EUR",Platba kartou,,
26,,2024-06-13,-0.25,EUR,Poplatok za platbu kartou,Poplatok za kartovú transakciu,,
27,,2024-06-13,-8.4,EUR,"B1828439027-44544 17** **** 4298;FACEBK *PEJWM28B92 ,fb.me/ads ,IE ;11.06.2024 15:42:07 ;CashBack:0 EUR",Platba kartou,,
28,,2024-06-13,-0.25,EUR,Poplatok za platbu kartou,Poplatok za kartovú transakciu,,
29,,2024-06-13,-0.03,EUR,"B1828392675-44544 17** **** 4298;FACEBK *VQHWM28B92 ,fb.me/ads ,IE ;11.06.2024 15:41:29 ;CashBack:0 EUR",Platba kartou,,
30,,2024-06-13,-0.25,EUR,Poplatok za platbu kartou,Poplatok za kartovú transakciu,,
31,,2024-06-13,-44.35,EUR,"B1828392673-44544 17** **** 4298;FACEBK *P7FQG2QB92 ,fb.me/ads ,IE ;11.06.2024 15:39:25 ;CashBack:0 EUR",Platba kartou,,
32,Mesto Poprad,2024-06-12,-65.0,EUR,daň za zabratie priestranstva,Platobný príkaz na úhradu / FIT 2.0 (EB),2020408048.0,
33,Imagination Development,2024-06-12,-170.0,EUR,plagáty výlep,Platobný príkaz na úhradu / FIT 2.0 (EB),20240001.0,
34,EURO KONTO s.r.o.,2024-06-12,-258.0,EUR,výlep plagátov,Platobný príkaz na úhradu / FIT 2.0 (EB),24016.0,
35,euroAWK spol. s.r.o.,2024-06-12,-2247.0,EUR,CLV 35 ks,Platobný príkaz na úhradu / FIT 2.0 (EB),242795.0,
36,Matúš Chovan,2024-06-12,-220.0,EUR,videá,Platobný príkaz na úhradu / FIT 2.0 (EB),20240007.0,
37,Matúš Chovan,2024-06-12,-240.0,EUR,videá,Platobný príkaz na úhradu / FIT 2.0 (EB),20240006.0,
38,Mestské lesy v Bratislave,2024-06-12,-1800.0,EUR,prenájom amfiteátra,Platobný príkaz na úhradu / FIT 2.0 (EB),2024060205.0,
39,Ing. Silvia Mazán - DEEM Design,2024-06-10,-615.0,EUR,reklamné služby,Platobný príkaz na úhradu / FIT 2.0 (EB),20240601.0,
40,Stefan Beig,2024-06-10,-381.6,EUR,"1/2024, moderovanie",Platobný príkaz na úhradu / FIT 2.0 (EB),,
41,Art spektrum s.r.o.,2024-06-10,-850.0,EUR,výroba streamov,Platobný príkaz na úhradu / FIT 2.0 (EB),202437.0,
42,Matúš Chovan,2024-06-10,-120.0,EUR,videá,Platobný príkaz na úhradu / FIT 2.0 (EB),20240015.0,
43,Matúš Chovan,2024-06-10,-200.0,EUR,videá,Platobný príkaz na úhradu / FIT 2.0 (EB),20240010.0,
44,Matúš Chovan,2024-06-10,-460.0,EUR,videá,Platobný príkaz na úhradu / FIT 2.0 (EB),20240016.0,
45,Matúš Chovan,2024-06-10,-260.0,EUR,videá,Platobný príkaz na úhradu / FIT 2.0 (EB),20240013.0,
46,,2024-06-09,-0.25,EUR,Poplatok za platbu kartou,Poplatok za kartovú transakciu,,
47,,2024-06-09,-8.98,EUR,"B1825212240-44544 17** **** 4298;FACEBK *5BX3K3YA92 ,fb.me/ads ,IE ;07.06.2024 12:26:55 ;CashBack:0 EUR",Platba kartou,,
48,,2024-06-07,-0.25,EUR,Poplatok za platbu kartou,Poplatok za kartovú transakciu,,
49,,2024-06-07,-143.71,EUR,"B1824421410-44544 17** **** 4298;FACEBK *WSMK92QB92 ,fb.me/ads ,IE ;06.06.2024 06:59:20 ;CashBack:0 EUR",Platba kartou,,
50,,2024-06-06,-0.25,EUR,Poplatok za platbu kartou,Poplatok za kartovú transakciu,,
51,,2024-06-06,-617.77,EUR,"B1823552120-44544 17** **** 4298;GoogleAdwordsEU ADS450198 ,Dublin ,IE ;05.06.2024 08:03:41 ;CashBack:0 EUR",Platba kartou,,
52,,2024-06-06,-22.0,EUR,"B1823539903-44544 17** **** 4298;FACEBK *9WYM82QB92 ,fb.me/ads ,IE ;05.06.2024 16:02:13 ;CashBack:0 EUR",Platba kartou,,
53,,2024-06-06,-18.0,EUR,"B1823539901-44544 17** **** 4298;FACEBK *YCNPF24B92 ,fb.me/ads ,IE ;05.06.2024 15:52:05 ;CashBack:0 EUR",Platba kartou,,
54,,2024-06-06,-0.25,EUR,Poplatok za platbu kartou,Poplatok za kartovú transakciu,,
55,,2024-06-06,-0.25,EUR,Poplatok za platbu kartou,Poplatok za kartovú transakciu,,
56,,2024-06-06,-15.0,EUR,"B1823539899-44544 17** **** 4298;FACEBK *JB3DD28B92 ,fb.me/ads ,IE ;05.06.2024 15:41:57 ;CashBack:0 EUR",Platba kartou,,
57,,2024-06-06,-0.25,EUR,Poplatok za platbu kartou,Poplatok za kartovú transakciu,,
58,,2024-06-06,-12.0,EUR,"B1823539895-44544 17** **** 4298;FACEBK *G8PZ43UA92 ,fb.me/ads ,IE ;05.06.2024 15:31:48 ;CashBack:0 EUR",Platba kartou,,
59,,2024-06-06,-0.25,EUR,Poplatok za platbu kartou,Poplatok za kartovú transakciu,,
60,,2024-06-06,-12.0,EUR,"B1823539893-44544 17** **** 4298;FACEBK *LZ9A43GB92 ,fb.me/ads ,IE ;05.06.2024 15:21:39 ;CashBack:0 EUR",Platba kartou,,
61,,2024-06-06,-0.25,EUR,Poplatok za platbu kartou,Poplatok za kartovú transakciu,,
62,,2024-06-06,-10.0,EUR,"B1823539890-44544 17** **** 4298;FACEBK *ZNYY43UA92 ,fb.me/ads ,IE ;05.06.2024 15:11:29 ;CashBack:0 EUR",Platba kartou,,
63,,2024-06-06,-0.25,EUR,Poplatok za platbu kartou,Poplatok za kartovú transakciu,,
64,,2024-06-06,-9.0,EUR,"B1823539888-44544 17** **** 4298;FACEBK *B8SBD28B92 ,fb.me/ads ,IE ;05.06.2024 15:01:19 ;CashBack:0 EUR",Platba kartou,,
65,,2024-06-06,-0.25,EUR,Poplatok za platbu kartou,Poplatok za kartovú transakciu,,
66,,2024-06-06,-8.0,EUR,"B1823539886-44544 17** **** 4298;FACEBK *MLWGL2CB92 ,fb.me/ads ,IE ;05.06.2024 14:51:06 ;CashBack:0 EUR",Platba kartou,,
67,,2024-06-06,-0.25,EUR,Poplatok za platbu kartou,Poplatok za kartovú transakciu,,
68,,2024-06-06,-8.0,EUR,"B1823539882-44544 17** **** 4298;FACEBK *WRNTQ2LB92 ,fb.me/ads ,IE ;05.06.2024 14:40:57 ;CashBack:0 EUR",Platba kartou,,
69,,2024-06-06,-0.25,EUR,Poplatok za platbu kartou,Poplatok za kartovú transakciu,,
70,,2024-06-06,-6.0,EUR,"B1823539880-44544 17** **** 4298;FACEBK *ZVBFL2CB92 ,fb.me/ads ,IE ;05.06.2024 13:59:37 ;CashBack:0 EUR",Platba kartou,,
71,,2024-06-06,-0.25,EUR,Poplatok za platbu kartou,Poplatok za kartovú transakciu,,
72,,2024-06-06,-6.0,EUR,"B1823539874-44544 17** **** 4298;FACEBK *MRANQ2LB92 ,fb.me/ads ,IE ;05.06.2024 12:04:52 ;CashBack:0 EUR",Platba kartou,,
73,,2024-06-06,-0.25,EUR,Poplatok za platbu kartou,Poplatok za kartovú transakciu,,
74,,2024-06-06,-960.0,EUR,"B1823539873-44544 17** **** 4298;FACEBK *XMVS43UA92 ,fb.me/ads ,IE ;05.06.2024 12:00:35 ;CashBack:0 EUR",Platba kartou,,
75,,2024-06-06,-0.25,EUR,Poplatok za platbu kartou,Poplatok za kartovú transakciu,,
76,,2024-06-06,-5.0,EUR,"B1823539869-44544 17** **** 4298;FACEBK *NMCBL2CB92 ,fb.me/ads ,IE ;05.06.2024 11:54:43 ;CashBack:0 EUR",Platba kartou,,
77,,2024-06-06,-0.25,EUR,Poplatok za platbu kartou,Poplatok za kartovú transakciu,,
78,,2024-06-06,-4.0,EUR,"B1823539865-44544 17** **** 4298;FACEBK *JFWFF24B92 ,fb.me/ads ,IE ;05.06.2024 11:44:33 ;CashBack:0 EUR",Platba kartou,,
79,,2024-06-06,-0.25,EUR,Poplatok za platbu kartou,Poplatok za kartovú transakciu,,
80,,2024-06-06,-3.0,EUR,"B1823539858-44544 17** **** 4298;FACEBK *ZUGKQ2LB92 ,fb.me/ads ,IE ;05.06.2024 11:34:24 ;CashBack:0 EUR",Platba kartou,,
81,,2024-06-06,-0.25,EUR,Poplatok za platbu kartou,Poplatok za kartovú transakciu,,
82,,2024-06-06,-2.0,EUR,"B1823539855-44544 17** **** 4298;FACEBK *HQW243GB92 ,fb.me/ads ,IE ;05.06.2024 11:24:13 ;CashBack:0 EUR",Platba kartou,,
83,,2024-06-06,-0.25,EUR,Poplatok za platbu kartou,Poplatok za kartovú transakciu,,
84,,2024-06-06,-2.0,EUR,"B1823539848-44544 17** **** 4298;FACEBK *7WT2D28B92 ,fb.me/ads ,IE ;05.06.2024 11:14:06 ;CashBack:0 EUR",Platba kartou,,
85,,2024-06-06,-0.25,EUR,Poplatok za platbu kartou,Poplatok za kartovú transakciu,,
86,,2024-06-06,-2.0,EUR,"B1823539845-44544 17** **** 4298;FACEBK *XP9243GB92 ,fb.me/ads ,IE ;05.06.2024 11:03:58 ;CashBack:0 EUR",Platba kartou,,
87,,2024-06-06,-0.25,EUR,Poplatok za platbu kartou,Poplatok za kartovú transakciu,,
88,,2024-06-06,-2.0,EUR,"B1823539841-44544 17** **** 4298;FACEBK *MUDC82QB92 ,fb.me/ads ,IE ;05.06.2024 10:53:49 ;CashBack:0 EUR",Platba kartou,,
89,,2024-06-06,-0.25,EUR,Poplatok za platbu kartou,Poplatok za kartovú transakciu,,
90,,2024-06-06,-2.0,EUR,"B1823539837-44544 17** **** 4298;FACEBK *UNB8G3YA92 ,fb.me/ads ,IE ;05.06.2024 10:43:41 ;CashBack:0 EUR",Platba kartou,,
91,,2024-06-06,-0.25,EUR,Poplatok za platbu kartou,Poplatok za kartovú transakciu,,
92,,2024-06-06,-960.0,EUR,"B1823539833-44544 17** **** 4298;FACEBK *FP59L2CB92 ,fb.me/ads ,IE ;05.06.2024 10:41:05 ;CashBack:0 EUR",Platba kartou,,
93,,2024-06-06,-0.25,EUR,Poplatok za platbu kartou,Poplatok za kartovú transakciu,,
94,,2024-06-06,-2.0,EUR,"B1823539829-44544 17** **** 4298;FACEBK *THTB82QB92 ,fb.me/ads ,IE ;05.06.2024 10:33:33 ;CashBack:0 EUR",Platba kartou,,
95,,2024-06-06,-0.25,EUR,Poplatok za platbu kartou,Poplatok za kartovú transakciu,,
96,,2024-06-06,-212.0,EUR,"B1823539921-44544 17** **** 4298;FACEBK *RYTKG3YA92 ,fb.me/ads ,IE ;05.06.2024 16:45:35 ;CashBack:0 EUR",Platba kartou,,
97,,2024-06-06,-0.25,EUR,Poplatok za platbu kartou,Poplatok za kartovú transakciu,,
98,,2024-06-06,-2.0,EUR,"B1823539826-44544 17** **** 4298;FACEBK *VY3Z33GB92 ,fb.me/ads ,IE ;05.06.2024 10:23:25 ;CashBack:0 EUR",Platba kartou,,
99,,2024-06-06,-0.25,EUR,Poplatok za platbu kartou,Poplatok za kartovú transakciu,,
100,,2024-06-06,-2.0,EUR,"B1823539821-44544 17** **** 4298;FACEBK *FXE7G3YA92 ,fb.me/ads ,IE ;05.06.2024 10:13:18 ;CashBack:0 EUR",Platba kartou,,
101,,2024-06-06,-0.25,EUR,Poplatok za platbu kartou,Poplatok za kartovú transakciu,,
102,,2024-06-06,-27.0,EUR,"B1823539906-44544 17** **** 4298;FACEBK *FBAQF24B92 ,fb.me/ads ,IE ;05.06.2024 16:12:22 ;CashBack:0 EUR",Platba kartou,,
103,,2024-06-06,-0.25,EUR,Poplatok za platbu kartou,Poplatok za kartovú transakciu,,
104,,2024-06-06,-0.25,EUR,Poplatok za platbu kartou,Poplatok za kartovú transakciu,,
105,,2024-06-06,-2.0,EUR,"B1823539817-44544 17** **** 4298;FACEBK *UHUCF24B92 ,fb.me/ads ,IE ;05.06.2024 10:03:11 ;CashBack:0 EUR",Platba kartou,,
106,,2024-06-06,-0.25,EUR,Poplatok za platbu kartou,Poplatok za kartovú transakciu,,
107,,2024-06-06,-500.0,EUR,"B1823530973-44544 17** **** 4298;GOOGLE *ADS4501982046 ,cc@google.com ,IE ;05.06.2024 16:11:13 ;CashBack:0 EUR",Platba kartou,,
108,,2024-06-06,-0.25,EUR,Poplatok za platbu kartou,Poplatok za kartovú transakciu,,
109,,2024-06-06,-500.0,EUR,"B1823529481-44544 17** **** 4298;GOOGLE *ADS4501982046 ,cc@google.com ,IE ;05.06.2024 15:11:02 ;CashBack:0 EUR",Platba kartou,,
110,,2024-06-06,-0.25,EUR,Poplatok za platbu kartou,Poplatok za kartovú transakciu,,
111,,2024-06-06,-421.9,EUR,"B1823506593-44544 17** **** 4298;FACEBK *VL5ZT2UB92 ,fb.me/ads ,IE ;05.06.2024 08:08:09 ;CashBack:0 EUR",Platba kartou,,
112,Polygrafické centrum s.r.o.,2024-06-06,-363.48,EUR,dotlač plagátov 10 000 ks,Platobný príkaz na úhradu / FIT 2.0 (EB),1240369.0,
113,Ondrej Drozd - BLACKBIRD,2024-06-06,-4583.0,EUR,kameramanské práce 5/24,Platobný príkaz na úhradu / FIT 2.0 (EB),20240002.0,
114,Mário Vojtas BTD,2024-06-06,-400.0,EUR,výroba videozáznamu,Platobný príkaz na úhradu / FIT 2.0 (EB),202415.0,
115,,2024-06-06,-117.26,EUR,"B1823413793-44544 17** **** 5827;SHELL 8262 ,BAJKALSKA ,SK ;04.06.2024 09:18:25 ;CashBack:0 EUR",Platba kartou,,
116,,2024-06-06,-0.25,EUR,Poplatok za platbu kartou,Poplatok za kartovú transakciu,,
117,,2024-06-06,-0.25,EUR,Poplatok za platbu kartou,Poplatok za kartovú transakciu,,
118,,2024-06-06,-8.96,EUR,"B1823413620-44544 17** **** 5827;SHELL 8262 ,BAJKALSKA ,SK ;04.06.2024 09:19:13 ;CashBack:0 EUR",Platba kartou,,
119,,2024-06-06,-0.25,EUR,Poplatok za platbu kartou,Poplatok za kartovú transakciu,,
120,,2024-06-06,-120.0,EUR,"B1822930394-44544 17** **** 4298;FACEBK *QXJ243UA92 ,fb.me/ads ,IE ;04.06.2024 22:04:09 ;CashBack:0 EUR",Platba kartou,,
121,,2024-06-06,-0.25,EUR,Poplatok za platbu kartou,Poplatok za kartovú transakciu,,
122,,2024-06-06,-120.0,EUR,"B1822815299-44544 17** **** 4298;FACEBK *YPGME24B92 ,fb.me/ads ,IE ;04.06.2024 21:51:53 ;CashBack:0 EUR",Platba kartou,,
123,,2024-06-06,-0.25,EUR,Poplatok za platbu kartou,Poplatok za kartovú transakciu,,
124,,2024-06-06,-120.0,EUR,"B1822810221-44544 17** **** 4298;FACEBK *9ARBC28B92 ,fb.me/ads ,IE ;04.06.2024 21:58:23 ;CashBack:0 EUR",Platba kartou,,
125,,2024-06-06,-0.25,EUR,Poplatok za platbu kartou,Poplatok za kartovú transakciu,,
126,,2024-06-06,-32.4,EUR,"B1822773334-44544 17** **** 4298;FACEBK *P52LE24B92 ,fb.me/ads ,IE ;04.06.2024 21:05:26 ;CashBack:0 EUR",Platba kartou,,
127,,2024-06-06,-0.25,EUR,Poplatok za platbu kartou,Poplatok za kartovú transakciu,,
128,,2024-06-06,-26.4,EUR,"B1822773307-44544 17** **** 4298;FACEBK *WKJG72QB92 ,fb.me/ads ,IE ;04.06.2024 20:22:28 ;CashBack:0 EUR",Platba kartou,,
129,,2024-06-06,-0.25,EUR,Poplatok za platbu kartou,Poplatok za kartovú transakciu,,
130,,2024-06-06,-0.25,EUR,Poplatok za platbu kartou,Poplatok za kartovú transakciu,,
131,,2024-06-06,-14.4,EUR,"B1822741845-44544 17** **** 4298;FACEBK *67NTJ2CB92 ,fb.me/ads ,IE ;04.06.2024 10:27:13 ;CashBack:0 EUR",Platba kartou,,
132,,2024-06-06,-960.0,EUR,"B1822746949-44544 17** **** 4298;FACEBK *NPV7E24B92 ,fb.me/ads ,IE ;04.06.2024 14:28:06 ;CashBack:0 EUR",Platba kartou,,
133,,2024-06-06,-0.25,EUR,Poplatok za platbu kartou,Poplatok za kartovú transakciu,,
134,,2024-06-06,-960.0,EUR,"B1822745645-44544 17** **** 4298;FACEBK *88RRE3YA92 ,fb.me/ads ,IE ;04.06.2024 09:34:51 ;CashBack:0 EUR",Platba kartou,,
135,,2024-06-06,-0.25,EUR,Poplatok za platbu kartou,Poplatok za kartovú transakciu,,
136,,2024-06-06,-192.0,EUR,"B1822745142-44544 17** **** 4298;FACEBK *EMJH23GB92 ,fb.me/ads ,IE ;04.06.2024 09:11:00 ;CashBack:0 EUR",Platba kartou,,
137,,2024-06-06,-960.0,EUR,"B1822736709-44544 17** **** 4298;FACEBK *RJ69T2UB92 ,fb.me/ads ,IE ;04.06.2024 19:00:08 ;CashBack:0 EUR",Platba kartou,,
138,,2024-06-06,-0.25,EUR,Poplatok za platbu kartou,Poplatok za kartovú transakciu,,
139,,2024-06-06,-21.6,EUR,"B1822735351-44544 17** **** 4298;FACEBK *5YF5T2UB92 ,fb.me/ads ,IE ;04.06.2024 16:55:47 ;CashBack:0 EUR",Platba kartou,,
140,,2024-06-06,-0.25,EUR,Poplatok za platbu kartou,Poplatok za kartovú transakciu,,
141,,2024-06-06,-18.0,EUR,"B1822735226-44544 17** **** 4298;FACEBK *RJ5XS2UB92 ,fb.me/ads ,IE ;04.06.2024 13:35:15 ;CashBack:0 EUR",Platba kartou,,
142,,2024-06-06,-0.25,EUR,Poplatok za platbu kartou,Poplatok za kartovú transakciu,,
143,,2024-06-06,-48.0,EUR,"B1822732090-44544 17** **** 4298;FACEBK *HF9KF3YA92 ,fb.me/ads ,IE ;04.06.2024 22:49:21 ;CashBack:0 EUR",Platba kartou,,
144,,2024-06-06,-0.25,EUR,Poplatok za platbu kartou,Poplatok za kartovú transakciu,,
145,,2024-06-06,-0.25,EUR,Poplatok za platbu kartou,Poplatok za kartovú transakciu,,
146,,2024-06-06,-500.0,EUR,"B1822731910-44544 17** **** 4298;GOOGLE *ADS4501982046 ,cc@google.com ,IE ;04.06.2024 13:49:11 ;CashBack:0 EUR",Platba kartou,,
147,,2024-06-06,-500.0,EUR,"B1822737093-44544 17** **** 4298;GOOGLE *ADS4501982046 ,cc@google.com ,IE ;04.06.2024 20:47:03 ;CashBack:0 EUR",Platba kartou,,
148,,2024-06-06,-0.25,EUR,Poplatok za platbu kartou,Poplatok za kartovú transakciu,,
149,,2024-06-06,-39.6,EUR,"B1822731391-44544 17** **** 4298;FACEBK *JCWGK2CB92 ,fb.me/ads ,IE ;04.06.2024 21:48:52 ;CashBack:0 EUR",Platba kartou,,
150,,2024-06-06,-0.25,EUR,Poplatok za platbu kartou,Poplatok za kartovú transakciu,,
151,,2024-06-06,-120.0,EUR,"B1822731108-44544 17** **** 4298;FACEBK *Z4UJ72QB92 ,fb.me/ads ,IE ;04.06.2024 21:36:16 ;CashBack:0 EUR",Platba kartou,,
152,,2024-06-06,-0.25,EUR,Poplatok za platbu kartou,Poplatok za kartovú transakciu,,
153,,2024-06-06,-120.0,EUR,"B1822736803-44544 17** **** 4298;FACEBK *LF4K72QB92 ,fb.me/ads ,IE ;04.06.2024 21:44:58 ;CashBack:0 EUR",Platba kartou,,
154,,2024-06-06,-0.25,EUR,Poplatok za platbu kartou,Poplatok za kartovú transakciu,,
155,,2024-06-06,-0.25,EUR,Poplatok za platbu kartou,Poplatok za kartovú transakciu,,
156,,2024-06-06,-12.0,EUR,"B1822690280-44544 17** **** 4298;FACEBK *9SPJB28B92 ,fb.me/ads ,IE ;04.06.2024 07:48:15 ;CashBack:0 EUR",Platba kartou,,
157,,2024-06-06,-0.25,EUR,Poplatok za platbu kartou,Poplatok za kartovú transakciu,,
158,,2024-06-06,-960.0,EUR,"B1822664062-44544 17** **** 4298;FACEBK *T3YLJ2CB92 ,fb.me/ads ,IE ;04.06.2024 06:15:40 ;CashBack:0 EUR",Platba kartou,,
159,,2024-06-05,-5.0,EUR,"Zmena limitu na karte,2067,5,Karta č. 4544 17** **** 5827Poplatok za zmenu limitu karty",Kartový poplatok,,
160,Maros Mjartan,2024-06-05,-1.0,EUR,Drzim palceky ..,Platobný príkaz na úhradu / FIT 2.0 (EB),,
161,Bačák Juraj,2024-06-05,-0.01,EUR,Prispevok na drahy alkohol v Dubaji .,Platobný príkaz na úhradu / FIT 2.0 (EB),,
162,,2024-06-04,-0.25,EUR,Poplatok za platbu kartou,Poplatok za kartovú transakciu,,
163,,2024-06-04,-9.6,EUR,"B1822616979-44544 17** **** 4298;FACEBK *KT9GD24B92 ,fb.me/ads ,IE ;04.06.2024 02:09:00 ;CashBack:0 EUR",Platba kartou,,
164,,2024-06-04,-9.6,EUR,"B1822596401-44544 17** **** 4298;FACEBK *7ZQF62QB92 ,fb.me/ads ,IE ;04.06.2024 02:08:51 ;CashBack:0 EUR",Platba kartou,,
165,,2024-06-04,-0.25,EUR,Poplatok za platbu kartou,Poplatok za kartovú transakciu,,
166,,2024-06-04,-0.25,EUR,Poplatok za platbu kartou,Poplatok za kartovú transakciu,,
167,,2024-06-04,-500.0,EUR,"B1821944826-44544 17** **** 4298;GOOGLE *ADS4501982046 ,cc@google.com ,IE ;03.06.2024 19:44:25 ;CashBack:0 EUR",Platba kartou,,
168,,2024-06-04,-0.25,EUR,Poplatok za platbu kartou,Poplatok za kartovú transakciu,,
169,,2024-06-04,-174.0,EUR,"B1821892611-44544 17** **** 4298;FACEBK *UPYNZ2UA92 ,fb.me/ads ,IE ;03.06.2024 06:18:54 ;CashBack:0 EUR",Platba kartou,,
170,MBM Tatry,2024-06-04,-3615.15,EUR,"ubytovanie, kampaňove výjazdy",Platobný príkaz na úhradu / FIT 2.0 (EB),2320240118.0,
171,KOLOMAŽ,2024-06-04,-120.0,EUR,technické zabezpečenie podujatia,Platobný príkaz na úhradu / FIT 2.0 (EB),20240504.0,
172,KOLOZSI PETER - KOLOREK,2024-06-04,-600.0,EUR,inzercia,Platobný príkaz na úhradu / FIT 2.0 (EB),2024104.0,
173,Matúš Chovan,2024-06-04,-60.0,EUR,videá,Platobný príkaz na úhradu / FIT 2.0 (EB),20240012.0,
174,Matúš Chovan,2024-06-04,-20.0,EUR,video,Platobný príkaz na úhradu / FIT 2.0 (EB),20240014.0,
175,Matúš Chovan,2024-06-04,-80.0,EUR,videá,Platobný príkaz na úhradu / FIT 2.0 (EB),20240011.0,
176,PROGRUP SK s.r.o.,2024-06-04,-195.0,EUR,"tlač novín, 1300ks",Platobný príkaz na úhradu / FIT 2.0 (EB),240960.0,
177,Bittner print,2024-06-04,-282.0,EUR,letaky 3000 ks,Platobný príkaz na úhradu / FIT 2.0 (EB),1020242471.0,0.0
178,,2024-06-03,-0.25,EUR,Poplatok za platbu kartou,Poplatok za kartovú transakciu,,
179,,2024-06-03,-500.0,EUR,"B1821448718-44544 17** **** 4298;GOOGLE *ADS4501982046 ,cc@google.com ,IE ;02.06.2024 22:29:53 ;CashBack:0 EUR",Platba kartou,,
180,,2024-06-03,-0.25,EUR,Poplatok za platbu kartou,Poplatok za kartovú transakciu,,
181,,2024-06-03,-500.0,EUR,"B1821424008-44544 17** **** 4298;GOOGLE *ADS4501982046 ,cc@google.com ,IE ;02.06.2024 13:30:45 ;CashBack:0 EUR",Platba kartou,,
182,,2024-06-03,-158.0,EUR,"B1821353873-44544 17** **** 4298;FACEBK *QMMY32QB92 ,fb.me/ads ,IE ;02.06.2024 06:02:10 ;CashBack:0 EUR",Platba kartou,,
183,,2024-06-03,-0.25,EUR,Poplatok za platbu kartou,Poplatok za kartovú transakciu,,
184,,2024-06-02,-0.25,EUR,Poplatok za platbu kartou,Poplatok za kartovú transakciu,,
185,,2024-06-02,-500.0,EUR,"B1820708287-44544 17** **** 4298;GOOGLE *ADS4501982046 ,cc@google.com ,IE ;01.06.2024 15:28:18 ;CashBack:0 EUR",Platba kartou,,
186,,2024-06-02,-0.25,EUR,Poplatok za platbu kartou,Poplatok za kartovú transakciu,,
187,,2024-06-02,-500.0,EUR,"B1820621490-44544 17** **** 4298;GOOGLE *ADS4501982046 ,cc@google.com ,IE ;01.06.2024 18:15:09 ;CashBack:0 EUR",Platba kartou,,
188,,2024-06-02,-0.25,EUR,Poplatok za platbu kartou,Poplatok za kartovú transakciu,,
189,,2024-06-02,-143.0,EUR,"B1820603992-44544 17** **** 4298;FACEBK *HEHT22QB92 ,fb.me/ads ,IE ;01.06.2024 06:47:43 ;CashBack:0 EUR",Platba kartou,,
190,,2024-06-02,-0.25,EUR,Poplatok za platbu kartou,Poplatok za kartovú transakciu,,
191,,2024-06-02,-759.37,EUR,"B1820603958-44544 17** **** 4298;FACEBK *VYJS22QB92 ,fb.me/ads ,IE ;01.06.2024 06:11:54 ;CashBack:0 EUR",Platba kartou,,
192,,2024-06-02,-0.25,EUR,Poplatok za platbu kartou,Poplatok za kartovú transakciu,,
193,,2024-06-02,-500.0,EUR,"B1819759995-44544 17** **** 4298;GOOGLE *ADS4501982046 ,cc@google.com ,IE ;31.05.2024 14:46:58 ;CashBack:0 EUR",Platba kartou,,
194,,2024-06-02,-0.25,EUR,Poplatok za platbu kartou,Poplatok za kartovú transakciu,,
195,,2024-06-02,-130.0,EUR,"B1819755757-44544 17** **** 4298;FACEBK *MUL8M2UB92 ,fb.me/ads ,IE ;31.05.2024 07:15:00 ;CashBack:0 EUR",Platba kartou,,
196,,2024-06-01,-0.25,EUR,Poplatok za platbu kartou,Poplatok za kartovú transakciu,,
197,,2024-06-01,-15.97,EUR,"B1819630564-44544 17** **** 5827;SHELL 8220 ,HRICOVSKA ,SK ;30.05.2024 22:07:32 ;CashBack:0 EUR",Platba kartou,,
198,,2024-06-01,-0.25,EUR,Poplatok za platbu kartou,Poplatok za kartovú transakciu,,
199,,2024-06-01,-130.28,EUR,"B1819248296-44544 17** **** 5827;SLOVNAFT-SK40102 ,Janovik ,SK ;30.05.2024 12:50:27 ;CashBack:0 EUR",Platba kartou,,
200,,2024-06-01,-0.25,EUR,Poplatok za platbu kartou,Poplatok za kartovú transakciu,,
201,,2024-06-01,-960.0,EUR,"B1818969694-44544 17** **** 4298;FACEBK *9ZX8724B92 ,fb.me/ads ,IE ;30.05.2024 10:38:38 ;CashBack:0 EUR",Platba kartou,,
202,,2024-06-01,-0.25,EUR,Poplatok za platbu kartou,Poplatok za kartovú transakciu,,
203,,2024-06-01,-500.0,EUR,"B1818855841-44544 17** **** 4298;GOOGLE *ADS4501982046 ,cc@google.com ,IE ;30.05.2024 19:10:51 ;CashBack:0 EUR",Platba kartou,,
204,,2024-05-31,-5.0,EUR,Zverejňovanie účtu,Poplatok,,
205,,2024-05-31,-5.0,EUR,Poplatok za vedenie účtu,Poplatok,,
206,,2024-05-31,-3.5,EUR,"Vedenie Platobnej karty embosovanej,2315,5,Karta č. 4544 17** **** 5827Poplatok za Platobnú kartu",Kartový poplatok,,
207,Matúš Chovan,2024-05-31,-120.0,EUR,videá,Platobný príkaz na úhradu / FIT 2.0 (EB),20240009.0,
208,SITA Slovenská tlačová agentúra,2024-05-31,-720.0,EUR,video rozhovor,Platobný príkaz na úhradu / FIT 2.0 (EB),312400627.0,
209,OLLE s.r.o.,2024-05-31,-210.0,EUR,inzercia,Platobný príkaz na úhradu / FIT 2.0 (EB),202410227.0,
210,,2024-05-31,-0.25,EUR,Poplatok za platbu kartou,Poplatok za kartovú transakciu,,
211,,2024-05-31,-500.0,EUR,"B1818166555-44544 17** **** 4298;GOOGLE *ADS4501982046 ,cc@google.com ,IE ;29.05.2024 22:54:47 ;CashBack:0 EUR",Platba kartou,,
212,,2024-05-30,-0.25,EUR,Poplatok za platbu kartou,Poplatok za kartovú transakciu,,
213,,2024-05-30,-500.0,EUR,"B1817545940-44544 17** **** 4298;GOOGLE *ADS4501982046 ,cc@google.com ,IE ;28.05.2024 23:35:33 ;CashBack:0 EUR",Platba kartou,,
214,,2024-05-30,-0.25,EUR,Poplatok za platbu kartou,Poplatok za kartovú transakciu,,
215,,2024-05-30,-500.0,EUR,"B1817158432-44544 17** **** 4298;GOOGLE *ADS4501982046 ,cc@google.com ,IE ;28.05.2024 07:58:31 ;CashBack:0 EUR",Platba kartou,,
216,,2024-05-29,-0.25,EUR,Poplatok za platbu kartou,Poplatok za kartovú transakciu,,
217,,2024-05-29,-146.0,EUR,"B1816657652-44544 17** **** 5827;KOVAC SERVIS ,Mocenok ,SK ;27.05.2024 16:05:07 ;CashBack:0 EUR",Platba kartou,,
218,,2024-05-29,-0.25,EUR,Poplatok za platbu kartou,Poplatok za kartovú transakciu,,
219,,2024-05-29,-24.4,EUR,"B1816446921-44544 17** **** 5827;POSTA BRATISLAVA 21 ,BRATISLAVA ,SK ;27.05.2024 10:32:14 ;CashBack:0 EUR",Platba kartou,,
220,,2024-05-29,-0.25,EUR,Poplatok za platbu kartou,Poplatok za kartovú transakciu,,
221,,2024-05-29,-500.0,EUR,"B1816330209-44544 17** **** 4298;GOOGLE *ADS4501982046 ,cc@google.com ,IE ;27.05.2024 13:47:56 ;CashBack:0 EUR",Platba kartou,,
222,,2024-05-29,-0.25,EUR,Poplatok za platbu kartou,Poplatok za kartovú transakciu,,
223,,2024-05-29,-500.0,EUR,"B1816296972-44544 17** **** 4298;GOOGLE *ADS4501982046 ,cc@google.com ,IE ;27.05.2024 18:17:46 ;CashBack:0 EUR",Platba kartou,,
224,,2024-05-29,-0.25,EUR,Poplatok za platbu kartou,Poplatok za kartovú transakciu,,
225,,2024-05-29,-960.0,EUR,"B1816296741-44544 17** **** 4298;FACEBK *7ZKF43YA92 ,fb.me/ads ,IE ;27.05.2024 09:52:11 ;CashBack:0 EUR",Platba kartou,,
226,Bittner print s.r.o.,2024-05-28,-120.0,EUR,letáky 1000ks,Platobný príkaz na úhradu / FIT 2.0 (EB),1020242303.0,
227,Mgr. Dušan javor jr.,2024-05-28,-150.0,EUR,"bannerová reklama, web Seredsity",Platobný príkaz na úhradu / FIT 2.0 (EB),20240033.0,
228,Matúš Chovan,2024-05-28,-220.0,EUR,videá,Platobný príkaz na úhradu / FIT 2.0 (EB),20240004.0,
229,Matúš Chovan,2024-05-28,-200.0,EUR,videá,Platobný príkaz na úhradu / FIT 2.0 (EB),20240005.0,
230,Ing. Jozef Adamec -Reštaurácia Kopyto,2024-05-28,-240.0,EUR,občerstvenie,Platobný príkaz na úhradu / FIT 2.0 (EB),240030.0,
231,Mesto Liptovský Mikuláš,2024-05-28,-26.55,EUR,daň za zabratie priestranstva,Platobný príkaz na úhradu / FIT 2.0 (EB),1330126.0,
232,Mesto Prešov,2024-05-28,-5.6,EUR,daň za zabratie priestranstva,Platobný príkaz na úhradu / FIT 2.0 (EB),1500033202.0,2403041293.0
233,IDEAMEDIA s.r.o.,2024-05-28,-29400.0,EUR,správa online kampane,Platobný príkaz na úhradu / FIT 2.0 (EB),3240110.0,
234,,2024-05-27,-0.25,EUR,Poplatok za platbu kartou,Poplatok za kartovú transakciu,,
235,,2024-05-27,-500.0,EUR,"B1815824394-44544 17** **** 4298;GOOGLE *ADS4501982046 ,cc@google.com ,IE ;26.05.2024 22:17:57 ;CashBack:0 EUR",Platba kartou,,
236,,2024-05-27,-0.25,EUR,Poplatok za platbu kartou,Poplatok za kartovú transakciu,,
237,,2024-05-27,-500.0,EUR,"B1815736097-44544 17** **** 4298;GOOGLE *ADS4501982046 ,cc@google.com ,IE ;26.05.2024 08:06:54 ;CashBack:0 EUR",Platba kartou,,
238,,2024-05-27,-0.25,EUR,Poplatok za platbu kartou,Poplatok za kartovú transakciu,,
239,,2024-05-27,-500.0,EUR,"B1815736013-44544 17** **** 4298;GOOGLE *ADS4501982046 ,cc@google.com ,IE ;26.05.2024 18:42:25 ;CashBack:0 EUR",Platba kartou,,
240,,2024-05-26,-0.25,EUR,Poplatok za platbu kartou,Poplatok za kartovú transakciu,,
241,,2024-05-26,-0.25,EUR,Poplatok za platbu kartou,Poplatok za kartovú transakciu,,
242,,2024-05-26,-500.0,EUR,"B1815030598-44544 17** **** 4298;GOOGLE *ADS4501982046 ,cc@google.com ,IE ;25.05.2024 08:26:38 ;CashBack:0 EUR",Platba kartou,,
243,,2024-05-26,-8.7,EUR,"B1815037810-44544 17** **** 4298;FACEBK* ,fb.me/ads ,IE ;25.05.2024 12:18:18 ;CashBack:0 EUR",Platba kartou,,
244,,2024-05-26,-0.25,EUR,Poplatok za platbu kartou,Poplatok za kartovú transakciu,,
245,,2024-05-26,-500.0,EUR,"B1814788385-44544 17** **** 4298;GOOGLE *ADS4501982046 ,cc@google.com ,IE ;25.05.2024 19:38:16 ;CashBack:0 EUR",Platba kartou,,
246,,2024-05-26,-0.25,EUR,Poplatok za platbu kartou,Poplatok za kartovú transakciu,,
247,,2024-05-26,-500.0,EUR,"B1814779368-44544 17** **** 4298;GOOGLE *ADS4501982046 ,cc@google.com ,IE ;25.05.2024 13:36:11 ;CashBack:0 EUR",Platba kartou,,
248,,2024-05-25,-0.25,EUR,Poplatok za platbu kartou,Poplatok za kartovú transakciu,,
249,,2024-05-25,-500.0,EUR,"B1814166518-44544 17** **** 4298;GOOGLE *ADS4501982046 ,cc@google.com ,IE ;24.05.2024 21:26:23 ;CashBack:0 EUR",Platba kartou,,
250,,2024-05-25,-0.25,EUR,Poplatok za platbu kartou,Poplatok za kartovú transakciu,,
251,,2024-05-25,-500.0,EUR,"B1814027987-44544 17** **** 4298;GOOGLE *ADS4501982046 ,cc@google.com ,IE ;24.05.2024 16:50:15 ;CashBack:0 EUR",Platba kartou,,
252,,2024-05-25,-0.25,EUR,Poplatok za platbu kartou,Poplatok za kartovú transakciu,,
253,,2024-05-25,-500.0,EUR,"B1814016170-44544 17** **** 4298;GOOGLE *ADS4501982046 ,cc@google.com ,IE ;24.05.2024 11:47:03 ;CashBack:0 EUR",Platba kartou,,
254,,2024-05-24,-0.25,EUR,Poplatok za platbu kartou,Poplatok za kartovú transakciu,,
255,,2024-05-24,-500.0,EUR,"B1813342115-44544 17** **** 4298;GOOGLE *ADS4501982046 ,cc@google.com ,IE ;23.05.2024 23:07:05 ;CashBack:0 EUR",Platba kartou,,
256,,2024-05-24,-0.25,EUR,Poplatok za platbu kartou,Poplatok za kartovú transakciu,,
257,,2024-05-24,-101.9,EUR,"B1813269529-44544 17** **** 5827;BBBOX.SK ,BRATISLAVA ,SK ;23.05.2024 10:19:13 ;CashBack:0 EUR",Platba kartou,,
258,,2024-05-24,-0.25,EUR,Poplatok za platbu kartou,Poplatok za kartovú transakciu,,
259,,2024-05-24,-500.0,EUR,"B1813256294-44544 17** **** 4298;GOOGLE *ADS4501982046 ,cc@google.com ,IE ;23.05.2024 14:16:58 ;CashBack:0 EUR",Platba kartou,,
260,,2024-05-24,-0.25,EUR,Poplatok za platbu kartou,Poplatok za kartovú transakciu,,
261,,2024-05-24,-500.0,EUR,"B1813247298-44544 17** **** 4298;GOOGLE *ADS4501982046 ,cc@google.com ,IE ;23.05.2024 09:46:05 ;CashBack:0 EUR",Platba kartou,,
262,,2024-05-24,-0.25,EUR,Poplatok za platbu kartou,Poplatok za kartovú transakciu,,
263,,2024-05-24,-500.0,EUR,"B1813163177-44544 17** **** 4298;GOOGLE *ADS4501982046 ,cc@google.com ,IE ;23.05.2024 17:26:45 ;CashBack:0 EUR",Platba kartou,,
264,,2024-05-24,-0.25,EUR,Poplatok za platbu kartou,Poplatok za kartovú transakciu,,
265,,2024-05-24,-500.0,EUR,"B1813149468-44544 17** **** 4298;GOOGLE *ADS4501982046 ,cc@google.com ,IE ;23.05.2024 06:45:09 ;CashBack:0 EUR",Platba kartou,,
266,Mesto Nitra,2024-05-24,-495.0,EUR,daň za užívanie priestranstva,Platobný príkaz na úhradu / FIT 2.0 (EB),1400347712.0,
267,Mesto Senica,2024-05-24,-750.0,EUR,daň za užívanie priestranstva,Platobný príkaz na úhradu / FIT 2.0 (EB),1500012252.0,
268,Matúš Chovan,2024-05-24,-20.0,EUR,videá,Platobný príkaz na úhradu / FIT 2.0 (EB),20240003.0,
269,Matúš Chovan,2024-05-24,-200.0,EUR,videá,Platobný príkaz na úhradu / FIT 2.0 (EB),20240002.0,
270,Mesto Trenčín,2024-05-24,-25.0,EUR,správny poplatok,Platobný príkaz na úhradu / FIT 2.0 (EB),5010013345.0,
271,Mesto Bratislava,2024-05-24,-80.0,EUR,daň za užívanie priestranstva,Platobný príkaz na úhradu / FIT 2.0 (EB),2241331319.0,
272,NUBIUM s.r.o.,2024-05-24,-3000.0,EUR,"BILBOARDY, 50KS",Platobný príkaz na úhradu / FIT 2.0 (EB),24053605.0,
273,bytiborkuna s.r.o.,2024-05-24,-960.0,EUR,videoprodukcia eurovolby 24,Platobný príkaz na úhradu / FIT 2.0 (EB),2024040.0,
274,,2024-05-23,-0.25,EUR,Poplatok za platbu kartou,Poplatok za kartovú transakciu,,
275,,2024-05-23,-49.8,EUR,"B1812550205-44544 17** **** 5827;POSTA BRATISLAVA 21 ,BRATISLAVA ,SK ;22.05.2024 09:53:04 ;CashBack:0 EUR",Platba kartou,,
276,,2024-05-23,-0.25,EUR,Poplatok za platbu kartou,Poplatok za kartovú transakciu,,
277,,2024-05-23,-500.0,EUR,"B1812434327-44544 17** **** 4298;GOOGLE *ADS4501982046 ,cc@google.com ,IE ;22.05.2024 22:03:53 ;CashBack:0 EUR",Platba kartou,,
278,,2024-05-23,-0.25,EUR,Poplatok za platbu kartou,Poplatok za kartovú transakciu,,
279,,2024-05-23,-500.0,EUR,"B1812380342-44544 17** **** 4298;GOOGLE *ADS4501982046 ,cc@google.com ,IE ;22.05.2024 17:03:26 ;CashBack:0 EUR",Platba kartou,,
280,,2024-05-23,-0.25,EUR,Poplatok za platbu kartou,Poplatok za kartovú transakciu,,
281,,2024-05-23,-500.0,EUR,"B1812338776-44544 17** **** 4298;GOOGLE *ADS4501982046 ,cc@google.com ,IE ;22.05.2024 09:02:41 ;CashBack:0 EUR",Platba kartou,,
282,,2024-05-23,-0.25,EUR,Poplatok za platbu kartou,Poplatok za kartovú transakciu,,
283,,2024-05-23,-500.0,EUR,"B1811403789-44544 17** **** 4298;GOOGLE *ADS4501982046 ,cc@google.com ,IE ;21.05.2024 17:16:59 ;CashBack:0 EUR",Platba kartou,,
284,N Press s.r.o.,2024-05-22,-50.0,EUR,lístky na diskusiu,Platobný príkaz na úhradu / FIT 2.0 (EB),240100029.0,
285,Bittner print s.r.o.,2024-05-22,-480.0,EUR,"letáky, 5000ks",Platobný príkaz na úhradu / FIT 2.0 (EB),1020242217.0,
286,CONVERSE SLOVAKIA s.r.o.,2024-05-22,-51.0,EUR,"prenájom a inštalácia banneru, 5/24doplatok",Platobný príkaz na úhradu / FIT 2.0 (EB),2405006.0,
287,New School Communications,2024-05-22,-2944.25,EUR,nákup mediálneho priestoru,Platobný príkaz na úhradu / FIT 2.0 (EB),2024203.0,
288,ARTON s.r.o.,2024-05-22,-2520.0,EUR,"nájom BB, 42 ks, máj",Platobný príkaz na úhradu / FIT 2.0 (EB),240253.0,
289,Mesto Košice,2024-05-22,-150.0,EUR,daň za vjazd vozidla,Platobný príkaz na úhradu / FIT 2.0 (EB),3524000073.0,
290,IDEAMEDIA s.r.o.,2024-05-22,-26400.0,EUR,správa online kampane,Platobný príkaz na úhradu / FIT 2.0 (EB),3240109.0,
291,,2024-05-22,-0.25,EUR,Poplatok za platbu kartou,Poplatok za kartovú transakciu,,
292,,2024-05-22,-500.0,EUR,"B1810676473-44544 17** **** 4298;GOOGLE *ADS4501982046 ,cc@google.com ,IE ;20.05.2024 12:53:10 ;CashBack:0 EUR",Platba kartou,,
293,,2024-05-22,-0.25,EUR,Poplatok za platbu kartou,Poplatok za kartovú transakciu,,
294,,2024-05-22,-500.0,EUR,"B1810595230-44544 17** **** 4298;GOOGLE *ADS4501982046 ,cc@google.com ,IE ;20.05.2024 20:09:31 ;CashBack:0 EUR",Platba kartou,,
295,,2024-05-21,-0.25,EUR,"Poplatok za výber kartou,2203,5,4544 17** **** 5827;Trhovisko TUBUS ,Bratislava ,SK ;21.05.2024 10:50:32",Poplatok za kartovú transakciu,,
296,,2024-05-21,-300.0,EUR,"B4062848731-214544 17** **** 5827;Trhovisko TUBUS ,Bratislava ,SK ;21.05.2024 10:50:32 ",Výber kartou,,
297,Matúš Chovan,2024-05-21,-200.0,EUR,video kampaň,Platobný príkaz na úhradu / FIT 2.0 (EB),20240001.0,
298,X print s.r.o.,2024-05-21,-774.0,EUR,"bočná stena stan, bannery, roll up",Platobný príkaz na úhradu / FIT 2.0 (EB),240510.0,
299,PROGROUP SK s.r.o.,2024-05-21,-331.2,EUR,promostolík,Platobný príkaz na úhradu / FIT 2.0 (EB),240802.0,
300,X print s.r.o.,2024-05-21,-865.2,EUR,"bannery, roll upy",Platobný príkaz na úhradu / FIT 2.0 (EB),240494.0,
301,Mesto Košice,2024-05-21,-80.0,EUR,správny poplatok,Platobný príkaz na úhradu / FIT 2.0 (EB),3451240213.0,
302,Copygraf s.r.o.,2024-05-21,-549.84,EUR,"memoranda, plagáty,fotoobraz",Platobný príkaz na úhradu / FIT 2.0 (EB),3091429.0,
303,Webglobe,2024-05-21,-5.99,EUR,domena sestrysestram,Platobný príkaz na úhradu / FIT 2.0 (EB),2489026334.0,
304,,2024-05-20,-0.25,EUR,Poplatok za platbu kartou,Poplatok za kartovú transakciu,,
305,,2024-05-20,-500.0,EUR,"B1810046567-44544 17** **** 4298;GOOGLE *ADS4501982046 ,cc@google.com ,IE ;19.05.2024 20:16:08 ;CashBack:0 EUR",Platba kartou,,
306,,2024-05-20,-0.25,EUR,Poplatok za platbu kartou,Poplatok za kartovú transakciu,,
307,,2024-05-20,-500.0,EUR,"B1810034885-44544 17** **** 4298;GOOGLE *ADS4501982046 ,cc@google.com ,IE ;19.05.2024 14:37:39 ;CashBack:0 EUR",Platba kartou,,
308,,2024-05-20,-0.25,EUR,Poplatok za platbu kartou,Poplatok za kartovú transakciu,,
309,,2024-05-20,-500.0,EUR,"B1809976312-44544 17** **** 4298;GOOGLE *ADS4501982046 ,cc@google.com ,IE ;19.05.2024 09:07:59 ;CashBack:0 EUR",Platba kartou,,
310,,2024-05-19,-0.25,EUR,Poplatok za platbu kartou,Poplatok za kartovú transakciu,,
311,,2024-05-19,-20.61,EUR,"B1809264390-44544 17** **** 4298;FACEBK* ,fb.me/ads ,IE ;18.05.2024 10:33:06 ;CashBack:0 EUR",Platba kartou,,
312,,2024-05-19,-0.25,EUR,Poplatok za platbu kartou,Poplatok za kartovú transakciu,,
313,,2024-05-19,-500.0,EUR,"B1809172099-44544 17** **** 4298;GOOGLE *ADS4501982046 ,cc@google.com ,IE ;18.05.2024 06:31:58 ;CashBack:0 EUR",Platba kartou,,
314,,2024-05-19,-0.25,EUR,Poplatok za platbu kartou,Poplatok za kartovú transakciu,,
315,,2024-05-19,-500.0,EUR,"B1809147217-44544 17** **** 4298;GOOGLE *ADS4501982046 ,cc@google.com ,IE ;18.05.2024 12:59:28 ;CashBack:0 EUR",Platba kartou,,
316,,2024-05-19,-0.25,EUR,Poplatok za platbu kartou,Poplatok za kartovú transakciu,,
317,,2024-05-19,-21.9,EUR,"B1808356760-44544 17** **** 5827;POSTA BRATISLAVA 21 ,BRATISLAVA ,SK ;17.05.2024 15:31:45 ;CashBack:0 EUR",Platba kartou,,
318,,2024-05-19,-0.25,EUR,Poplatok za platbu kartou,Poplatok za kartovú transakciu,,
319,,2024-05-19,-500.0,EUR,"B1808246991-44544 17** **** 4298;GOOGLE *ADS4501982046 ,cc@google.com ,IE ;17.05.2024 18:28:23 ;CashBack:0 EUR",Platba kartou,,
320,,2024-05-19,-0.25,EUR,Poplatok za platbu kartou,Poplatok za kartovú transakciu,,
321,,2024-05-19,-500.0,EUR,"B1808247247-44544 17** **** 4298;GOOGLE *ADS4501982046 ,cc@google.com ,IE ;17.05.2024 21:55:10 ;CashBack:0 EUR",Platba kartou,,
322,,2024-05-19,-0.25,EUR,Poplatok za platbu kartou,Poplatok za kartovú transakciu,,
323,,2024-05-19,-500.0,EUR,"B1808149391-44544 17** **** 4298;GOOGLE *ADS4501982046 ,cc@google.com ,IE ;17.05.2024 13:10:46 ;CashBack:0 EUR",Platba kartou,,
324,,2024-05-17,-0.25,EUR,Poplatok za platbu kartou,Poplatok za kartovú transakciu,,
325,,2024-05-17,-21.0,EUR,"B1807191910-44544 17** **** 4298;FACEBK *K6REJZ7B92 ,fb.me/ads ,IE ;16.05.2024 11:11:31 ;CashBack:0 EUR",Platba kartou,,
326,,2024-05-17,-0.25,EUR,Poplatok za platbu kartou,Poplatok za kartovú transakciu,,
327,,2024-05-17,-0.25,EUR,Poplatok za platbu kartou,Poplatok za kartovú transakciu,,
328,,2024-05-17,-5.0,EUR,"B1807331325-44544 17** **** 4298;FACEBK* ,fb.me/ads ,IE ;16.05.2024 09:21:28 ;CashBack:0 EUR",Platba kartou,,
329,,2024-05-17,-356.6,EUR,"B1807416872-44544 17** **** 5827;POSTA BRATISLAVA 21 ,BRATISLAVA ,SK ;16.05.2024 09:41:48 ;CashBack:0 EUR",Platba kartou,,
330,,2024-05-17,-400.0,EUR,"B4058102695-214544 17** **** 5827;NC Centrál ,Bratislava ,SK ;17.05.2024 13:53:45 ",Výber kartou,,
331,,2024-05-17,-0.25,EUR,"Poplatok za výber kartou,2203,5,4544 17** **** 5827;NC Centrál ,Bratislava ,SK ;17.05.2024 13:53:45",Poplatok za kartovú transakciu,,
332,FALAFEL NITRA,2024-05-17,-106.4,EUR,OBčERSTVENIE,Platobný príkaz na úhradu / FIT 2.0 (EB),2024010.0,
333,Wave sound solutions s.r.o.,2024-05-17,-1218.0,EUR,technické zabezpečenie podujatia,Platobný príkaz na úhradu / FIT 2.0 (EB),20240025.0,
334,IMI TRADE s.r.o.,2024-05-17,-7680.0,EUR,"balóniky 5000ks, perá 5000ks, šnúrk5000 ks",Platobný príkaz na úhradu / FIT 2.0 (EB),7002406034.0,
335,AKO s.r.o.,2024-05-17,-3600.0,EUR,prieskum verejnej mienky,Platobný príkaz na úhradu / FIT 2.0 (EB),1720242445.0,
336,CONVERSE SLOVAKIA s.r.o.,2024-05-17,-813.0,EUR,"BANNER, inštalácia, prenájom 05/24",Platobný príkaz na úhradu / FIT 2.0 (EB),2405006.0,
337,Pavol Konštiak,2024-05-17,-300.0,EUR,bannerová reklama,Platobný príkaz na úhradu / FIT 2.0 (EB),20240005.0,
338,,2024-05-17,-0.25,EUR,Poplatok za platbu kartou,Poplatok za kartovú transakciu,,
339,,2024-05-17,-19.0,EUR,"B1806673956-44544 17** **** 4298;FACEBK *CJS582GB92 ,fb.me/ads ,IE ;16.05.2024 00:22:35 ;CashBack:0 EUR",Platba kartou,,
340,,2024-05-17,-0.25,EUR,Poplatok za platbu kartou,Poplatok za kartovú transakciu,,
341,,2024-05-17,-450.84,EUR,"B1806482957-44544 17** **** 5827;Farlesk ,Bratislava ,SK ;15.05.2024 10:15:09 ;CashBack:0 EUR",Platba kartou,,
342,,2024-05-17,-0.25,EUR,Poplatok za platbu kartou,Poplatok za kartovú transakciu,,
343,,2024-05-17,-15.0,EUR,"B1806214052-44544 17** **** 4298;FACEBK *5LRQ72UA92 ,fb.me/ads ,IE ;15.05.2024 14:09:37 ;CashBack:0 EUR",Platba kartou,,
344,,2024-05-17,-0.25,EUR,Poplatok za platbu kartou,Poplatok za kartovú transakciu,,
345,,2024-05-17,-350.0,EUR,"B1806206975-44544 17** **** 4298;GOOGLE *ADS4501982046 ,cc@google.com ,IE ;15.05.2024 12:56:45 ;CashBack:0 EUR",Platba kartou,,
346,,2024-05-17,-0.25,EUR,Poplatok za platbu kartou,Poplatok za kartovú transakciu,,
347,,2024-05-17,-960.0,EUR,"B1806183249-44544 17** **** 4298;FACEBK* ,fb.me/ads ,IE ;15.05.2024 11:19:49 ;CashBack:0 EUR",Platba kartou,,
348,,2024-05-17,-17.0,EUR,"B1806183049-44544 17** **** 4298;FACEBK* ,fb.me/ads ,IE ;15.05.2024 18:54:01 ;CashBack:0 EUR",Platba kartou,,
349,,2024-05-17,-0.25,EUR,Poplatok za platbu kartou,Poplatok za kartovú transakciu,,
350,,2024-05-16,-0.25,EUR,Poplatok za platbu kartou,Poplatok za kartovú transakciu,,
351,,2024-05-16,-456.2,EUR,"B1805446233-44544 17** **** 5827;POSTA BRATISLAVA 21 ,BRATISLAVA ,SK ;14.05.2024 10:29:44 ;CashBack:0 EUR",Platba kartou,,
352,,2024-05-16,-40.0,EUR,"B1805418858-44544 17** **** 4298;FACEBK* ,fb.me/ads ,IE ;14.05.2024 21:27:49 ;CashBack:0 EUR",Platba kartou,,
353,,2024-05-16,-0.25,EUR,Poplatok za platbu kartou,Poplatok za kartovú transakciu,,
354,,2024-05-16,-0.25,EUR,Poplatok za platbu kartou,Poplatok za kartovú transakciu,,
355,,2024-05-16,-22.0,EUR,"B1805345325-44544 17** **** 4298;FACEBK* ,fb.me/ads ,IE ;14.05.2024 06:54:09 ;CashBack:0 EUR",Platba kartou,,
356,,2024-05-16,-0.25,EUR,Poplatok za platbu kartou,Poplatok za kartovú transakciu,,
357,,2024-05-16,-200.0,EUR,"B1805336802-44544 17** **** 4298;GOOGLE *ADS4501982046 ,cc@google.com ,IE ;14.05.2024 12:32:35 ;CashBack:0 EUR",Platba kartou,,
358,,2024-05-16,-0.25,EUR,Poplatok za platbu kartou,Poplatok za kartovú transakciu,,
359,,2024-05-16,-50.0,EUR,"B1805318656-44544 17** **** 4298;GOOGLE *ADS4501982046 ,cc@google.com ,IE ;14.05.2024 09:16:25 ;CashBack:0 EUR",Platba kartou,,
360,,2024-05-16,-33.0,EUR,"B1805300506-44544 17** **** 4298;FACEBK* ,fb.me/ads ,IE ;14.05.2024 16:20:22 ;CashBack:0 EUR",Platba kartou,,
361,,2024-05-16,-0.25,EUR,Poplatok za platbu kartou,Poplatok za kartovú transakciu,,
362,,2024-05-16,-0.25,EUR,Poplatok za platbu kartou,Poplatok za kartovú transakciu,,
363,,2024-05-16,-10.0,EUR,"B1805294485-44544 17** **** 4298;GOOGLE *ADS4501982046 ,cc@google.com ,IE ;14.05.2024 08:01:00 ;CashBack:0 EUR",Platba kartou,,
364,,2024-05-16,-0.25,EUR,Poplatok za platbu kartou,Poplatok za kartovú transakciu,,
365,,2024-05-16,-27.0,EUR,"B1805270294-44544 17** **** 4298;FACEBK* ,fb.me/ads ,IE ;14.05.2024 10:30:05 ;CashBack:0 EUR",Platba kartou,,
366,euroAWK spol. s.r.o.,2024-05-15,-1284.0,EUR,"CLV nosiče, doplatok k zálohe 20 ks",Platobný príkaz na úhradu / FIT 2.0 (EB),242146.0,
367,Bittner print s.r.o.,2024-05-15,-237.6,EUR,"letáky, 500 ks",Platobný príkaz na úhradu / FIT 2.0 (EB),1020242089.0,
368,Polygrafické centrum s.r.o.,2024-05-15,-232.8,EUR,tlač plagátov,Platobný príkaz na úhradu / FIT 2.0 (EB),403000047.0,
369,,2024-05-14,-0.25,EUR,Poplatok za platbu kartou,Poplatok za kartovú transakciu,,
370,,2024-05-14,-960.0,EUR,"B1804958816-44544 17** **** 4298;FACEBK* ,fb.me/ads ,IE ;14.05.2024 02:54:27 ;CashBack:0 EUR",Platba kartou,,
371,,2024-05-14,-0.25,EUR,Poplatok za platbu kartou,Poplatok za kartovú transakciu,,
372,,2024-05-14,-163.7,EUR,"B1804828625-44544 17** **** 5827;LAMITEC,BA,PESTOVATELSK ,BRATISLAVA ,SK ;13.05.2024 12:08:57 ;CashBack:0 EUR",Platba kartou,,
373,,2024-05-14,-0.25,EUR,Poplatok za platbu kartou,Poplatok za kartovú transakciu,,
374,,2024-05-14,-8.0,EUR,"B1804527595-44544 17** **** 4298;FACEBK* ,fb.me/ads ,IE ;13.05.2024 19:08:06 ;CashBack:0 EUR",Platba kartou,,
375,,2024-05-14,-0.25,EUR,Poplatok za platbu kartou,Poplatok za kartovú transakciu,,
376,,2024-05-14,-12.0,EUR,"B1804529044-44544 17** **** 4298;FACEBK* ,fb.me/ads ,IE ;13.05.2024 21:15:48 ;CashBack:0 EUR",Platba kartou,,
377,,2024-05-14,-0.25,EUR,Poplatok za platbu kartou,Poplatok za kartovú transakciu,,
378,,2024-05-14,-10.0,EUR,"B1804528832-44544 17** **** 4298;FACEBK* ,fb.me/ads ,IE ;13.05.2024 20:03:42 ;CashBack:0 EUR",Platba kartou,,
379,,2024-05-14,-0.25,EUR,Poplatok za platbu kartou,Poplatok za kartovú transakciu,,
380,,2024-05-14,-20.0,EUR,"B1804529856-44544 17** **** 4298;FACEBK* ,fb.me/ads ,IE ;13.05.2024 23:01:23 ;CashBack:0 EUR",Platba kartou,,
381,,2024-05-14,-0.25,EUR,Poplatok za platbu kartou,Poplatok za kartovú transakciu,,
382,,2024-05-14,-6.0,EUR,"B1804480192-44544 17** **** 4298;FACEBK* ,fb.me/ads ,IE ;13.05.2024 18:14:31 ;CashBack:0 EUR",Platba kartou,,
383,NUBIUM s.r.o.,2024-05-14,-12180.0,EUR,"tlač plagátov, bannerov, inštalácia355 ks BB, 11 ks banner",Platobný príkaz na úhradu / FIT 2.0 (EB),24053377.0,
384,Reklama Boka s.r.o.,2024-05-14,-150.0,EUR,inzercia,Platobný príkaz na úhradu / FIT 2.0 (EB),24170.0,
385,Reklama Boka s.r.o.,2024-05-14,-150.0,EUR,"distribúcia letákov,5000ks",Platobný príkaz na úhradu / FIT 2.0 (EB),24169.0,
386,Aspena s.r.o.,2024-05-14,-1872.0,EUR,"tlmočenie, tlmočnícka technika",Platobný príkaz na úhradu / FIT 2.0 (EB),2240428.0,
387,ProRacio n.o.,2024-05-14,-1000.0,EUR,"inzercia, europskenoviny.sk",Platobný príkaz na úhradu / FIT 2.0 (EB),240800001.0,
388,JAGERKAFFEE PLUS s.r.o.,2024-05-14,-3803.0,EUR,"občerstvenie, catering, staráNR SR, verejná diskusia",Platobný príkaz na úhradu / FIT 2.0 (EB),20240004.0,
389,bytiborkuna,2024-05-14,-1380.0,EUR,videoprodukcia,Platobný príkaz na úhradu / FIT 2.0 (EB),2024034.0,
390,Boomerang Smartmedia s.r.o.,2024-05-14,-7452.0,EUR,"outdoor reklama, reklamné spoty",Platobný príkaz na úhradu / FIT 2.0 (EB),2400068.0,
391,Polygrafické centrum s.r.o.,2024-05-14,-906.0,EUR,tlač plagátov,Platobný príkaz na úhradu / FIT 2.0 (EB),403000044.0,
392,,2024-05-13,-0.25,EUR,Poplatok za platbu kartou,Poplatok za kartovú transakciu,,
393,,2024-05-13,-118.0,EUR,"B1803770205-44544 17** **** 4298;FACEBK* ,fb.me/ads ,IE ;12.05.2024 06:41:42 ;CashBack:0 EUR",Platba kartou,,
394,,2024-05-12,-0.25,EUR,Poplatok za platbu kartou,Poplatok za kartovú transakciu,,
395,,2024-05-12,-864.0,EUR,"B1801970648-44544 17** **** 4298;FACEBK* ,fb.me/ads ,IE ;10.05.2024 14:10:36 ;CashBack:0 EUR",Platba kartou,,
396,,2024-05-10,-0.25,EUR,Poplatok za platbu kartou,Poplatok za kartovú transakciu,,
397,,2024-05-10,-107.0,EUR,"B1800887554-44544 17** **** 4298;FACEBK* ,fb.me/ads ,IE ;09.05.2024 12:54:15 ;CashBack:0 EUR",Platba kartou,,
398,,2024-05-09,-0.25,EUR,Poplatok za platbu kartou,Poplatok za kartovú transakciu,,
399,,2024-05-09,-4.0,EUR,"B1800798027-44544 17** **** 4298;FACEBK* ,fb.me/ads ,IE ;09.05.2024 00:09:38 ;CashBack:0 EUR",Platba kartou,,
400,,2024-05-09,-0.25,EUR,Poplatok za platbu kartou,Poplatok za kartovú transakciu,,
401,,2024-05-09,-2.0,EUR,"B1800619249-44544 17** **** 4298;FACEBK* ,fb.me/ads ,IE ;08.05.2024 23:21:29 ;CashBack:0 EUR",Platba kartou,,
402,,2024-05-09,-0.25,EUR,Poplatok za platbu kartou,Poplatok za kartovú transakciu,,
403,,2024-05-09,-2.0,EUR,"B1800617442-44544 17** **** 4298;FACEBK* ,fb.me/ads ,IE ;08.05.2024 23:41:39 ;CashBack:0 EUR",Platba kartou,,
404,,2024-05-09,-0.25,EUR,Poplatok za platbu kartou,Poplatok za kartovú transakciu,,
405,,2024-05-09,-2.0,EUR,"B1800617390-44544 17** **** 4298;FACEBK* ,fb.me/ads ,IE ;08.05.2024 23:31:34 ;CashBack:0 EUR",Platba kartou,,
406,,2024-05-09,-0.25,EUR,Poplatok za platbu kartou,Poplatok za kartovú transakciu,,
407,,2024-05-09,-3.0,EUR,"B1800616979-44544 17** **** 4298;FACEBK* ,fb.me/ads ,IE ;08.05.2024 23:51:47 ;CashBack:0 EUR",Platba kartou,,
408,,2024-05-09,-0.25,EUR,Poplatok za platbu kartou,Poplatok za kartovú transakciu,,
409,,2024-05-09,-600.0,EUR,"B1799585537-44544 17** **** 4298;FACEBK* ,fb.me/ads ,IE ;07.05.2024 15:12:27 ;CashBack:0 EUR",Platba kartou,,
410,,2024-05-07,-0.25,EUR,Poplatok za platbu kartou,Poplatok za kartovú transakciu,,
411,,2024-05-07,-88.0,EUR,"B1798715027-44544 17** **** 4298;FACEBK* ,fb.me/ads ,IE ;06.05.2024 12:35:49 ;CashBack:0 EUR",Platba kartou,,
412,,2024-05-07,-0.25,EUR,Poplatok za platbu kartou,Poplatok za kartovú transakciu,,
413,,2024-05-07,-97.0,EUR,"B1798706581-44544 17** **** 4298;FACEBK* ,fb.me/ads ,IE ;06.05.2024 15:28:59 ;CashBack:0 EUR",Platba kartou,,
414,BAJKO s.r.o.,2024-05-07,-1800.0,EUR,volebný program,Platobný príkaz na úhradu / FIT 2.0 (EB),2024100.0,
415,Bittner print s.r.o.,2024-05-07,-686.4,EUR,"letáky, 4000 ks",Platobný príkaz na úhradu / FIT 2.0 (EB),1020241953.0,
416,euroAWK spol. s.r.o.,2024-05-07,-2247.0,EUR,"CLV kampaň, máj",Platobný príkaz na úhradu / FIT 2.0 (EB),2470042.0,
417,,2024-05-06,-0.25,EUR,Poplatok za platbu kartou,Poplatok za kartovú transakciu,,
418,,2024-05-06,-153.98,EUR,"B1798577864-44544 17** **** 4298;FACEBK* ,fb.me/ads ,IE ;06.05.2024 00:04:33 ;CashBack:0 EUR",Platba kartou,,
419,X print s.r.o.,2024-05-03,-302.4,EUR,roll up 100x200 cm,Platobný príkaz na úhradu / FIT 2.0 (EB),240461.0,
420,CONFIDENCE MEDIA SR s.r.o.,2024-05-03,-1332.0,EUR,Produkcia (Eurovolby 2024),Platobný príkaz na úhradu / FIT 2.0 (EB),2421098.0,
421,Kancelária NR SR,2024-05-03,-800.0,EUR,prevádzkové náklady,Platobný príkaz na úhradu / FIT 2.0 (EB),732024.0,
422,Kancelária NR SR,2024-05-03,-1000.0,EUR,prenájom priestorov,Platobný príkaz na úhradu / FIT 2.0 (EB),732024.0,
423,Ondrej Drozd - BLACKBIRD,2024-05-03,-1685.0,EUR,"kameramanské práce , 4/24",Platobný príkaz na úhradu / FIT 2.0 (EB),20240001.0,
424,NUBIUM s.r.o.,2024-05-03,-56360.4,EUR,"prenájom bigboardov, bilboardov 11 ks + 333 ks, máj 24",Platobný príkaz na úhradu / FIT 2.0 (EB),24052901.0,
425,CTF s.r.o.,2024-05-03,-45.0,EUR,"prenájom priestorov, občerstvenie",Platobný príkaz na úhradu / FIT 2.0 (EB),20240004.0,
426,SPARKS s.r.o.,2024-05-03,-2967.05,EUR,"tričká, vesty",Platobný príkaz na úhradu / FIT 2.0 (EB),2490001538.0,
427,SRNKYPRINT s.r.o.,2024-05-03,-60.0,EUR,tlač plagátov,Platobný príkaz na úhradu / FIT 2.0 (EB),20240098.0,
428,,2024-05-02,-0.25,EUR,Poplatok za platbu kartou,Poplatok za kartovú transakciu,,
429,,2024-05-02,-80.0,EUR,"B1795237018-44544 17** **** 4298;FACEBK* ,fb.me/ads ,IE ;01.05.2024 09:16:11 ;CashBack:0 EUR",Platba kartou,,
430,,2024-05-02,-0.25,EUR,Poplatok za platbu kartou,Poplatok za kartovú transakciu,,
431,,2024-05-02,-59.56,EUR,"B1795128664-44544 17** **** 4298;FACEBK* ,fb.me/ads ,IE ;01.05.2024 06:50:58 ;CashBack:0 EUR",Platba kartou,,
432,,2024-05-02,-0.25,EUR,Poplatok za platbu kartou,Poplatok za kartovú transakciu,,
433,,2024-05-02,-291.22,EUR,"B1795128657-44544 17** **** 4298;FACEBK* ,fb.me/ads ,IE ;01.05.2024 06:40:58 ;CashBack:0 EUR",Platba kartou,,
434,,2024-04-30,-5.0,EUR,Zverejňovanie účtu,Poplatok,,
435,,2024-04-30,-5.0,EUR,Poplatok za vedenie účtu,Poplatok,,
436,,2024-04-30,-0.25,EUR,Poplatok za platbu kartou,Poplatok za kartovú transakciu,,
437,,2024-04-30,-80.0,EUR,"B1793658363-44544 17** **** 5827;CHF*Adressit.com ,Helsinki ,FI ;29.04.2024 12:17:48 ;CashBack:0 EUR",Platba kartou,,
438,,2024-04-30,-3.5,EUR,"Vedenie Platobnej karty embosovanej,2315,5,Karta č. 4544 17** **** 5827Poplatok za Platobnú kartu",Kartový poplatok,,
439,,2024-04-28,-0.25,EUR,Poplatok za platbu kartou,Poplatok za kartovú transakciu,,
440,,2024-04-28,-12.0,EUR,"B1792094230-44544 17** **** 4298;FACEBK *QWE7TY3B92 ,fb.me/ads ,IE ;27.04.2024 12:57:26 ;CashBack:0 EUR",Platba kartou,,
441,,2024-04-28,-0.25,EUR,Poplatok za platbu kartou,Poplatok za kartovú transakciu,,
442,,2024-04-28,-600.0,EUR,"B1791998249-44544 17** **** 4298;FACEBK* ,fb.me/ads ,IE ;27.04.2024 17:48:19 ;CashBack:0 EUR",Platba kartou,,
443,,2024-04-28,-0.25,EUR,Poplatok za platbu kartou,Poplatok za kartovú transakciu,,
444,,2024-04-28,-10.0,EUR,"B1791986620-44544 17** **** 4298;FACEBK* ,fb.me/ads ,IE ;27.04.2024 08:43:20 ;CashBack:0 EUR",Platba kartou,,
445,,2024-04-28,-0.25,EUR,Poplatok za platbu kartou,Poplatok za kartovú transakciu,,
446,,2024-04-28,-9.0,EUR,"B1791347913-44544 17** **** 4298;FACEBK* ,fb.me/ads ,IE ;26.04.2024 23:07:24 ;CashBack:0 EUR",Platba kartou,,
447,,2024-04-28,-2.0,EUR,"B1791238747-44544 17** **** 4298;FACEBK* ,fb.me/ads ,IE ;26.04.2024 11:29:37 ;CashBack:0 EUR",Platba kartou,,
448,,2024-04-28,-0.25,EUR,Poplatok za platbu kartou,Poplatok za kartovú transakciu,,
449,,2024-04-28,-0.25,EUR,Poplatok za platbu kartou,Poplatok za kartovú transakciu,,
450,,2024-04-28,-2.0,EUR,"B1791244955-44544 17** **** 4298;FACEBK* ,fb.me/ads ,IE ;26.04.2024 09:29:26 ;CashBack:0 EUR",Platba kartou,,
451,,2024-04-28,-0.25,EUR,Poplatok za platbu kartou,Poplatok za kartovú transakciu,,
452,,2024-04-28,-2.0,EUR,"B1791244732-44544 17** **** 4298;FACEBK* ,fb.me/ads ,IE ;26.04.2024 07:38:04 ;CashBack:0 EUR",Platba kartou,,
453,,2024-04-28,-8.0,EUR,"B1791232716-44544 17** **** 4298;FACEBK *3M3NFZTA92 ,fb.me/ads ,IE ;26.04.2024 21:15:26 ;CashBack:0 EUR",Platba kartou,,
454,,2024-04-28,-0.25,EUR,Poplatok za platbu kartou,Poplatok za kartovú transakciu,,
455,,2024-04-28,-2.0,EUR,"B1791237765-44544 17** **** 4298;FACEBK* ,fb.me/ads ,IE ;26.04.2024 07:07:44 ;CashBack:0 EUR",Platba kartou,,
456,,2024-04-28,-0.25,EUR,Poplatok za platbu kartou,Poplatok za kartovú transakciu,,
457,,2024-04-28,-6.0,EUR,"B1791232526-44544 17** **** 4298;FACEBK *KQU7SY3B92 ,fb.me/ads ,IE ;26.04.2024 18:01:39 ;CashBack:0 EUR",Platba kartou,,
458,,2024-04-28,-0.25,EUR,Poplatok za platbu kartou,Poplatok za kartovú transakciu,,
459,,2024-04-28,-2.0,EUR,"B1791238529-44544 17** **** 4298;FACEBK* ,fb.me/ads ,IE ;26.04.2024 10:13:18 ;CashBack:0 EUR",Platba kartou,,
460,,2024-04-28,-0.25,EUR,Poplatok za platbu kartou,Poplatok za kartovú transakciu,,
461,,2024-04-28,-0.25,EUR,Poplatok za platbu kartou,Poplatok za kartovú transakciu,,
462,,2024-04-28,-4.0,EUR,"B1791178470-44544 17** **** 4298;FACEBK* ,fb.me/ads ,IE ;26.04.2024 14:41:36 ;CashBack:0 EUR",Platba kartou,,
463,,2024-04-28,-0.25,EUR,Poplatok za platbu kartou,Poplatok za kartovú transakciu,,
464,,2024-04-28,-3.0,EUR,"B1791109997-44544 17** **** 4298;FACEBK* ,fb.me/ads ,IE ;26.04.2024 12:32:17 ;CashBack:0 EUR",Platba kartou,,
465,,2024-04-28,-0.25,EUR,Poplatok za platbu kartou,Poplatok za kartovú transakciu,,
466,,2024-04-28,-3.0,EUR,"B1791089794-44544 17** **** 4298;FACEBK* ,fb.me/ads ,IE ;26.04.2024 13:25:42 ;CashBack:0 EUR",Platba kartou,,
467,,2024-04-28,-0.25,EUR,Poplatok za platbu kartou,Poplatok za kartovú transakciu,,
468,,2024-04-28,-0.25,EUR,Poplatok za platbu kartou,Poplatok za kartovú transakciu,,
469,,2024-04-28,-5.0,EUR,"B1791066621-44544 17** **** 4298;FACEBK *MSYUZYKB92 ,fb.me/ads ,IE ;26.04.2024 16:15:35 ;CashBack:0 EUR",Platba kartou,,
470,,2024-04-28,-0.25,EUR,Poplatok za platbu kartou,Poplatok za kartovú transakciu,,
471,,2024-04-28,-2.0,EUR,"B1791066272-44544 17** **** 4298;FACEBK *EQ5XEZTA92 ,fb.me/ads ,IE ;26.04.2024 08:44:23 ;CashBack:0 EUR",Platba kartou,,
472,,2024-04-28,-0.25,EUR,Poplatok za platbu kartou,Poplatok za kartovú transakciu,,
473,,2024-04-28,-2.0,EUR,"B1791066270-44544 17** **** 4298;FACEBK *HUQKSZXA92 ,fb.me/ads ,IE ;26.04.2024 08:08:42 ;CashBack:0 EUR",Platba kartou,,
474,,2024-04-28,-6.0,EUR,"B1791070209-44544 17** **** 4298;FACEBK* ,fb.me/ads ,IE ;26.04.2024 19:38:52 ;CashBack:0 EUR",Platba kartou,,
475,,2024-04-28,-0.25,EUR,Poplatok za platbu kartou,Poplatok za kartovú transakciu,,
476,,2024-04-28,-2.0,EUR,"B1791063679-44544 17** **** 4298;FACEBK* ,fb.me/ads ,IE ;26.04.2024 10:44:40 ;CashBack:0 EUR",Platba kartou,,
477,,2024-04-26,-0.25,EUR,Poplatok za platbu kartou,Poplatok za kartovú transakciu,,
478,,2024-04-26,-72.0,EUR,"B1790983159-44544 17** **** 4298;FACEBK* ,fb.me/ads ,IE ;26.04.2024 05:51:43 ;CashBack:0 EUR",Platba kartou,,
479,,2024-04-26,-0.25,EUR,Poplatok za platbu kartou,Poplatok za kartovú transakciu,,
480,,2024-04-26,-65.0,EUR,"B1790230314-44544 17** **** 4298;FACEBK* ,fb.me/ads ,IE ;25.04.2024 08:13:58 ;CashBack:0 EUR",Platba kartou,,
481,,2024-04-26,-0.25,EUR,"Poplatok za výber kartou,2203,5,4544 17** **** 5827;ZSE ,Bratislava ,SK ;26.04.2024 14:57:46",Poplatok za kartovú transakciu,,
482,,2024-04-26,-400.0,EUR,"B4030391285-214544 17** **** 5827;ZSE ,Bratislava ,SK ;26.04.2024 14:57:46 ",Výber kartou,,
483,X print s.r.o.,2024-04-26,-104.4,EUR,samolepky,Platobný príkaz na úhradu / FIT 2.0 (EB),240422.0,
484,,2024-04-25,-0.25,EUR,Poplatok za platbu kartou,Poplatok za kartovú transakciu,,
485,,2024-04-25,-41.6,EUR,"B1789717673-44544 17** **** 5827;POSTA BRATISLAVA 21 ,BRATISLAVA ,SK ;24.04.2024 13:33:59 ;CashBack:0 EUR",Platba kartou,,
486,,2024-04-25,-0.25,EUR,Poplatok za platbu kartou,Poplatok za kartovú transakciu,,
487,,2024-04-25,-609.6,EUR,"B1789712317-44544 17** **** 5827;POSTA BRATISLAVA 21 ,BRATISLAVA ,SK ;24.04.2024 10:09:17 ;CashBack:0 EUR",Platba kartou,,
488,,2024-04-25,-0.25,EUR,Poplatok za platbu kartou,Poplatok za kartovú transakciu,,
489,,2024-04-25,-59.0,EUR,"B1789425719-44544 17** **** 4298;FACEBK* ,fb.me/ads ,IE ;24.04.2024 12:23:33 ;CashBack:0 EUR",Platba kartou,,
490,,2024-04-25,-0.25,EUR,Poplatok za platbu kartou,Poplatok za kartovú transakciu,,
491,,2024-04-25,-53.0,EUR,"B1788630500-44544 17** **** 4298;FACEBK 8R6TAZFB92 ,fb.me/ads ,IE ;23.04.2024 19:44:30 ;CashBack:0 EUR",Platba kartou,,
492,,2024-04-25,-0.25,EUR,Poplatok za platbu kartou,Poplatok za kartovú transakciu,,
493,,2024-04-25,-48.0,EUR,"B1788514216-44544 17** **** 4298;FACEBK FZHVKY7B92 ,fb.me/ads ,IE ;23.04.2024 09:33:31 ;CashBack:0 EUR",Platba kartou,,
494,,2024-04-23,-0.25,EUR,Poplatok za platbu kartou,Poplatok za kartovú transakciu,,
495,,2024-04-23,-44.2,EUR,"B1788381665-44544 17** **** 5827;Prevadzka Sevt_25 ,Bratislava ,SK ;22.04.2024 14:01:40 ;CashBack:0 EUR",Platba kartou,,
496,,2024-04-23,-0.25,EUR,Poplatok za platbu kartou,Poplatok za kartovú transakciu,,
497,,2024-04-23,-39.0,EUR,"B1787714813-44544 17** **** 4298;FACEBK W9SKLY3B92 ,fb.me/ads ,IE ;22.04.2024 08:52:58 ;CashBack:0 EUR",Platba kartou,,
498,,2024-04-23,-0.25,EUR,Poplatok za platbu kartou,Poplatok za kartovú transakciu,,
499,,2024-04-23,-43.0,EUR,"B1787718855-44544 17** **** 4298;FACEBK BPNRDYPB92 ,fb.me/ads ,IE ;22.04.2024 18:22:38 ;CashBack:0 EUR",Platba kartou,,
500,Mesto Humenné,2024-04-23,-192.15,EUR,daň za užívanie priestranstva,Platobný príkaz na úhradu / FIT 2.0 (EB),1500085732.0,
501,Mesto Nitra,2024-04-23,-120.0,EUR,správny poplatok,Platobný príkaz na úhradu / FIT 2.0 (EB),221004.0,
502,,2024-04-22,-0.25,EUR,Poplatok za platbu kartou,Poplatok za kartovú transakciu,,
503,,2024-04-22,-35.0,EUR,"B1787191518-44544 17** **** 4298;FACEBK VUF69ZTA92 ,fb.me/ads ,IE ;21.04.2024 19:31:58 ;CashBack:0 EUR",Platba kartou,,
504,,2024-04-22,-0.25,EUR,Poplatok za platbu kartou,Poplatok za kartovú transakciu,,
505,,2024-04-22,-31.0,EUR,"B1787170695-44544 17** **** 4298;FACEBK AZQMHY7B92 ,fb.me/ads ,IE ;21.04.2024 12:22:35 ;CashBack:0 EUR",Platba kartou,,
506,,2024-04-21,-0.25,EUR,Poplatok za platbu kartou,Poplatok za kartovú transakciu,,
507,,2024-04-21,-28.0,EUR,"B1786813753-44544 17** **** 4298;FACEBK GBRYKZXA92 ,fb.me/ads ,IE ;21.04.2024 01:00:00 ;CashBack:0 EUR",Platba kartou,,
508,,2024-04-21,-0.25,EUR,Poplatok za platbu kartou,Poplatok za kartovú transakciu,,
509,,2024-04-21,-22.0,EUR,"B1786459367-44544 17** **** 4298;FACEBK HXWGGY7B92 ,fb.me/ads ,IE ;20.04.2024 12:17:16 ;CashBack:0 EUR",Platba kartou,,
510,,2024-04-21,-0.25,EUR,Poplatok za platbu kartou,Poplatok za kartovú transakciu,,
511,,2024-04-21,-25.0,EUR,"B1786460314-44544 17** **** 4298;FACEBK JW6TGY7B92 ,fb.me/ads ,IE ;20.04.2024 18:11:59 ;CashBack:0 EUR",Platba kartou,,
512,,2024-04-21,-0.25,EUR,Poplatok za platbu kartou,Poplatok za kartovú transakciu,,
513,,2024-04-21,-18.0,EUR,"B1786439416-44544 17** **** 4298;FACEBK WA32PYBB92 ,fb.me/ads ,IE ;20.04.2024 06:26:58 ;CashBack:0 EUR",Platba kartou,,
514,,2024-04-21,-0.25,EUR,Poplatok za platbu kartou,Poplatok za kartovú transakciu,,
515,,2024-04-21,-8.0,EUR,"B1785644956-44544 17** **** 4298;FACEBK SYMR5ZFB92 ,fb.me/ads ,IE ;19.04.2024 15:51:31 ;CashBack:0 EUR",Platba kartou,,
516,,2024-04-21,-0.25,EUR,Poplatok za platbu kartou,Poplatok za kartovú transakciu,,
517,,2024-04-21,-15.0,EUR,"B1785620299-44544 17** **** 4298;FACEBK WWZVWYTB92 ,fb.me/ads ,IE ;19.04.2024 22:55:38 ;CashBack:0 EUR",Platba kartou,,
518,,2024-04-21,-0.25,EUR,Poplatok za platbu kartou,Poplatok za kartovú transakciu,,
519,,2024-04-21,-2.0,EUR,"B1785614124-44544 17** **** 4298;FACEBK F7Y3FY7B92 ,fb.me/ads ,IE ;19.04.2024 09:25:57 ;CashBack:0 EUR",Platba kartou,,
520,,2024-04-21,-0.25,EUR,Poplatok za platbu kartou,Poplatok za kartovú transakciu,,
521,,2024-04-21,-0.25,EUR,Poplatok za platbu kartou,Poplatok za kartovú transakciu,,
522,,2024-04-21,-2.0,EUR,"B1785613397-44544 17** **** 4298;FACEBK NVVWGY3B92 ,fb.me/ads ,IE ;19.04.2024 07:22:25 ;CashBack:0 EUR",Platba kartou,,
523,,2024-04-21,-2.0,EUR,"B1785617775-44544 17** **** 4298;FACEBK MH426ZTA92 ,fb.me/ads ,IE ;19.04.2024 06:26:15 ;CashBack:0 EUR",Platba kartou,,
524,,2024-04-21,-0.25,EUR,Poplatok za platbu kartou,Poplatok za kartovú transakciu,,
525,,2024-04-21,-6.0,EUR,"B1785505379-44544 17** **** 4298;FACEBK M38Y9YPB92 ,fb.me/ads ,IE ;19.04.2024 13:48:32 ;CashBack:0 EUR",Platba kartou,,
526,,2024-04-21,-0.25,EUR,Poplatok za platbu kartou,Poplatok za kartovú transakciu,,
527,,2024-04-21,-2.0,EUR,"B1785509490-44544 17** **** 4298;FACEBK 7LBPQYKB92 ,fb.me/ads ,IE ;19.04.2024 08:47:02 ;CashBack:0 EUR",Platba kartou,,
528,,2024-04-21,-12.0,EUR,"B1785477019-44544 17** **** 4298;FACEBK EX5DAYPB92 ,fb.me/ads ,IE ;19.04.2024 20:58:04 ;CashBack:0 EUR",Platba kartou,,
529,,2024-04-21,-0.25,EUR,Poplatok za platbu kartou,Poplatok za kartovú transakciu,,
530,,2024-04-21,-0.25,EUR,Poplatok za platbu kartou,Poplatok za kartovú transakciu,,
531,,2024-04-21,-3.0,EUR,"B1785430278-44544 17** **** 4298;FACEBK EMZ76ZTA92 ,fb.me/ads ,IE ;19.04.2024 10:08:32 ;CashBack:0 EUR",Platba kartou,,
532,,2024-04-21,-0.25,EUR,Poplatok za platbu kartou,Poplatok za kartovú transakciu,,
533,,2024-04-21,-2.0,EUR,"B1785428974-44544 17** **** 4298;FACEBK CRKYGY3B92 ,fb.me/ads ,IE ;19.04.2024 08:25:38 ;CashBack:0 EUR",Platba kartou,,
534,,2024-04-21,-0.25,EUR,Poplatok za platbu kartou,Poplatok za kartovú transakciu,,
535,,2024-04-21,-0.25,EUR,Poplatok za platbu kartou,Poplatok za kartovú transakciu,,
536,,2024-04-21,-2.0,EUR,"B1785388484-44544 17** **** 4298;FACEBK DBQXGY3B92 ,fb.me/ads ,IE ;19.04.2024 07:53:06 ;CashBack:0 EUR",Platba kartou,,
537,,2024-04-21,-5.0,EUR,"B1785394516-44544 17** **** 4298;FACEBK TQ8K5ZFB92 ,fb.me/ads ,IE ;19.04.2024 12:16:46 ;CashBack:0 EUR",Platba kartou,,
538,,2024-04-21,-0.25,EUR,Poplatok za platbu kartou,Poplatok za kartovú transakciu,,
539,,2024-04-21,-4.0,EUR,"B1785391239-44544 17** **** 4298;FACEBK R4U8WYTB92 ,fb.me/ads ,IE ;19.04.2024 11:03:21 ;CashBack:0 EUR",Platba kartou,,
540,,2024-04-21,-0.25,EUR,Poplatok za platbu kartou,Poplatok za kartovú transakciu,,
541,,2024-04-21,-2.0,EUR,"B1785380058-44544 17** **** 4298;FACEBK MDW26ZTA92 ,fb.me/ads ,IE ;19.04.2024 06:57:10 ;CashBack:0 EUR",Platba kartou,,
542,,2024-04-21,-0.25,EUR,Poplatok za platbu kartou,Poplatok za kartovú transakciu,,
543,,2024-04-21,-9.0,EUR,"B1785379851-44544 17** **** 4298;FACEBK WXXDJZXA92 ,fb.me/ads ,IE ;19.04.2024 17:53:55 ;CashBack:0 EUR",Platba kartou,,
544,,2024-04-21,-0.25,EUR,Poplatok za platbu kartou,Poplatok za kartovú transakciu,,
545,,2024-04-21,-10.0,EUR,"B1785376533-44544 17** **** 4298;FACEBK V5SAAYPB92 ,fb.me/ads ,IE ;19.04.2024 19:39:04 ;CashBack:0 EUR",Platba kartou,,
546,,2024-04-19,-0.25,EUR,Poplatok za platbu kartou,Poplatok za kartovú transakciu,,
547,,2024-04-19,-2.0,EUR,"B1785308937-44544 17** **** 4298;FACEBK LA5J9YPB92 ,fb.me/ads ,IE ;19.04.2024 05:14:49 ;CashBack:0 EUR",Platba kartou,,
548,,2024-04-19,-0.25,EUR,Poplatok za platbu kartou,Poplatok za kartovú transakciu,,
549,,2024-04-19,-5.61,EUR,"B1785247278-44544 17** **** 5827;Prevadzka Sevt_25 ,Bratislava ,SK ;18.04.2024 15:14:14 ;CashBack:0 EUR",Platba kartou,,
550,,2024-04-19,-0.25,EUR,Poplatok za platbu kartou,Poplatok za kartovú transakciu,,
551,,2024-04-19,-2.0,EUR,"B1784658090-44544 17** **** 4298;FACEBK 3AXHGY3B92 ,fb.me/ads ,IE ;18.04.2024 23:12:59 ;CashBack:0 EUR",Platba kartou,,
552,,2024-04-19,-0.25,EUR,Poplatok za platbu kartou,Poplatok za kartovú transakciu,,
553,,2024-04-19,-2.0,EUR,"B1784657652-44544 17** **** 4298;FACEBK 2NAR4ZFB92 ,fb.me/ads ,IE ;18.04.2024 20:16:01 ;CashBack:0 EUR",Platba kartou,,
554,,2024-04-19,-0.25,EUR,Poplatok za platbu kartou,Poplatok za kartovú transakciu,,
555,,2024-04-19,-2.0,EUR,"B1784657650-44544 17** **** 4298;FACEBK QMU99YPB92 ,fb.me/ads ,IE ;18.04.2024 23:59:34 ;CashBack:0 EUR",Platba kartou,,
556,,2024-04-19,-0.25,EUR,Poplatok za platbu kartou,Poplatok za kartovú transakciu,,
557,,2024-04-19,-2.0,EUR,"B1784657466-44544 17** **** 4298;FACEBK CBW9MYBB92 ,fb.me/ads ,IE ;18.04.2024 20:42:19 ;CashBack:0 EUR",Platba kartou,,
558,,2024-04-19,-0.25,EUR,Poplatok za platbu kartou,Poplatok za kartovú transakciu,,
559,,2024-04-19,-2.0,EUR,"B1784657221-44544 17** **** 4298;FACEBK 89TBMYBB92 ,fb.me/ads ,IE ;18.04.2024 21:51:31 ;CashBack:0 EUR",Platba kartou,,
560,,2024-04-19,-0.25,EUR,Poplatok za platbu kartou,Poplatok za kartovú transakciu,,
561,,2024-04-19,-6.0,EUR,"B1784523887-44544 17** **** 4298;FACEBK 45JSFY3B92 ,fb.me/ads ,IE ;18.04.2024 09:22:47 ;CashBack:0 EUR",Platba kartou,,
562,,2024-04-19,-0.25,EUR,Poplatok za platbu kartou,Poplatok za kartovú transakciu,,
563,,2024-04-19,-8.0,EUR,"B1784529582-44544 17** **** 4298;FACEBK 882TPYKB92 ,fb.me/ads ,IE ;18.04.2024 15:49:04 ;CashBack:0 EUR",Platba kartou,,
564,,2024-04-18,-0.25,EUR,Poplatok za platbu kartou,Poplatok za kartovú transakciu,,
565,,2024-04-18,-5.0,EUR,"B1783702902-44544 17** **** 4298;FACEBK T974LYBB92 ,fb.me/ads ,IE ;17.04.2024 21:57:11 ;CashBack:0 EUR",Platba kartou,,
566,,2024-04-18,-0.25,EUR,Poplatok za platbu kartou,Poplatok za kartovú transakciu,,
567,,2024-04-18,-2.0,EUR,"B1783653463-44544 17** **** 4298;FACEBK 2NXKCY7B92 ,fb.me/ads ,IE ;17.04.2024 08:54:44 ;CashBack:0 EUR",Platba kartou,,
568,,2024-04-18,-0.25,EUR,Poplatok za platbu kartou,Poplatok za kartovú transakciu,,
569,,2024-04-18,-4.0,EUR,"B1783636736-44544 17** **** 4298;FACEBK 96PPNYKB92 ,fb.me/ads ,IE ;17.04.2024 18:40:32 ;CashBack:0 EUR",Platba kartou,,
570,,2024-04-18,-0.25,EUR,Poplatok za platbu kartou,Poplatok za kartovú transakciu,,
571,,2024-04-18,-2.0,EUR,"B1783631151-44544 17** **** 4298;FACEBK 8EWGCY7B92 ,fb.me/ads ,IE ;17.04.2024 07:00:03 ;CashBack:0 EUR",Platba kartou,,
572,,2024-04-18,-0.25,EUR,Poplatok za platbu kartou,Poplatok za kartovú transakciu,,
573,,2024-04-18,-3.0,EUR,"B1783575910-44544 17** **** 4298;FACEBK XJ4F7YPB92 ,fb.me/ads ,IE ;17.04.2024 12:39:04 ;CashBack:0 EUR",Platba kartou,,
574,,2024-04-18,-0.25,EUR,Poplatok za platbu kartou,Poplatok za kartovú transakciu,,
575,,2024-04-18,-2.0,EUR,"B1783575851-44544 17** **** 4298;FACEBK WRRMEY3B92 ,fb.me/ads ,IE ;17.04.2024 11:13:59 ;CashBack:0 EUR",Platba kartou,,
576,,2024-04-18,-0.25,EUR,Poplatok za platbu kartou,Poplatok za kartovú transakciu,,
577,,2024-04-18,-3.0,EUR,"B1783581237-44544 17** **** 4298;FACEBK MU393ZFB92 ,fb.me/ads ,IE ;17.04.2024 15:30:53 ;CashBack:0 EUR",Platba kartou,,
578,F&LCreative s.r.o.,2024-04-18,-600.0,EUR,nahrávanie audio programu,Platobný príkaz na úhradu / FIT 2.0 (EB),2401100024.0,
579,DCin s.r.o.,2024-04-18,-600.0,EUR,nahrávanie zvukového záznamu,Platobný príkaz na úhradu / FIT 2.0 (EB),202400014.0,
580,ozdravme s.r.o.,2024-04-18,-1000.0,EUR,bannerová reklama,Platobný príkaz na úhradu / FIT 2.0 (EB),2401009.0,
581,,2024-04-18,-0.25,EUR,Poplatok za platbu kartou,Poplatok za kartovú transakciu,,
582,,2024-04-18,-2.0,EUR,"B1783483765-44544 17** **** 4298;FACEBK 5Q26KYBB92 ,fb.me/ads ,IE ;17.04.2024 03:48:40 ;CashBack:0 EUR",Platba kartou,,
583,,2024-04-18,-0.25,EUR,Poplatok za platbu kartou,Poplatok za kartovú transakciu,,
584,,2024-04-18,-2.0,EUR,"B1783488090-44544 17** **** 4298;FACEBK MVQ2KYBB92 ,fb.me/ads ,IE ;17.04.2024 01:28:50 ;CashBack:0 EUR",Platba kartou,,
585,,2024-04-18,-0.25,EUR,Poplatok za platbu kartou,Poplatok za kartovú transakciu,,
586,,2024-04-18,-2.0,EUR,"B1783469780-44544 17** **** 4298;FACEBK 8K9DCY7B92 ,fb.me/ads ,IE ;17.04.2024 04:44:23 ;CashBack:0 EUR",Platba kartou,,
587,,2024-04-18,-0.25,EUR,Poplatok za platbu kartou,Poplatok za kartovú transakciu,,
588,,2024-04-18,-2.0,EUR,"B1782883197-44544 17** **** 4298;FACEBK 68ME2ZFB92 ,fb.me/ads ,IE ;16.04.2024 23:14:41 ;CashBack:0 EUR",Platba kartou,,
589,,2024-04-18,-0.25,EUR,Poplatok za platbu kartou,Poplatok za kartovú transakciu,,
590,,2024-04-18,-2.0,EUR,"B1782881811-44544 17** **** 4298;FACEBK WKKXJYBB92 ,fb.me/ads ,IE ;16.04.2024 22:53:32 ;CashBack:0 EUR",Platba kartou,,
591,Zoznam s.r.o.,2024-04-17,-18090.0,EUR,inzercia topky,Platobný príkaz na úhradu / FIT 2.0 (EB),24000163.0,
592,Ribida s.r.o.,2024-04-17,-5802.0,EUR,propagačné materiály a fotenie kandidátov,Platobný príkaz na úhradu / FIT 2.0 (EB),20240001.0,
593,ARTON s.r.o.,2024-04-17,-1968.0,EUR,"tlač plagátov, 164 ks",Platobný príkaz na úhradu / FIT 2.0 (EB),240150.0,
594,ARTON s.r.o.,2024-04-17,-19483.2,EUR,"prenájom bilboardy, 164ks, 5/24",Platobný príkaz na úhradu / FIT 2.0 (EB),240149.0,
595,ARTON s.r.o.,2024-04-17,-6480.0,EUR,"NáJOM BIGBOARDY, 9KS, 5/24",Platobný príkaz na úhradu / FIT 2.0 (EB),240148.0,
596,,2024-04-13,-0.25,EUR,Poplatok za platbu kartou,Poplatok za kartovú transakciu,,
597,,2024-04-13,-9.1,EUR,"B1779597377-44544 17** **** 5827;POSTA BRATISLAVA 21 ,BRATISLAVA ,SK ;12.04.2024 12:05:28 ;CashBack:0 EUR",Platba kartou,,
598,,2024-04-13,-0.25,EUR,Poplatok za platbu kartou,Poplatok za kartovú transakciu,,
599,,2024-04-13,-64.4,EUR,"B1778553324-44544 17** **** 5827;POSTA BRATISLAVA 21 ,BRATISLAVA ,SK ;11.04.2024 10:46:21 ;CashBack:0 EUR",Platba kartou,,
600,Polygrafické centrum s.r.o.,2024-04-12,-5520.0,EUR,záloha volebné noviny,Platobný príkaz na úhradu / FIT 2.0 (EB),403000031.0,
601,NEXT Film s.r.o.,2024-04-10,-720.0,EUR,natáčanie europrogramu,Platobný príkaz na úhradu / FIT 2.0 (EB),2024025.0,
602,Bittner print,2024-04-10,-3594.0,EUR,"tlač brožúry, 1000 ks",Platobný príkaz na úhradu / FIT 2.0 (EB),1020241517.0,
603,euroAWK spol. s.r.o.,2024-04-10,-1284.0,EUR,"CLV 20 ks, apríl",Platobný príkaz na úhradu / FIT 2.0 (EB),2470026.0,
604,Hl. m. SR Bratislava,2024-04-05,-80.0,EUR,zabratie verejného priestranstva,Platobný príkaz na úhradu / FIT 2.0 (EB),2241331167.0,
605,NUBIUM s.r.o.,2024-04-03,-68840.4,EUR,"prenájom bigboardy + inštalacia 10 ks, bilboardy 333 ks+ tlač, apríl 2024",Platobný príkaz na úhradu / FIT 2.0 (EB),24042272.0,
606,,2024-03-31,-5.0,EUR,Zverejňovanie účtu,Poplatok,,
607,,2024-03-31,-5.0,EUR,Poplatok za vedenie účtu,Poplatok,,
608,,2024-03-31,-2.6,EUR,"Vedenie Platobnej karty embosovanej,2315,5,Karta č. 4544 17** **** 5827Poplatok za Platobnú kartu",Kartový poplatok,,
609,Maros Mjartan,2024-03-30,1.0,EUR,Drzim palceky ..,Bezhotovostný vklad - okamžitá platba,,
610,Mesto Trnava,2024-03-27,-240.0,EUR,,Platobný príkaz na úhradu / FIT 2.0 (EB),5000300609.0,
611,ARTON s.r.o.,2024-03-08,-6480.0,EUR,"nájomné bigboardy, 9 ks 4/24",Platobný príkaz na úhradu / FIT 2.0 (EB),240084.0,
612,ARTON s.r.o.,2024-03-08,-5400.0,EUR,"tlač a inštalácia bigboardov,9 ks",Platobný príkaz na úhradu / FIT 2.0 (EB),240085.0,
613,ARTON s.r.o.,2024-03-08,-25423.2,EUR,"nájomné bilboardov, 214 ks, 4/24",Platobný príkaz na úhradu / FIT 2.0 (EB),240086.0,
614,ARTON s.r.o.,2024-03-08,-2568.0,EUR,tlač bilboardov 214 ks,Platobný príkaz na úhradu / FIT 2.0 (EB),240087.0,
615,,2024-02-29,-5.0,EUR,Zverejňovanie účtu,Poplatok,,
616,,2024-02-29,-5.0,EUR,Poplatok za vedenie účtu,Poplatok,,
617,Lukáš Marcinko,2024-02-29,-2500.0,EUR,"websupport a web design, SSL certif",Platobný príkaz na úhradu / FIT 2.0 (EB),2024061.0,
618,Ministerstvo vnútra,2024-02-29,-1700.0,EUR,uhrada kaucie,Platobný príkaz na úhradu / FIT 2.0 (EB),42139333.0,
619,LK Studio s.r.o.,2024-02-28,-1800.0,EUR,fotografické práce,Platobný príkaz na úhradu / FIT 2.0 (EB),20240005.0,
620,CONFIDENCE MEDIA SR s.r.o.,2024-02-12,-6403.2,EUR,"prenájom bilboardov, citylightov, bigboard",Platobný príkaz na úhradu / FIT 2.0 (EB),2421020.0,
621,Sloboda a Solidarita (SaS),2024-02-02,500000.0,EUR,presun prostriedkov na kampaň,Bezhotovostný vklad,,
622,,2024-01-31,-5.0,EUR,Zverejňovanie účtu,Poplatok,,
623,,2024-01-31,-1.61,EUR,Poplatok za vedenie účtu,Poplatok,,
624,Bačák Juraj,2024-01-27,0.01,EUR,Prispevok na drahy alkohol v Dubaji .,Bezhotovostný vklad - okamžitá platba,,
625,Sloboda a Solidarita (SaS),2024-01-23,200.0,EUR,presun prostriedkov,Bezhotovostný vklad,,