index,account_name,date,amount,currency,message,tx_type,vs,ss
0,Finančné riaditeľstvo Slovenskej republiky ICO: 42,2024-07-23,-3383.13,EUR,DPH 6/2024,Platobný príkaz na úhradu / FIT 2.0 (EB),1100062024.0,
1,MARATÓN s.r.o. ICO:36570796,2024-07-17,-1000.0,EUR,prenajom priestorov,Platobný príkaz na úhradu / FIT 2.0 (EB),2024000132.0,
2,DigiSkilly s.r.o. ICO: 55632165,2024-07-03,-3408.0,EUR,Online marketing,Platobný príkaz na úhradu / FIT 2.0 (EB),2024000027.0,
3,"VIA MOBILE, s.r.o. ICO: 44633521",2024-07-03,-5671.31,EUR,SMS system,Platobný príkaz na úhradu / FIT 2.0 (EB),2430484.0,
4,,2024-06-30,-5.0,EUR,Zverejňovanie účtu,Poplatok,,
5,,2024-06-30,-5.0,EUR,Poplatok za vedenie účtu,Poplatok,,
6,,2024-06-30,-3.5,EUR,"Vedenie Platobnej karty embosovanej,2315,5,Karta č. 4544 17** **** 6461Poplatok za Platobnú kartu",Kartový poplatok,,
7,Matěj Horník ICO: 52206572,2024-06-26,-330.0,EUR,Socialne siete,Platobný príkaz na úhradu / FIT 2.0 (EB),724.0,
8,Martin Bagar ICO: 50355031,2024-06-26,-864.0,EUR,Audio-vizualne sluzby,Platobný príkaz na úhradu / FIT 2.0 (EB),20240008.0,
9,"SofiaCare, s.r.o. ICO: 50044982",2024-06-26,-2500.0,EUR,Marketingove sluzby,Platobný príkaz na úhradu / FIT 2.0 (EB),2024012.0,
10,frensia s.r.o. ICO: 52934560,2024-06-26,-400.0,EUR,Audiovizualne sluzby,Platobný príkaz na úhradu / FIT 2.0 (EB),2024008.0,
11,frensia s.r.o. ICO: 52934560,2024-06-26,-1430.0,EUR,Audiovizualne sluzby,Platobný príkaz na úhradu / FIT 2.0 (EB),2024006.0,
12,Ing. Michal Pročko ICO: 52224031,2024-06-25,-1620.0,EUR,Audio-vizualne sluzby,Platobný príkaz na úhradu / FIT 2.0 (EB),22062024.0,
13,"SLOVNAFT, a.s. ICO: 31322832",2024-06-25,-1045.43,EUR,PHM,Platobný príkaz na úhradu / FIT 2.0 (EB),3082103153.0,
14,Ringier Slovakia Media s.r.o. ICO: 53708792,2024-06-25,-2282.4,EUR,Online kampaň,Platobný príkaz na úhradu / FIT 2.0 (EB),3824900779.0,
15,Palenik Robert ICO: 41888863,2024-06-25,-345.6,EUR,preprava,Platobný príkaz na úhradu / FIT 2.0 (EB),20241090.0,
16,"Regionpress s.r.o, IČO: 36252417",2024-06-24,-7296.66,EUR,inzercia,Platobný príkaz na úhradu / FIT 2.0 (EB),336240021.0,
17,"Regionpress s.r.o, IČO: 36252417",2024-06-24,-7037.48,EUR,inzercia,Platobný príkaz na úhradu / FIT 2.0 (EB),336240017.0,
18,"Regionpress s.r.o, IČO: 36252417",2024-06-24,-7210.27,EUR,inzercia,Platobný príkaz na úhradu / FIT 2.0 (EB),336240023.0,
19,Finančné riaditeľstvo SR ICO: 42499500,2024-06-24,-2837.09,EUR,DPH 5/2024,Platobný príkaz na úhradu / FIT 2.0 (EB),1100052024.0,
20,SLOVENSKO,2024-06-21,50000.0,EUR,prevod na TU,Bezhotovostný vklad,11.0,
21,Radoslav Hajnoš ICO: 55238416,2024-06-19,-1000.0,EUR,video produkcia,Platobný príkaz na úhradu / FIT 2.0 (EB),2024023.0,
22,PTA spol. s.r.o. ICO: 36680958,2024-06-19,-6471.84,EUR,merch,Platobný príkaz na úhradu / FIT 2.0 (EB),24060701.0,
23,,2024-06-15,-0.25,EUR,Poplatok za platbu kartou,Poplatok za kartovú transakciu,,
24,,2024-06-15,-112.2,EUR,"B1830352628-44544 17** **** 6916;FACEBK *59XYB5YYT2 ,fb.me/ads ,IE ;13.06.2024 15:29:21 ;CashBack:0 EUR",Platba kartou,,
25,"FAMI s.r.o., IČO:36319970",2024-06-13,-939.6,EUR,Tlacoviny,Platobný príkaz na úhradu / FIT 2.0 (EB),240300175.0,
26,"DT- SMART s.r.o., IČO:46777555",2024-06-13,-631.7,EUR,Prenajom priestorov,Platobný príkaz na úhradu / FIT 2.0 (EB),1324003.0,
27,"Mestské kultúrne stredisko Revúca, IČO:00138789",2024-06-13,-150.0,EUR,Prenajom priestorov,Platobný príkaz na úhradu / FIT 2.0 (EB),240031.0,
28,"JML Spol. s.r.o., IČO:50734598",2024-06-13,-120.0,EUR,Prenajom priestorov,Platobný príkaz na úhradu / FIT 2.0 (EB),2024003.0,
29,"Mesto Senica, IČO:00309974",2024-06-13,-75.0,EUR,Miestna dan,Platobný príkaz na úhradu / FIT 2.0 (EB),1500015392.0,
30,Matěj Horník ICO: 52206572,2024-06-13,-2200.0,EUR,Socialne siete,Platobný príkaz na úhradu / FIT 2.0 (EB),624.0,
31,,2024-06-09,-0.25,EUR,Poplatok za platbu kartou,Poplatok za kartovú transakciu,,
32,,2024-06-09,-17.11,EUR,"B1825229885-44544 17** **** 6461;FACEBK *ME47R5L7S2 ,fb.me/ads ,IE ;07.06.2024 06:53:22 ;CashBack:0 EUR",Platba kartou,,
33,,2024-06-07,-11.63,EUR,"B1824369890-44544 17** **** 6916;PREDAJNA MIER ,SPISSKA NOVA ,SK ;05.06.2024 12:31:06 ;CashBack:0 EUR",Platba kartou,,
34,,2024-06-07,-0.25,EUR,Poplatok za platbu kartou,Poplatok za kartovú transakciu,,
35,,2024-06-07,-0.25,EUR,Poplatok za platbu kartou,Poplatok za kartovú transakciu,,
36,,2024-06-07,-662.1,EUR,"B1824329853-44544 17** **** 6461;FACEBK *5MWYM5U6S2 ,fb.me/ads ,IE ;06.06.2024 06:58:51 ;CashBack:0 EUR",Platba kartou,,
37,,2024-06-06,-0.25,EUR,Poplatok za platbu kartou,Poplatok za kartovú transakciu,,
38,,2024-06-06,-30.71,EUR,"B1824292658-44544 17** **** 6916;Masiaren ,Spisska Nova ,SK ;05.06.2024 12:40:45 ;CashBack:0 EUR",Platba kartou,,
39,,2024-06-06,-0.25,EUR,Poplatok za platbu kartou,Poplatok za kartovú transakciu,,
40,,2024-06-06,-52.78,EUR,"B1823620129-44544 17** **** 6916;MILK-AGRO, S.R.O. ,SPISSKA NOVA ,SK ;05.06.2024 12:37:38 ;CashBack:0 EUR",Platba kartou,,
41,,2024-06-06,-0.25,EUR,Poplatok za platbu kartou,Poplatok za kartovú transakciu,,
42,,2024-06-06,-500.0,EUR,"B1823575820-44544 17** **** 6916;FACEBK *GJWRE5C7S2 ,fb.me/ads ,IE ;05.06.2024 15:54:00 ;CashBack:0 EUR",Platba kartou,,
43,,2024-06-06,-0.25,EUR,Poplatok za platbu kartou,Poplatok za kartovú transakciu,,
44,,2024-06-06,-500.0,EUR,"B1823570383-44544 17** **** 6916;FACEBK *HNBLY587S2 ,fb.me/ads ,IE ;05.06.2024 06:12:17 ;CashBack:0 EUR",Platba kartou,,
45,,2024-06-06,-0.25,EUR,Poplatok za platbu kartou,Poplatok za kartovú transakciu,,
46,,2024-06-06,-200.0,EUR,"B1823541060-44544 17** **** 6916;FACEBK *SCWNG58ZT2 ,fb.me/ads ,IE ;05.06.2024 13:15:15 ;CashBack:0 EUR",Platba kartou,,
47,,2024-06-06,-0.25,EUR,Poplatok za platbu kartou,Poplatok za kartovú transakciu,,
48,,2024-06-06,-200.0,EUR,"B1823540884-44544 17** **** 6916;FACEBK *U4ZPC5CZT2 ,fb.me/ads ,IE ;05.06.2024 07:48:22 ;CashBack:0 EUR",Platba kartou,,
49,,2024-06-06,-0.25,EUR,Poplatok za platbu kartou,Poplatok za kartovú transakciu,,
50,,2024-06-06,-500.0,EUR,"B1823544266-44544 17** **** 6916;FACEBK *DRZMN5L7S2 ,fb.me/ads ,IE ;05.06.2024 13:00:31 ;CashBack:0 EUR",Platba kartou,,
51,,2024-06-06,-0.25,EUR,Poplatok za platbu kartou,Poplatok za kartovú transakciu,,
52,,2024-06-06,-500.0,EUR,"B1823541943-44544 17** **** 6916;FACEBK *4W8RL5U6S2 ,fb.me/ads ,IE ;05.06.2024 10:42:57 ;CashBack:0 EUR",Platba kartou,,
53,,2024-06-06,-0.25,EUR,Poplatok za platbu kartou,Poplatok za kartovú transakciu,,
54,,2024-06-06,-500.0,EUR,"B1823520744-44544 17** **** 6916;FACEBK *7EP2W5Y6S2 ,fb.me/ads ,IE ;05.06.2024 09:35:18 ;CashBack:0 EUR",Platba kartou,,
55,,2024-06-06,-0.25,EUR,Poplatok za platbu kartou,Poplatok za kartovú transakciu,,
56,,2024-06-06,-624.27,EUR,"B1823514621-44544 17** **** 6461;FACEBK *PLBZN5L7S2 ,fb.me/ads ,IE ;05.06.2024 18:53:50 ;CashBack:0 EUR",Platba kartou,,
57,,2024-06-06,-0.25,EUR,Poplatok za platbu kartou,Poplatok za kartovú transakciu,,
58,,2024-06-06,-0.25,EUR,Poplatok za platbu kartou,Poplatok za kartovú transakciu,,
59,,2024-06-06,-500.0,EUR,"B1823507125-44544 17** **** 6916;FACEBK *T5AJE5C7S2 ,fb.me/ads ,IE ;05.06.2024 11:55:29 ;CashBack:0 EUR",Platba kartou,,
60,,2024-06-06,-500.0,EUR,"B1823514217-44544 17** **** 6916;FACEBK *8NTDN5L7S2 ,fb.me/ads ,IE ;05.06.2024 08:36:05 ;CashBack:0 EUR",Platba kartou,,
61,,2024-06-06,-0.25,EUR,Poplatok za platbu kartou,Poplatok za kartovú transakciu,,
62,,2024-06-06,-500.0,EUR,"B1823506718-44544 17** **** 6916;FACEBK *QB4XV5Y6S2 ,fb.me/ads ,IE ;05.06.2024 07:34:11 ;CashBack:0 EUR",Platba kartou,,
63,,2024-06-06,-0.25,EUR,Poplatok za platbu kartou,Poplatok za kartovú transakciu,,
64,,2024-06-06,-500.0,EUR,"B1823506379-44544 17** **** 6916;FACEBK *CQXPN5L7S2 ,fb.me/ads ,IE ;05.06.2024 14:01:30 ;CashBack:0 EUR",Platba kartou,,
65,,2024-06-06,-0.25,EUR,Poplatok za platbu kartou,Poplatok za kartovú transakciu,,
66,,2024-06-06,-500.0,EUR,"B1823518043-44544 17** **** 6916;FACEBK *AV9H26U7S2 ,fb.me/ads ,IE ;05.06.2024 16:44:14 ;CashBack:0 EUR",Platba kartou,,
67,,2024-06-06,-0.25,EUR,Poplatok za platbu kartou,Poplatok za kartovú transakciu,,
68,,2024-06-06,-500.0,EUR,"B1823518009-44544 17** **** 6916;FACEBK *CGWD26U7S2 ,fb.me/ads ,IE ;05.06.2024 15:01:16 ;CashBack:0 EUR",Platba kartou,,
69,,2024-06-06,-0.25,EUR,Poplatok za platbu kartou,Poplatok za kartovú transakciu,,
70,,2024-06-06,-200.0,EUR,"B1823478365-44544 17** **** 6461;FACEBK *SFS6K5QYT2 ,fb.me/ads ,IE ;05.06.2024 19:13:09 ;CashBack:0 EUR",Platba kartou,,
71,Mgr. Branislav Gigac ICO: 55086217,2024-06-06,-2800.0,EUR,Prace na kampani,Platobný príkaz na úhradu / FIT 2.0 (EB),2024030004.0,
72,Tatiana Malyszka ICO: 51974983,2024-06-06,-60.01,EUR,Prenajom priestorov,Platobný príkaz na úhradu / FIT 2.0 (EB),20240026.0,
73,ferix s.r.o. ICO: 46778888,2024-06-06,-1000.0,EUR,Reklamny polep,Platobný príkaz na úhradu / FIT 2.0 (EB),20240087.0,
74,"Chilli Peppers, s.r.o. ICO: 45354972",2024-06-06,-4320.01,EUR,Graficke prace,Platobný príkaz na úhradu / FIT 2.0 (EB),232024.0,
75,Mesto Zvolen ICO: 00320439,2024-06-06,-20.0,EUR,Miestna dan,Platobný príkaz na úhradu / FIT 2.0 (EB),1010179824.0,
76,"PUBLISHING HOUSE, a.s. ICO: 46495959",2024-06-06,-1200.0,EUR,Medialna prezentacia,Platobný príkaz na úhradu / FIT 2.0 (EB),900240207.0,
77,Trbišovské hotelové družstvo ICO: 53244656,2024-06-06,-237.5,EUR,Prenajom priestorov,Platobný príkaz na úhradu / FIT 2.0 (EB),1020240094.0,
78,PhDr. Peter Dojčan - D-CREO ICO: 48063142,2024-06-06,-3000.0,EUR,Graficke prace,Platobný príkaz na úhradu / FIT 2.0 (EB),20240005.0,
79,Technické služby mesta Trebišov ICO.00188433,2024-06-06,-259.5,EUR,Ubytovanie,Platobný príkaz na úhradu / FIT 2.0 (EB),202400356.0,
80,191tech s.r.o. ICO:43857965,2024-06-06,-696.0,EUR,Prenajom priestorov,Platobný príkaz na úhradu / FIT 2.0 (EB),191240006.0,
81,Villa Plaza Boutique Hotel & Spa ICO: 31652239,2024-06-06,-1199.9,EUR,Ubytovanie,Platobný príkaz na úhradu / FIT 2.0 (EB),2442000197.0,
82,"MAXIM 2001, s.r.o. ICO: 35797118",2024-06-06,-300.0,EUR,Prenajom priestorov,Platobný príkaz na úhradu / FIT 2.0 (EB),240216.0,
83,Mesto Želiezovce ICO: 00307696,2024-06-06,-4.0,EUR,Rozhlas,Platobný príkaz na úhradu / FIT 2.0 (EB),5014400138.0,
84,Dávid Mariančík MARSTUDIO ICO: 50033964,2024-06-06,-825.0,EUR,Audiovizualne sluzby,Platobný príkaz na úhradu / FIT 2.0 (EB),20240007.0,
85,Central Gastro s.r.o. ICO: 45619301,2024-06-06,-250.0,EUR,Prenajom priestorov,Platobný príkaz na úhradu / FIT 2.0 (EB),2024109.0,
86,"Car Route, s.r.o. ICO: 46294996",2024-06-06,-414.0,EUR,Preprava,Platobný príkaz na úhradu / FIT 2.0 (EB),202405680.0,
87,Ing. arch. Elena Pätoprstá - Creative Net ICO: 369,2024-06-06,-180.0,EUR,OOH,Platobný príkaz na úhradu / FIT 2.0 (EB),10022024.0,
88,,2024-06-06,-0.25,EUR,Poplatok za platbu kartou,Poplatok za kartovú transakciu,,
89,,2024-06-06,-200.0,EUR,"B1822931779-44544 17** **** 6916;FACEBK *WLYMX4YYT2 ,fb.me/ads ,IE ;04.06.2024 23:27:55 ;CashBack:0 EUR",Platba kartou,,
90,,2024-06-06,-0.25,EUR,Poplatok za platbu kartou,Poplatok za kartovú transakciu,,
91,,2024-06-06,-500.0,EUR,"B1822815762-44544 17** **** 6916;FACEBK *4R9RD5C7S2 ,fb.me/ads ,IE ;04.06.2024 22:03:20 ;CashBack:0 EUR",Platba kartou,,
92,,2024-06-06,-0.25,EUR,Poplatok za platbu kartou,Poplatok za kartovú transakciu,,
93,,2024-06-06,-500.0,EUR,"B1822815540-44544 17** **** 6916;FACEBK *ZVYY95Q7S2 ,fb.me/ads ,IE ;04.06.2024 20:45:54 ;CashBack:0 EUR",Platba kartou,,
94,,2024-06-06,-0.25,EUR,Poplatok za platbu kartou,Poplatok za kartovú transakciu,,
95,,2024-06-06,-500.0,EUR,"B1822786251-44544 17** **** 6916;FACEBK *AH59Y587S2 ,fb.me/ads ,IE ;04.06.2024 23:49:28 ;CashBack:0 EUR",Platba kartou,,
96,,2024-06-06,-0.25,EUR,Poplatok za platbu kartou,Poplatok za kartovú transakciu,,
97,,2024-06-06,-500.0,EUR,"B1822768590-44544 17** **** 6916;FACEBK *X33W95Q7S2 ,fb.me/ads ,IE ;04.06.2024 19:09:08 ;CashBack:0 EUR",Platba kartou,,
98,,2024-06-06,-0.25,EUR,Poplatok za platbu kartou,Poplatok za kartovú transakciu,,
99,,2024-06-06,-200.0,EUR,"B1822746622-44544 17** **** 6916;FACEBK *UYFSB5CZT2 ,fb.me/ads ,IE ;04.06.2024 15:09:56 ;CashBack:0 EUR",Platba kartou,,
100,,2024-06-06,-0.25,EUR,Poplatok za platbu kartou,Poplatok za kartovú transakciu,,
101,,2024-06-06,-200.0,EUR,"B1822744921-44544 17** **** 6916;FACEBK *9AKEB5CZT2 ,fb.me/ads ,IE ;04.06.2024 08:23:35 ;CashBack:0 EUR",Platba kartou,,
102,,2024-06-06,-0.25,EUR,Poplatok za platbu kartou,Poplatok za kartovú transakciu,,
103,,2024-06-06,-200.0,EUR,"B1822736512-44544 17** **** 6916;FACEBK *H8QY254ZT2 ,fb.me/ads ,IE ;04.06.2024 19:33:41 ;CashBack:0 EUR",Platba kartou,,
104,,2024-06-06,-0.25,EUR,Poplatok za platbu kartou,Poplatok za kartovú transakciu,,
105,,2024-06-06,-500.0,EUR,"B1822735170-44544 17** **** 6916;FACEBK *RGKR95Q7S2 ,fb.me/ads ,IE ;04.06.2024 16:47:06 ;CashBack:0 EUR",Platba kartou,,
106,,2024-06-06,-0.25,EUR,Poplatok za platbu kartou,Poplatok za kartovú transakciu,,
107,,2024-06-06,-500.0,EUR,"B1822736912-44544 17** **** 6916;FACEBK *6PCNK747S2 ,fb.me/ads ,IE ;04.06.2024 11:46:04 ;CashBack:0 EUR",Platba kartou,,
108,,2024-06-06,-0.25,EUR,Poplatok za platbu kartou,Poplatok za kartovú transakciu,,
109,,2024-06-06,-500.0,EUR,"B1822697209-44544 17** **** 6916;FACEBK *JTCBM5L7S2 ,fb.me/ads ,IE ;04.06.2024 14:28:02 ;CashBack:0 EUR",Platba kartou,,
110,,2024-06-06,-0.25,EUR,Poplatok za platbu kartou,Poplatok za kartovú transakciu,,
111,,2024-06-06,-500.0,EUR,"B1822691180-44544 17** **** 6916;FACEBK *FES995Q7S2 ,fb.me/ads ,IE ;04.06.2024 08:20:47 ;CashBack:0 EUR",Platba kartou,,
112,,2024-06-06,-0.25,EUR,Poplatok za platbu kartou,Poplatok za kartovú transakciu,,
113,,2024-06-06,-500.0,EUR,"B1822685278-44544 17** **** 6916;FACEBK *CVYCY5U7S2 ,fb.me/ads ,IE ;04.06.2024 06:15:39 ;CashBack:0 EUR",Platba kartou,,
114,Matěj Horník ICO: 52206572,2024-06-05,-2200.0,EUR,Socialne siete,Platobný príkaz na úhradu / FIT 2.0 (EB),524.0,
115,SLOVENSKO,2024-06-05,40000.0,EUR,prevod na TU,Bezhotovostný vklad,9.0,
116,frensia s.r.o. ICO: 52934560,2024-06-05,-400.0,EUR,Audiovizualne sluzby,Platobný príkaz na úhradu / FIT 2.0 (EB),2024003.0,
117,frensia s.r.o. ICO: 52934560,2024-06-05,-1250.0,EUR,Audiovizualne sluzby,Platobný príkaz na úhradu / FIT 2.0 (EB),2024005.0,
118,frensia s.r.o. ICO: 52934560,2024-06-05,-1300.0,EUR,Audiovizualne sluzby,Platobný príkaz na úhradu / FIT 2.0 (EB),2024004.0,
119,,2024-06-04,-0.25,EUR,Poplatok za platbu kartou,Poplatok za kartovú transakciu,,
120,,2024-06-04,-500.0,EUR,"B1822019382-44544 17** **** 6916;FACEBK *BJUBC5C7S2 ,fb.me/ads ,IE ;03.06.2024 22:40:27 ;CashBack:0 EUR",Platba kartou,,
121,,2024-06-04,-0.25,EUR,Poplatok za platbu kartou,Poplatok za kartovú transakciu,,
122,,2024-06-04,-500.0,EUR,"B1821969663-44544 17** **** 6916;FACEBK *NHGXB5C7S2 ,fb.me/ads ,IE ;03.06.2024 16:58:38 ;CashBack:0 EUR",Platba kartou,,
123,,2024-06-04,-0.25,EUR,Poplatok za platbu kartou,Poplatok za kartovú transakciu,,
124,,2024-06-04,-500.0,EUR,"B1821968824-44544 17** **** 6916;FACEBK *GFN365G7S2 ,fb.me/ads ,IE ;03.06.2024 06:13:07 ;CashBack:0 EUR",Platba kartou,,
125,,2024-06-04,-0.25,EUR,Poplatok za platbu kartou,Poplatok za kartovú transakciu,,
126,,2024-06-04,-200.0,EUR,"B1821919784-44544 17** **** 6916;FACEBK *K2ZML5GYT2 ,fb.me/ads ,IE ;03.06.2024 09:18:30 ;CashBack:0 EUR",Platba kartou,,
127,,2024-06-04,-0.25,EUR,Poplatok za platbu kartou,Poplatok za kartovú transakciu,,
128,,2024-06-04,-200.0,EUR,"B1821892595-44544 17** **** 6916;FACEBK *P9AGE58ZT2 ,fb.me/ads ,IE ;03.06.2024 21:54:06 ;CashBack:0 EUR",Platba kartou,,
129,,2024-06-04,-0.25,EUR,Poplatok za platbu kartou,Poplatok za kartovú transakciu,,
130,,2024-06-04,-200.0,EUR,"B1821892571-44544 17** **** 6916;FACEBK *GCTGZ44ZT2 ,fb.me/ads ,IE ;03.06.2024 17:04:20 ;CashBack:0 EUR",Platba kartou,,
131,"POSTOJ MEDIA, s.r.o. ICO: 50205668",2024-06-04,-6310.0,EUR,Inzercia,Platobný príkaz na úhradu / FIT 2.0 (EB),20241084.0,
132,"PEMI group, s.r.o. ICO: 47558261",2024-06-04,-4536.0,EUR,Potlac na tricka,Platobný príkaz na úhradu / FIT 2.0 (EB),2024063.0,
133,"SLOVNAFT, a.s. ICO: 31322832",2024-06-04,-2395.11,EUR,PHM,Platobný príkaz na úhradu / FIT 2.0 (EB),3082093361.0,
134,,2024-06-03,-200.0,EUR,"B1821636442-44544 17** **** 6916;FACEBK *ZPA3L5GYT2 ,fb.me/ads ,IE ;02.06.2024 22:16:39 ;CashBack:0 EUR",Platba kartou,,
135,,2024-06-03,-0.25,EUR,Poplatok za platbu kartou,Poplatok za kartovú transakciu,,
136,,2024-06-03,-0.25,EUR,Poplatok za platbu kartou,Poplatok za kartovú transakciu,,
137,,2024-06-03,-200.0,EUR,"B1821425474-44544 17** **** 6916;FACEBK *2N6HE5CYT2 ,fb.me/ads ,IE ;02.06.2024 14:55:16 ;CashBack:0 EUR",Platba kartou,,
138,,2024-06-03,-0.25,EUR,Poplatok za platbu kartou,Poplatok za kartovú transakciu,,
139,,2024-06-03,-200.0,EUR,"B1821425249-44544 17** **** 6916;FACEBK *U4FQA4LYT2 ,fb.me/ads ,IE ;02.06.2024 07:12:42 ;CashBack:0 EUR",Platba kartou,,
140,,2024-06-03,-500.0,EUR,"B1821414923-44544 17** **** 6916;FACEBK *6TJ3W5U7S2 ,fb.me/ads ,IE ;02.06.2024 13:24:37 ;CashBack:0 EUR",Platba kartou,,
141,,2024-06-03,-0.25,EUR,Poplatok za platbu kartou,Poplatok za kartovú transakciu,,
142,,2024-06-02,-0.25,EUR,Poplatok za platbu kartou,Poplatok za kartovú transakciu,,
143,,2024-06-02,-185.26,EUR,"B1820955877-44544 17** **** 6916;KAUFLAND 1430,PO,BARDEJ. ,PRESOV ,SK ;01.06.2024 12:32:21 ;CashBack:0 EUR",Platba kartou,,
144,,2024-06-02,-0.25,EUR,Poplatok za platbu kartou,Poplatok za kartovú transakciu,,
145,,2024-06-02,-200.0,EUR,"B1820714775-44544 17** **** 6916;FACEBK *L38LT4YYT2 ,fb.me/ads ,IE ;01.06.2024 20:11:01 ;CashBack:0 EUR",Platba kartou,,
146,,2024-06-02,-0.25,EUR,Poplatok za platbu kartou,Poplatok za kartovú transakciu,,
147,,2024-06-02,-200.0,EUR,"B1820705691-44544 17** **** 6916;FACEBK *VKR8J5GYT2 ,fb.me/ads ,IE ;01.06.2024 12:15:39 ;CashBack:0 EUR",Platba kartou,,
148,,2024-06-02,-500.0,EUR,"B1820676265-44544 17** **** 6916;FACEBK *XHMHQ5Y6S2 ,fb.me/ads ,IE ;01.06.2024 08:10:43 ;CashBack:0 EUR",Platba kartou,,
149,,2024-06-02,-0.25,EUR,Poplatok za platbu kartou,Poplatok za kartovú transakciu,,
150,,2024-06-02,-0.25,EUR,Poplatok za platbu kartou,Poplatok za kartovú transakciu,,
151,,2024-06-02,-200.0,EUR,"B1819967502-44544 17** **** 6916;FACEBK *QD4LH5GYT2 ,fb.me/ads ,IE ;31.05.2024 23:25:39 ;CashBack:0 EUR",Platba kartou,,
152,,2024-06-02,-0.25,EUR,Poplatok za platbu kartou,Poplatok za kartovú transakciu,,
153,,2024-06-02,-500.0,EUR,"B1819764697-44544 17** **** 6916;FACEBK *YMN8T5U7S2 ,fb.me/ads ,IE ;31.05.2024 08:18:07 ;CashBack:0 EUR",Platba kartou,,
154,,2024-06-02,-0.25,EUR,Poplatok za platbu kartou,Poplatok za kartovú transakciu,,
155,,2024-06-02,-200.0,EUR,"B1819757171-44544 17** **** 6916;FACEBK *7ZZ6H5GYT2 ,fb.me/ads ,IE ;31.05.2024 16:47:30 ;CashBack:0 EUR",Platba kartou,,
156,,2024-06-02,-0.25,EUR,Poplatok za platbu kartou,Poplatok za kartovú transakciu,,
157,,2024-06-02,-200.0,EUR,"B1819756407-44544 17** **** 6916;FACEBK *7WQ4C5QYT2 ,fb.me/ads ,IE ;31.05.2024 07:19:41 ;CashBack:0 EUR",Platba kartou,,
158,Martin Bagar ICO: 50355031,2024-06-01,-1890.0,EUR,Audio-vizualne sluzby,Platobný príkaz na úhradu / FIT 2.0 (EB),20240006.0,
159,,2024-06-01,-0.25,EUR,Poplatok za platbu kartou,Poplatok za kartovú transakciu,,
160,,2024-06-01,-200.0,EUR,"B1818912181-44544 17** **** 6916;FACEBK *VPKKU44ZT2 ,fb.me/ads ,IE ;30.05.2024 20:03:24 ;CashBack:0 EUR",Platba kartou,,
161,,2024-06-01,-0.25,EUR,Poplatok za platbu kartou,Poplatok za kartovú transakciu,,
162,,2024-06-01,-500.0,EUR,"B1818849222-44544 17** **** 6916;FACEBK* ,fb.me/ads ,IE ;30.05.2024 06:18:25 ;CashBack:0 EUR",Platba kartou,,
163,,2024-06-01,-0.25,EUR,Poplatok za platbu kartou,Poplatok za kartovú transakciu,,
164,,2024-06-01,-200.0,EUR,"B1818822265-44544 17** **** 6916;FACEBK *6SYAA5CYT2 ,fb.me/ads ,IE ;30.05.2024 06:17:27 ;CashBack:0 EUR",Platba kartou,,
165,,2024-06-01,-0.25,EUR,Poplatok za platbu kartou,Poplatok za kartovú transakciu,,
166,,2024-06-01,-500.0,EUR,"B1818817678-44544 17** **** 6916;FACEBK* ,fb.me/ads ,IE ;30.05.2024 17:38:14 ;CashBack:0 EUR",Platba kartou,,
167,,2024-05-31,-5.0,EUR,Zverejňovanie účtu,Poplatok,,
168,,2024-05-31,-5.0,EUR,Poplatok za vedenie účtu,Poplatok,,
169,,2024-05-31,-3.5,EUR,"Vedenie Platobnej karty embosovanej,2315,5,Karta č. 4544 17** **** 6461Poplatok za Platobnú kartu",Kartový poplatok,,
170,SLOVENSKO,2024-05-31,30000.0,EUR,prevod na TU,Bezhotovostný vklad,8.0,
171,,2024-05-31,-121.77,EUR,"B1818789709-44544 17** **** 6461;DWOR WAPOWCE ,WAPOWCE ,PL ;29.05.2024 15:53:49 ;CashBack:0 EUR",Platba kartou,,
172,,2024-05-31,-0.25,EUR,Poplatok za platbu kartou,Poplatok za kartovú transakciu,,
173,,2024-05-31,-12.84,EUR,"B1818810867-44544 17** **** 6461;AZS OKKO 71 LV ,BRODY ,UA ;28.05.2024 17:04:07;554;UAH;CashBack:0 EUR",Platba kartou,,
174,,2024-05-31,-0.25,EUR,Poplatok za platbu kartou,Poplatok za kartovú transakciu,,
175,,2024-05-31,-0.25,EUR,Poplatok za platbu kartou,Poplatok za kartovú transakciu,,
176,,2024-05-31,-9.84,EUR,"B1818783262-44544 17** **** 6461;PARKOMAYDANCH ,LVOV ,UA ;29.05.2024 09:20:34;430;UAH;CashBack:0 EUR",Platba kartou,,
177,,2024-05-31,-0.25,EUR,Poplatok za platbu kartou,Poplatok za kartovú transakciu,,
178,,2024-05-31,-9.84,EUR,"B1818783260-44544 17** **** 6461;PARKOMAYDANCH ,LVOV ,UA ;29.05.2024 09:16:41;430;UAH;CashBack:0 EUR",Platba kartou,,
179,,2024-05-31,-0.25,EUR,Poplatok za platbu kartou,Poplatok za kartovú transakciu,,
180,,2024-05-31,-1.03,EUR,"B1818783256-44544 17** **** 6461;BLACK HONEY ,LVOV ,UA ;29.05.2024 08:52:01;45;UAH;CashBack:0 EUR",Platba kartou,,
181,,2024-05-31,-0.25,EUR,Poplatok za platbu kartou,Poplatok za kartovú transakciu,,
182,,2024-05-31,-3.77,EUR,"B1818783253-44544 17** **** 6461;BLACK HONEY ,LVOV ,UA ;29.05.2024 08:46:19;165;UAH;CashBack:0 EUR",Platba kartou,,
183,,2024-05-31,-0.25,EUR,Poplatok za platbu kartou,Poplatok za kartovú transakciu,,
184,,2024-05-31,-43.57,EUR,"B1818783247-44544 17** **** 6461;FOPDOBUSHDYA ,LVOV ,UA ;29.05.2024 08:31:37;1905;UAH;CashBack:0 EUR",Platba kartou,,
185,,2024-05-31,-0.08,EUR,"Spracov. transakcií v inej mene ako EUR,2232,5,Karta c. 4544 17** **** 6461Poplatok za spracovanie transakcií v inej mene ako EUR29.05.2024 08:46:19 165.0000 UAHBLACK HONEY LVOV UA",Kartový poplatok,,
186,,2024-05-31,-0.2,EUR,"Spracov. transakcií v inej mene ako EUR,2232,5,Karta c. 4544 17** **** 6461Poplatok za spracovanie transakcií v inej mene ako EUR29.05.2024 09:20:34 430.0000 UAHPARKOMAYDANCH LVOV UA",Kartový poplatok,,
187,,2024-05-31,-0.2,EUR,"Spracov. transakcií v inej mene ako EUR,2232,5,Karta c. 4544 17** **** 6461Poplatok za spracovanie transakcií v inej mene ako EUR29.05.2024 09:16:41 430.0000 UAHPARKOMAYDANCH LVOV UA",Kartový poplatok,,
188,,2024-05-31,-0.02,EUR,"Spracov. transakcií v inej mene ako EUR,2232,5,Karta c. 4544 17** **** 6461Poplatok za spracovanie transakcií v inej mene ako EUR29.05.2024 08:52:01 45.0000 UAHBLACK HONEY LVOV UA",Kartový poplatok,,
189,,2024-05-31,-0.87,EUR,"Spracov. transakcií v inej mene ako EUR,2232,5,Karta c. 4544 17** **** 6461Poplatok za spracovanie transakcií v inej mene ako EUR29.05.2024 08:31:37 1905.0000 UAHFOPDOBUSHDYA LVOV UA",Kartový poplatok,,
190,,2024-05-31,-0.26,EUR,"Spracov. transakcií v inej mene ako EUR,2232,5,Karta c. 4544 17** **** 6461Poplatok za spracovanie transakcií v inej mene ako EUR28.05.2024 17:04:07 554.0000 UAHAZS OKKO 71 LV BRODY UA",Kartový poplatok,,
191,,2024-05-31,-200.0,EUR,"B1818091736-44544 17** **** 6916;FACEBK *3TAAP4YYT2 ,fb.me/ads ,IE ;29.05.2024 12:03:12 ;CashBack:0 EUR",Platba kartou,,
192,,2024-05-31,-0.25,EUR,Poplatok za platbu kartou,Poplatok za kartovú transakciu,,
193,,2024-05-31,-0.25,EUR,Poplatok za platbu kartou,Poplatok za kartovú transakciu,,
194,,2024-05-31,-500.0,EUR,"B1817966266-44544 17** **** 6916;FACEBK* ,fb.me/ads ,IE ;29.05.2024 16:54:10 ;CashBack:0 EUR",Platba kartou,,
195,DigiSkilly s.r.o. ICO: 55632165,2024-05-30,-1992.0,EUR,Online marketing,Platobný príkaz na úhradu / FIT 2.0 (EB),2024000017.0,
196,Michal Babčan,2024-05-30,-1200.0,EUR,Graficke prace,Platobný príkaz na úhradu / FIT 2.0 (EB),92024.0,
197,Ing. arch. Elena Pätoprstá - Creative Net ICO: 369,2024-05-30,-900.0,EUR,OOH,Platobný príkaz na úhradu / FIT 2.0 (EB),10022024.0,
198,Padych František-Penzión Čierna pani ICO: 30498473,2024-05-30,-280.0,EUR,Prenajom priestorov,Platobný príkaz na úhradu / FIT 2.0 (EB),2024122.0,
199,"SPRÁVA MESTSKÉHO MAJETKU, s.r.o. ICO: 34140590",2024-05-30,-24.0,EUR,Uzivanie verejneho priestranstva,Platobný príkaz na úhradu / FIT 2.0 (EB),2024600139.0,
200,,2024-05-30,-0.61,EUR,"Spracov. transakcií v inej mene ako EUR,2232,5,Karta c. 4544 17** **** 6461Poplatok za spracovanie transakcií v inej mene ako EUR28.05.2024 11:44:04 1310.0000 UAHKAFE BALCONE KIEV UA",Kartový poplatok,,
201,,2024-05-30,-0.97,EUR,"Spracov. transakcií v inej mene ako EUR,2232,5,Karta c. 4544 17** **** 6461Poplatok za spracovanie transakcií v inej mene ako EUR27.05.2024 07:48:08 2087.5800 UAHHOTEL UKRAINE KYIV UA",Kartový poplatok,,
202,,2024-05-30,-0.34,EUR,"Spracov. transakcií v inej mene ako EUR,2232,5,Karta c. 4544 17** **** 6461Poplatok za spracovanie transakcií v inej mene ako EUR27.05.2024 13:33:46 723.0000 UAHAROMA KAVA KYIV UA",Kartový poplatok,,
203,,2024-05-30,-0.13,EUR,"Spracov. transakcií v inej mene ako EUR,2232,5,Karta c. 4544 17** **** 6461Poplatok za spracovanie transakcií v inej mene ako EUR28.05.2024 08:02:57 290.0000 UAHCOFFEEBRO KIEV UA",Kartový poplatok,,
204,,2024-05-30,-0.53,EUR,"Spracov. transakcií v inej mene ako EUR,2232,5,Karta c. 4544 17** **** 6461Poplatok za spracovanie transakcií v inej mene ako EUR28.05.2024 07:44:32 1142.0000 UAHPUZATA KHATA KIEV UA",Kartový poplatok,,
205,,2024-05-30,-0.2,EUR,"Spracov. transakcií v inej mene ako EUR,2232,5,Karta c. 4544 17** **** 6461Poplatok za spracovanie transakcií v inej mene ako EUR28.05.2024 20:29:59 430.0000 UAHTOVSUVLAKIBAR LVOV UA",Kartový poplatok,,
206,,2024-05-30,-1.66,EUR,"Spracov. transakcií v inej mene ako EUR,2232,5,Karta c. 4544 17** **** 6461Poplatok za spracovanie transakcií v inej mene ako EUR28.05.2024 19:17:17 3575.0000 UAHDANILO NN LVOV UA",Kartový poplatok,,
207,,2024-05-30,-2.29,EUR,"Spracov. transakcií v inej mene ako EUR,2232,5,Karta c. 4544 17** **** 6461Poplatok za spracovanie transakcií v inej mene ako EUR28.05.2024 19:16:42 4928.5000 UAHDANILO NN LVOV UA",Kartový poplatok,,
208,,2024-05-30,-1.87,EUR,"Spracov. transakcií v inej mene ako EUR,2232,5,Karta c. 4544 17** **** 6461Poplatok za spracovanie transakcií v inej mene ako EUR28.05.2024 18:23:29 4021.9100 UAHWOG 1923 ZAPYTIV UA",Kartový poplatok,,
209,,2024-05-30,-62.23,EUR,"B1817948200-44544 17** **** 6461;VERY WELL CAFE ,KYIV ,UA ;27.05.2024 12:54:33;2684;UAH;CashBack:0 EUR",Platba kartou,,
210,,2024-05-30,-0.25,EUR,Poplatok za platbu kartou,Poplatok za kartovú transakciu,,
211,,2024-05-30,-48.02,EUR,"B1817948197-44544 17** **** 6461;CAFE VATRA ,KYIV ,UA ;27.05.2024 18:49:53;2071;UAH;CashBack:0 EUR",Platba kartou,,
212,,2024-05-30,-0.25,EUR,Poplatok za platbu kartou,Poplatok za kartovú transakciu,,
213,,2024-05-30,-13.56,EUR,"B1817948194-44544 17** **** 6461;BAR DRUNK CHERRY M ,KYIV ,UA ;27.05.2024 20:13:47;585;UAH;CashBack:0 EUR",Platba kartou,,
214,,2024-05-30,-0.25,EUR,Poplatok za platbu kartou,Poplatok za kartovú transakciu,,
215,,2024-05-30,-9.18,EUR,"B1817948187-44544 17** **** 6461;CAFE VATRA ,KYIV ,UA ;27.05.2024 18:49:15;396;UAH;CashBack:0 EUR",Platba kartou,,
216,,2024-05-30,-0.25,EUR,Poplatok za platbu kartou,Poplatok za kartovú transakciu,,
217,,2024-05-30,-93.25,EUR,"B1817949690-44544 17** **** 6461;WOG 1923 ,ZAPYTIV ,UA ;28.05.2024 18:23:29;4021.91;UAH;CashBack:0 EUR",Platba kartou,,
218,,2024-05-30,-0.25,EUR,Poplatok za platbu kartou,Poplatok za kartovú transakciu,,
219,,2024-05-30,-16.76,EUR,"B1817947140-44544 17** **** 6461;AROMA KAVA ,KYIV ,UA ;27.05.2024 13:33:46;723;UAH;CashBack:0 EUR",Platba kartou,,
220,,2024-05-30,-0.25,EUR,Poplatok za platbu kartou,Poplatok za kartovú transakciu,,
221,,2024-05-30,-0.96,EUR,"Spracov. transakcií v inej mene ako EUR,2232,5,Karta c. 4544 17** **** 6461Poplatok za spracovanie transakcií v inej mene ako EUR27.05.2024 18:49:53 2071.0000 UAHCAFE VATRA KYIV UA",Kartový poplatok,,
222,,2024-05-30,-48.4,EUR,"B1817947045-44544 17** **** 6461;HOTEL UKRAINE ,KYIV ,UA ;27.05.2024 07:48:08;2087.58;UAH;CashBack:0 EUR",Platba kartou,,
223,,2024-05-30,-0.25,EUR,Poplatok za platbu kartou,Poplatok za kartovú transakciu,,
224,,2024-05-30,-1.24,EUR,"Spracov. transakcií v inej mene ako EUR,2232,5,Karta c. 4544 17** **** 6461Poplatok za spracovanie transakcií v inej mene ako EUR27.05.2024 12:54:33 2684.0000 UAHVERY WELL CAFE KYIV UA",Kartový poplatok,,
225,,2024-05-30,-0.27,EUR,"Spracov. transakcií v inej mene ako EUR,2232,5,Karta c. 4544 17** **** 6461Poplatok za spracovanie transakcií v inej mene ako EUR27.05.2024 20:13:47 585.0000 UAHBAR DRUNK CHERRY M KYIV UA",Kartový poplatok,,
226,,2024-05-30,-0.18,EUR,"Spracov. transakcií v inej mene ako EUR,2232,5,Karta c. 4544 17** **** 6461Poplatok za spracovanie transakcií v inej mene ako EUR27.05.2024 18:49:15 396.0000 UAHCAFE VATRA KYIV UA",Kartový poplatok,,
227,,2024-05-30,-0.25,EUR,Poplatok za platbu kartou,Poplatok za kartovú transakciu,,
228,,2024-05-30,-60.93,EUR,"B1817934539-44544 17** **** 6461;MVF ,LVOV ,UA ;28.05.2024 20:30:35;2628;UAH;CashBack:0 EUR",Platba kartou,,
229,,2024-05-30,-0.25,EUR,Poplatok za platbu kartou,Poplatok za kartovú transakciu,,
230,,2024-05-30,-9.97,EUR,"B1817934537-44544 17** **** 6461;TOVSUVLAKIBAR ,LVOV ,UA ;28.05.2024 20:29:59;430;UAH;CashBack:0 EUR",Platba kartou,,
231,,2024-05-30,-0.25,EUR,Poplatok za platbu kartou,Poplatok za kartovú transakciu,,
232,,2024-05-30,-82.89,EUR,"B1817934535-44544 17** **** 6461;DANILO NN ,LVOV ,UA ;28.05.2024 19:17:17;3575;UAH;CashBack:0 EUR",Platba kartou,,
233,,2024-05-30,-0.25,EUR,Poplatok za platbu kartou,Poplatok za kartovú transakciu,,
234,,2024-05-30,-114.27,EUR,"B1817934532-44544 17** **** 6461;DANILO NN ,LVOV ,UA ;28.05.2024 19:16:42;4928.5;UAH;CashBack:0 EUR",Platba kartou,,
235,,2024-05-30,-1.22,EUR,"Spracov. transakcií v inej mene ako EUR,2232,5,Karta c. 4544 17** **** 6461Poplatok za spracovanie transakcií v inej mene ako EUR28.05.2024 20:30:35 2628.0000 UAHMVF LVOV UA",Kartový poplatok,,
236,,2024-05-30,-0.25,EUR,Poplatok za platbu kartou,Poplatok za kartovú transakciu,,
237,,2024-05-30,-30.37,EUR,"B1817923312-44544 17** **** 6461;KAFE BALCONE ,KIEV ,UA ;28.05.2024 11:44:04;1310;UAH;CashBack:0 EUR",Platba kartou,,
238,,2024-05-30,-0.25,EUR,Poplatok za platbu kartou,Poplatok za kartovú transakciu,,
239,,2024-05-30,-6.72,EUR,"B1817922170-44544 17** **** 6461;COFFEEBRO ,KIEV ,UA ;28.05.2024 08:02:57;290;UAH;CashBack:0 EUR",Platba kartou,,
240,,2024-05-30,-0.25,EUR,Poplatok za platbu kartou,Poplatok za kartovú transakciu,,
241,,2024-05-30,-26.48,EUR,"B1817922166-44544 17** **** 6461;PUZATA KHATA ,KIEV ,UA ;28.05.2024 07:44:32;1142;UAH;CashBack:0 EUR",Platba kartou,,
242,,2024-05-30,-0.25,EUR,Poplatok za platbu kartou,Poplatok za kartovú transakciu,,
243,,2024-05-30,-500.0,EUR,"B1817887081-44544 17** **** 6916;FACEBK* ,fb.me/ads ,IE ;29.05.2024 05:58:59 ;CashBack:0 EUR",Platba kartou,,
244,,2024-05-30,-0.25,EUR,Poplatok za platbu kartou,Poplatok za kartovú transakciu,,
245,,2024-05-30,-500.0,EUR,"B1817215315-44544 17** **** 6916;FACEBK* ,fb.me/ads ,IE ;28.05.2024 16:55:24 ;CashBack:0 EUR",Platba kartou,,
246,,2024-05-30,-0.25,EUR,Poplatok za platbu kartou,Poplatok za kartovú transakciu,,
247,,2024-05-30,-500.0,EUR,"B1817166373-44544 17** **** 6916;FACEBK* ,fb.me/ads ,IE ;28.05.2024 07:17:16 ;CashBack:0 EUR",Platba kartou,,
248,,2024-05-30,-0.25,EUR,Poplatok za platbu kartou,Poplatok za kartovú transakciu,,
249,,2024-05-30,-200.0,EUR,"B1817103967-44544 17** **** 6916;FACEBK *N77W558ZT2 ,fb.me/ads ,IE ;28.05.2024 10:55:22 ;CashBack:0 EUR",Platba kartou,,
250,"Regionpress s.r.o, IČO: 36252417",2024-05-29,-192.0,EUR,inzercia,Platobný príkaz na úhradu / FIT 2.0 (EB),334240003.0,
251,,2024-05-29,-0.25,EUR,Poplatok za platbu kartou,Poplatok za kartovú transakciu,,
252,,2024-05-29,-483.21,EUR,"B1817094578-44544 17** **** 6461;HOTEL UKRAINE ,KYIV ,UA ;26.05.2024 17:54:26;20841;UAH;CashBack:0 EUR",Platba kartou,,
253,,2024-05-29,-0.25,EUR,Poplatok za platbu kartou,Poplatok za kartovú transakciu,,
254,,2024-05-29,-51.33,EUR,"B1817079506-44544 17** **** 6461;PUZATA KHATA ,KIEV ,UA ;27.05.2024 19:13:35;2214;UAH;CashBack:0 EUR",Platba kartou,,
255,,2024-05-29,-13.03,EUR,"B1817070248-44544 17** **** 6461;GRKY ESPRESSO BAR ,KIYEV ,UA ;27.05.2024 11:33:35;562;UAH;CashBack:0 EUR",Platba kartou,,
256,,2024-05-29,-0.25,EUR,Poplatok za platbu kartou,Poplatok za kartovú transakciu,,
257,,2024-05-29,-12.29,EUR,"B1817069128-44544 17** **** 6461;YALYUBLYUKEBAB ,KIEV ,UA ;27.05.2024 09:30:07;530;UAH;CashBack:0 EUR",Platba kartou,,
258,,2024-05-29,-0.25,EUR,Poplatok za platbu kartou,Poplatok za kartovú transakciu,,
259,,2024-05-29,-25.04,EUR,"B1817070395-44544 17** **** 6461;GRKY ESPRESSO BAR ,KIEV ,UA ;27.05.2024 15:04:30;1080;UAH;CashBack:0 EUR",Platba kartou,,
260,,2024-05-29,-0.25,EUR,Poplatok za platbu kartou,Poplatok za kartovú transakciu,,
261,,2024-05-29,-5.0,EUR,"Spracov. transakcií v inej mene ako EUR,2232,5,Karta c. 4544 17** **** 6461Poplatok za spracovanie transakcií v inej mene ako EUR26.05.2024 17:54:26 20841.0000 UAHHOTEL UKRAINE KYIV UA",Kartový poplatok,,
262,,2024-05-29,-0.5,EUR,"Spracov. transakcií v inej mene ako EUR,2232,5,Karta c. 4544 17** **** 6461Poplatok za spracovanie transakcií v inej mene ako EUR27.05.2024 15:04:30 1080.0000 UAHGRKY ESPRESSO BAR KIEV UA",Kartový poplatok,,
263,,2024-05-29,-0.26,EUR,"Spracov. transakcií v inej mene ako EUR,2232,5,Karta c. 4544 17** **** 6461Poplatok za spracovanie transakcií v inej mene ako EUR27.05.2024 11:33:35 562.0000 UAHGRKY ESPRESSO BAR KIYEV UA",Kartový poplatok,,
264,,2024-05-29,-1.03,EUR,"Spracov. transakcií v inej mene ako EUR,2232,5,Karta c. 4544 17** **** 6461Poplatok za spracovanie transakcií v inej mene ako EUR27.05.2024 19:13:35 2214.0000 UAHPUZATA KHATA KIEV UA",Kartový poplatok,,
265,,2024-05-29,-0.25,EUR,"Spracov. transakcií v inej mene ako EUR,2232,5,Karta c. 4544 17** **** 6461Poplatok za spracovanie transakcií v inej mene ako EUR27.05.2024 09:30:07 530.0000 UAHYALYUBLYUKEBAB KIEV UA",Kartový poplatok,,
266,,2024-05-29,-0.25,EUR,Poplatok za platbu kartou,Poplatok za kartovú transakciu,,
267,,2024-05-29,-500.0,EUR,"B1816342133-44544 17** **** 6916;FACEBK* ,fb.me/ads ,IE ;27.05.2024 16:04:25 ;CashBack:0 EUR",Platba kartou,,
268,,2024-05-29,-0.25,EUR,Poplatok za platbu kartou,Poplatok za kartovú transakciu,,
269,,2024-05-29,-200.0,EUR,"B1816296121-44544 17** **** 6916;FACEBK *5WJD75QYT2 ,fb.me/ads ,IE ;27.05.2024 14:22:20 ;CashBack:0 EUR",Platba kartou,,
270,"Regionpress s.r.o, IČO: 36252417",2024-05-29,-2217.6,EUR,distribucia letakov,Platobný príkaz na úhradu / FIT 2.0 (EB),974240009.0,
271,,2024-05-27,-0.25,EUR,Poplatok za platbu kartou,Poplatok za kartovú transakciu,,
272,,2024-05-27,-55.88,EUR,"B1816277742-44544 17** **** 6461;MAMA-GOCHI ,m.Kyiv ,UA ;26.05.2024 20:57:07;2410;UAH;CashBack:0 EUR",Platba kartou,,
273,,2024-05-27,-0.25,EUR,Poplatok za platbu kartou,Poplatok za kartovú transakciu,,
274,,2024-05-27,-75.68,EUR,"B1816277738-44544 17** **** 6461;restoran Mama-Gochi ,m.Kyiv ,UA ;26.05.2024 20:56:43;3264;UAH;CashBack:0 EUR",Platba kartou,,
275,,2024-05-27,-0.25,EUR,Poplatok za platbu kartou,Poplatok za kartovú transakciu,,
276,,2024-05-27,-5.56,EUR,"B1816244433-44544 17** **** 6461;PARKINH PARKING ,KIYEV ,UA ;26.05.2024 16:58:54;240;UAH;CashBack:0 EUR",Platba kartou,,
277,,2024-05-27,-0.25,EUR,Poplatok za platbu kartou,Poplatok za kartovú transakciu,,
278,,2024-05-27,-84.86,EUR,"B1816244430-44544 17** **** 6461;POLTAVA ,KIYEV ,UA ;26.05.2024 16:44:11;3660;UAH;CashBack:0 EUR",Platba kartou,,
279,,2024-05-27,-0.25,EUR,Poplatok za platbu kartou,Poplatok za kartovú transakciu,,
280,,2024-05-27,-12.87,EUR,"B1816244428-44544 17** **** 6461;POLTAVA ,KIEV ,UA ;26.05.2024 16:43:17;555;UAH;CashBack:0 EUR",Platba kartou,,
281,,2024-05-27,-0.25,EUR,Poplatok za platbu kartou,Poplatok za kartovú transakciu,,
282,,2024-05-27,-7.23,EUR,"B1816244411-44544 17** **** 6461;KRUG ,BORODYANKA ,UA ;26.05.2024 12:18:01;312;UAH;CashBack:0 EUR",Platba kartou,,
283,,2024-05-27,-0.25,EUR,Poplatok za platbu kartou,Poplatok za kartovú transakciu,,
284,,2024-05-27,-3.27,EUR,"B1816244407-44544 17** **** 6461;KRUG ,BORODYANKA ,UA ;26.05.2024 11:48:30;141;UAH;CashBack:0 EUR",Platba kartou,,
285,,2024-05-27,-0.25,EUR,Poplatok za platbu kartou,Poplatok za kartovú transakciu,,
286,,2024-05-27,-245.75,EUR,"B1816242826-44544 17** **** 6461;GOTELTSARGRAD ,MILA ,UA ;26.05.2024 08:07:49;10599.4;UAH;CashBack:0 EUR",Platba kartou,,
287,,2024-05-27,-0.25,EUR,Poplatok za platbu kartou,Poplatok za kartovú transakciu,,
288,,2024-05-27,-60.51,EUR,"B1816242822-44544 17** **** 6461;RESTORANTSARGRAD ,MILA ,UA ;26.05.2024 08:04:49;2610;UAH;CashBack:0 EUR",Platba kartou,,
289,,2024-05-27,-5.56,EUR,"B1816244425-44544 17** **** 6461;PARKINH PARKING ,KIYEV ,UA ;26.05.2024 17:00:57;240;UAH;CashBack:0 EUR",Platba kartou,,
290,,2024-05-27,-0.25,EUR,Poplatok za platbu kartou,Poplatok za kartovú transakciu,,
291,,2024-05-27,-4.92,EUR,"Spracov. transakcií v inej mene ako EUR,2232,5,Karta c. 4544 17** **** 6461Poplatok za spracovanie transakcií v inej mene ako EUR26.05.2024 08:07:49 10599.4000 UAHGOTELTSARGRAD MILA UA",Kartový poplatok,,
292,,2024-05-27,-1.21,EUR,"Spracov. transakcií v inej mene ako EUR,2232,5,Karta c. 4544 17** **** 6461Poplatok za spracovanie transakcií v inej mene ako EUR26.05.2024 08:04:49 2610.0000 UAHRESTORANTSARGRAD MILA UA",Kartový poplatok,,
293,,2024-05-27,-1.12,EUR,"Spracov. transakcií v inej mene ako EUR,2232,5,Karta c. 4544 17** **** 6461Poplatok za spracovanie transakcií v inej mene ako EUR26.05.2024 20:57:07 2410.0000 UAHMAMA-GOCHI m.Kyiv UA",Kartový poplatok,,
294,,2024-05-27,-1.51,EUR,"Spracov. transakcií v inej mene ako EUR,2232,5,Karta c. 4544 17** **** 6461Poplatok za spracovanie transakcií v inej mene ako EUR26.05.2024 20:56:43 3264.0000 UAHrestoran Mama-Gochi m.Kyiv UA",Kartový poplatok,,
295,,2024-05-27,-0.25,EUR,Poplatok za platbu kartou,Poplatok za kartovú transakciu,,
296,,2024-05-27,-200.0,EUR,"B1815816210-44544 17** **** 6916;FACEBK *SHW9P44ZT2 ,fb.me/ads ,IE ;26.05.2024 18:30:46 ;CashBack:0 EUR",Platba kartou,,
297,,2024-05-27,-0.25,EUR,Poplatok za platbu kartou,Poplatok za kartovú transakciu,,
298,,2024-05-27,-500.0,EUR,"B1815822759-44544 17** **** 6916;FACEBK* ,fb.me/ads ,IE ;26.05.2024 21:01:18 ;CashBack:0 EUR",Platba kartou,,
299,,2024-05-27,-0.11,EUR,"Spracov. transakcií v inej mene ako EUR,2232,5,Karta c. 4544 17** **** 6461Poplatok za spracovanie transakcií v inej mene ako EUR26.05.2024 16:58:54 240.0000 UAHPARKINH PARKING KIYEV UA",Kartový poplatok,,
300,,2024-05-27,-1.7,EUR,"Spracov. transakcií v inej mene ako EUR,2232,5,Karta c. 4544 17** **** 6461Poplatok za spracovanie transakcií v inej mene ako EUR26.05.2024 16:44:11 3660.0000 UAHPOLTAVA KIYEV UA",Kartový poplatok,,
301,,2024-05-27,-0.26,EUR,"Spracov. transakcií v inej mene ako EUR,2232,5,Karta c. 4544 17** **** 6461Poplatok za spracovanie transakcií v inej mene ako EUR26.05.2024 16:43:17 555.0000 UAHPOLTAVA KIEV UA",Kartový poplatok,,
302,,2024-05-27,-0.11,EUR,"Spracov. transakcií v inej mene ako EUR,2232,5,Karta c. 4544 17** **** 6461Poplatok za spracovanie transakcií v inej mene ako EUR26.05.2024 17:00:57 240.0000 UAHPARKINH PARKING KIYEV UA",Kartový poplatok,,
303,,2024-05-27,-0.14,EUR,"Spracov. transakcií v inej mene ako EUR,2232,5,Karta c. 4544 17** **** 6461Poplatok za spracovanie transakcií v inej mene ako EUR26.05.2024 12:18:01 312.0000 UAHKRUG BORODYANKA UA",Kartový poplatok,,
304,,2024-05-27,-0.07,EUR,"Spracov. transakcií v inej mene ako EUR,2232,5,Karta c. 4544 17** **** 6461Poplatok za spracovanie transakcií v inej mene ako EUR26.05.2024 11:48:30 141.0000 UAHKRUG BORODYANKA UA",Kartový poplatok,,
305,,2024-05-26,-1.36,EUR,"Spracov. transakcií v inej mene ako EUR,2232,5,Karta c. 4544 17** **** 6461Poplatok za spracovanie transakcií v inej mene ako EUR25.05.2024 16:48:18 2925.0000 UAHPID ARSENALOM 2 LVIV UA",Kartový poplatok,,
306,,2024-05-26,-0.17,EUR,"Spracov. transakcií v inej mene ako EUR,2232,5,Karta c. 4544 17** **** 6461Poplatok za spracovanie transakcií v inej mene ako EUR25.05.2024 16:46:36 368.0000 UAHPID ARSENALOM 1 LVIV UA",Kartový poplatok,,
307,,2024-05-26,-0.28,EUR,"Spracov. transakcií v inej mene ako EUR,2232,5,Karta c. 4544 17** **** 6461Poplatok za spracovanie transakcií v inej mene ako EUR26.05.2024 00:20:05 600.0000 UAHRESTORANTSARGRAD MILA UA",Kartový poplatok,,
308,,2024-05-26,-2.08,EUR,"Spracov. transakcií v inej mene ako EUR,2232,5,Karta c. 4544 17** **** 6461Poplatok za spracovanie transakcií v inej mene ako EUR26.05.2024 00:18:25 4480.0000 UAHRESTORANTSARGRAD MILA UA",Kartový poplatok,,
309,,2024-05-26,-0.01,EUR,"Spracov. transakcií v inej mene ako EUR,2232,5,Karta c. 4544 17** **** 6461Poplatok za spracovanie transakcií v inej mene ako EUR25.05.2024 17:44:51 32.0000 UAHU GO ST. MYLIATYN UA",Kartový poplatok,,
310,,2024-05-26,-0.16,EUR,"Spracov. transakcií v inej mene ako EUR,2232,5,Karta c. 4544 17** **** 6461Poplatok za spracovanie transakcií v inej mene ako EUR25.05.2024 17:42:50 355.5000 UAHU GO ST. MYLIATYN UA",Kartový poplatok,,
311,,2024-05-26,-1.86,EUR,"Spracov. transakcií v inej mene ako EUR,2232,5,Karta c. 4544 17** **** 6461Poplatok za spracovanie transakcií v inej mene ako EUR25.05.2024 19:53:31 4017.5300 UAHAZK UPG KORNIN UA",Kartový poplatok,,
312,,2024-05-26,-1.14,EUR,"Spracov. transakcií v inej mene ako EUR,2232,5,Karta c. 4544 17** **** 6461Poplatok za spracovanie transakcií v inej mene ako EUR25.05.2024 19:55:01 2449.6400 UAHAZK UPG KORNIN UA",Kartový poplatok,,
313,,2024-05-26,-0.25,EUR,Poplatok za platbu kartou,Poplatok za kartovú transakciu,,
314,,2024-05-26,-0.74,EUR,"B1815565961-44544 17** **** 6461;U GO ,ST. MYLIATYN ,UA ;25.05.2024 17:44:51;32;UAH;CashBack:0 EUR",Platba kartou,,
315,,2024-05-26,-8.24,EUR,"B1815565960-44544 17** **** 6461;U GO ,ST. MYLIATYN ,UA ;25.05.2024 17:42:50;355.5;UAH;CashBack:0 EUR",Platba kartou,,
316,,2024-05-26,-0.25,EUR,Poplatok za platbu kartou,Poplatok za kartovú transakciu,,
317,,2024-05-26,-67.82,EUR,"B1815564120-44544 17** **** 6461;PID ARSENALOM 2 ,LVIV ,UA ;25.05.2024 16:48:18;2925;UAH;CashBack:0 EUR",Platba kartou,,
318,,2024-05-26,-0.25,EUR,Poplatok za platbu kartou,Poplatok za kartovú transakciu,,
319,,2024-05-26,-8.53,EUR,"B1815564114-44544 17** **** 6461;PID ARSENALOM 1 ,LVIV ,UA ;25.05.2024 16:46:36;368;UAH;CashBack:0 EUR",Platba kartou,,
320,,2024-05-26,-0.25,EUR,Poplatok za platbu kartou,Poplatok za kartovú transakciu,,
321,,2024-05-26,-0.25,EUR,Poplatok za platbu kartou,Poplatok za kartovú transakciu,,
322,,2024-05-26,-13.91,EUR,"B1815554006-44544 17** **** 6461;RESTORANTSARGRAD ,MILA ,UA ;26.05.2024 00:20:05;600;UAH;CashBack:0 EUR",Platba kartou,,
323,,2024-05-26,-0.25,EUR,Poplatok za platbu kartou,Poplatok za kartovú transakciu,,
324,,2024-05-26,-103.87,EUR,"B1815554003-44544 17** **** 6461;RESTORANTSARGRAD ,MILA ,UA ;26.05.2024 00:18:25;4480;UAH;CashBack:0 EUR",Platba kartou,,
325,,2024-05-26,-0.25,EUR,Poplatok za platbu kartou,Poplatok za kartovú transakciu,,
326,,2024-05-26,-93.15,EUR,"B1815553853-44544 17** **** 6461;AZK UPG ,KORNIN ,UA ;25.05.2024 19:53:31;4017.53;UAH;CashBack:0 EUR",Platba kartou,,
327,,2024-05-26,-0.25,EUR,Poplatok za platbu kartou,Poplatok za kartovú transakciu,,
328,,2024-05-26,-56.8,EUR,"B1815553849-44544 17** **** 6461;AZK UPG ,KORNIN ,UA ;25.05.2024 19:55:01;2449.64;UAH;CashBack:0 EUR",Platba kartou,,
329,,2024-05-26,-0.25,EUR,Poplatok za platbu kartou,Poplatok za kartovú transakciu,,
330,,2024-05-26,-2.56,EUR,"B1815549982-44544 17** **** 6461;PRZEMYSKIE CEN. K55192 ,Przemysl ,PL ;25.05.2024 11:53:33 ;CashBack:0 EUR",Platba kartou,,
331,,2024-05-26,-0.25,EUR,Poplatok za platbu kartou,Poplatok za kartovú transakciu,,
332,,2024-05-26,-11.01,EUR,"B1815549847-44544 17** **** 6461;PRZEMYSKIE CEN. K55192 ,Przemysl ,PL ;25.05.2024 11:37:49 ;CashBack:0 EUR",Platba kartou,,
333,,2024-05-26,-0.25,EUR,Poplatok za platbu kartou,Poplatok za kartovú transakciu,,
334,,2024-05-26,-294.0,EUR,"B1815215748-44544 17** **** 6461;HOTEL ARTIN-RESTAUR,BAR. ,BARDEJOV ,SK ;25.05.2024 07:24:35 ;CashBack:0 EUR",Platba kartou,,
335,,2024-05-26,-0.25,EUR,Poplatok za platbu kartou,Poplatok za kartovú transakciu,,
336,,2024-05-26,-8.8,EUR,"B1815211755-44544 17** **** 6461;HOTEL ARTIN-RESTAUR,BAR. ,BARDEJOV ,SK ;25.05.2024 00:29:10 ;CashBack:0 EUR",Platba kartou,,
337,,2024-05-26,-0.25,EUR,Poplatok za platbu kartou,Poplatok za kartovú transakciu,,
338,,2024-05-26,-200.0,EUR,"B1815089295-44544 17** **** 6916;FACEBK *ZU5J95GYT2 ,fb.me/ads ,IE ;25.05.2024 21:49:56 ;CashBack:0 EUR",Platba kartou,,
339,,2024-05-26,-0.25,EUR,Poplatok za platbu kartou,Poplatok za kartovú transakciu,,
340,,2024-05-26,-500.0,EUR,"B1815091519-44544 17** **** 6916;FACEBK* ,fb.me/ads ,IE ;25.05.2024 21:18:02 ;CashBack:0 EUR",Platba kartou,,
341,,2024-05-25,-0.25,EUR,Poplatok za platbu kartou,Poplatok za kartovú transakciu,,
342,,2024-05-25,-14.0,EUR,"B1814393926-44544 17** **** 6916;TEDI,TV,KOMENSKEHO ,TREBISOV ,SK ;24.05.2024 15:09:37 ;CashBack:0 EUR",Platba kartou,,
343,,2024-05-25,-0.25,EUR,Poplatok za platbu kartou,Poplatok za kartovú transakciu,,
344,,2024-05-25,-200.0,EUR,"B1814301689-44544 17** **** 6916;FACEBK *8BJKH4YYT2 ,fb.me/ads ,IE ;24.05.2024 23:16:38 ;CashBack:0 EUR",Platba kartou,,
345,,2024-05-25,-0.25,EUR,Poplatok za platbu kartou,Poplatok za kartovú transakciu,,
346,,2024-05-25,-130.05,EUR,"B1814266808-44544 17** **** 6916;BKG*BOOKING.COM HOTEL ,(888)850-3958 ,NL ;25.05.2024 00:01:57 ;CashBack:0 EUR",Platba kartou,,
347,,2024-05-25,-0.25,EUR,Poplatok za platbu kartou,Poplatok za kartovú transakciu,,
348,,2024-05-25,-500.0,EUR,"B1814217966-44544 17** **** 6916;FACEBK* ,fb.me/ads ,IE ;24.05.2024 20:38:01 ;CashBack:0 EUR",Platba kartou,,
349,,2024-05-25,-0.25,EUR,Poplatok za platbu kartou,Poplatok za kartovú transakciu,,
350,,2024-05-25,-3.93,EUR,"B1814014817-44544 17** **** 6916;FACEBK *KET335QYT2 ,fb.me/ads ,IE ;24.05.2024 06:39:53 ;CashBack:0 EUR",Platba kartou,,
351,,2024-05-24,-0.25,EUR,Poplatok za platbu kartou,Poplatok za kartovú transakciu,,
352,,2024-05-24,-200.0,EUR,"B1813581113-44544 17** **** 6916;FACEBK *LW3LU4CZT2 ,fb.me/ads ,IE ;23.05.2024 23:47:45 ;CashBack:0 EUR",Platba kartou,,
353,,2024-05-24,-0.25,EUR,Poplatok za platbu kartou,Poplatok za kartovú transakciu,,
354,,2024-05-24,-500.0,EUR,"B1813130408-44544 17** **** 6916;FACEBK* ,fb.me/ads ,IE ;23.05.2024 10:25:26 ;CashBack:0 EUR",Platba kartou,,
355,"Regionpress s.r.o, IČO: 36252417",2024-05-24,-5688.0,EUR,letaky,Platobný príkaz na úhradu / FIT 2.0 (EB),974240008.0,
356,,2024-05-23,-0.25,EUR,Poplatok za platbu kartou,Poplatok za kartovú transakciu,,
357,,2024-05-23,-200.0,EUR,"B1813061204-44544 17** **** 6916;FACEBK* ,fb.me/ads ,IE ;23.05.2024 04:24:39 ;CashBack:0 EUR",Platba kartou,,
358,,2024-05-23,-0.25,EUR,Poplatok za platbu kartou,Poplatok za kartovú transakciu,,
359,,2024-05-23,-187.0,EUR,"B1812262950-44544 17** **** 6916;FACEBK* ,fb.me/ads ,IE ;22.05.2024 07:16:38 ;CashBack:0 EUR",Platba kartou,,
360,,2024-05-23,-0.25,EUR,Poplatok za platbu kartou,Poplatok za kartovú transakciu,,
361,,2024-05-23,-500.0,EUR,"B1811430043-44544 17** **** 6916;FACEBK* ,fb.me/ads ,IE ;21.05.2024 06:59:42 ;CashBack:0 EUR",Platba kartou,,
362,Mesto Stará Ľubovňa ICO: 00330167,2024-05-22,-52.5,EUR,Miestna dan,Platobný príkaz na úhradu / FIT 2.0 (EB),1500000114.0,
363,FAMI s.r.o. ICO: 36319970,2024-05-22,-3652.2,EUR,Tlacoviny,Platobný príkaz na úhradu / FIT 2.0 (EB),240300162.0,
364,TJS s.r.o. ICO: 52184781,2024-05-22,-100.0,EUR,Prenajom priestorov,Platobný príkaz na úhradu / FIT 2.0 (EB),2400005.0,
365,Finančné riaditeľstvo Slovenskej republiky ICO: 42,2024-05-22,-475.42,EUR,DPH 4/2024,Platobný príkaz na úhradu / FIT 2.0 (EB),1100042024.0,
366,"Kultúrny dom Andreja Hlinku, a.s. ICO: 36010456",2024-05-22,-80.0,EUR,Prenajom priestorov,Platobný príkaz na úhradu / FIT 2.0 (EB),2400179.0,
367,"SofiaCare, s.r.o. ICO: 50044982",2024-05-22,-2500.0,EUR,Marketingove sluzby,Platobný príkaz na úhradu / FIT 2.0 (EB),2024009.0,
368,Radoslav Hajnoš ICO: 55238416,2024-05-22,-1000.0,EUR,Videoprodukcia,Platobný príkaz na úhradu / FIT 2.0 (EB),2024016.0,
369,Rozpočtová oganizácia Lukus ICO: 42313902,2024-05-22,-300.0,EUR,Prenajom priestorov,Platobný príkaz na úhradu / FIT 2.0 (EB),14.0,
370,WESTWOOD Slovakia s.r.o. ICO: 35831839,2024-05-22,-1320.0,EUR,OOH,Platobný príkaz na úhradu / FIT 2.0 (EB),240240.0,
371,Pressburgpress s.r.o. ICO: 45979863,2024-05-22,-1188.0,EUR,Tlacoviny,Platobný príkaz na úhradu / FIT 2.0 (EB),2024050046.0,
372,,2024-05-21,-8.0,EUR,Poplatok za výber hotovosti,Poplatok,,
373,,2024-05-21,-6000.0,EUR,,Výber hotovosti,,
374,Plotbase s.r.o. ICO: 45674515,2024-05-21,-442.89,EUR,Beachflagy,Platobný príkaz na úhradu / FIT 2.0 (EB),113050.0,
375,Hutermann Eastern Europe Division a.s. ICO: 257950,2024-05-20,-394.31,EUR,prenajom zariadenia,Platobný príkaz na úhradu / FIT 2.0 (EB),2400049.0,
376,"SLOVNAFT, a.s. ICO: 31322832",2024-05-20,-1745.68,EUR,PHM,Platobný príkaz na úhradu / FIT 2.0 (EB),3082085343.0,
377,,2024-05-19,-0.25,EUR,Poplatok za platbu kartou,Poplatok za kartovú transakciu,,
378,,2024-05-19,-10.14,EUR,"B1809835829-44544 17** **** 6916;BILLA SPOL S RO 314 ,LEVOCA ,SK ;18.05.2024 11:55:33 ;CashBack:0 EUR",Platba kartou,,
379,,2024-05-19,-0.25,EUR,Poplatok za platbu kartou,Poplatok za kartovú transakciu,,
380,,2024-05-19,-25.97,EUR,"B1809498800-44544 17** **** 6916;KAUFLAND 1430,PO,BARDEJ. ,PRESOV ,SK ;18.05.2024 12:52:40 ;CashBack:0 EUR",Platba kartou,,
381,,2024-05-19,-0.25,EUR,Poplatok za platbu kartou,Poplatok za kartovú transakciu,,
382,,2024-05-19,-41.05,EUR,"B1808873166-44544 17** **** 6916;Tesco Presov ,Presov ,SK ;17.05.2024 16:23:16 ;CashBack:0 EUR",Platba kartou,,
383,,2024-05-19,-0.25,EUR,Poplatok za platbu kartou,Poplatok za kartovú transakciu,,
384,,2024-05-19,-71.02,EUR,"B1808234191-44544 17** **** 6916;PAGURKO Masiarstvo ,Presov ,SK ;17.05.2024 15:34:39 ;CashBack:0 EUR",Platba kartou,,
385,,2024-05-17,-0.25,EUR,Poplatok za platbu kartou,Poplatok za kartovú transakciu,,
386,,2024-05-17,-170.0,EUR,"B1807339652-44544 17** **** 6916;FACEBK* ,fb.me/ads ,IE ;16.05.2024 20:32:28 ;CashBack:0 EUR",Platba kartou,,
387,SLOVENSKO,2024-05-17,50000.0,EUR,prevod na TU,Bezhotovostný vklad,7.0,
388,,2024-05-17,-0.25,EUR,Poplatok za platbu kartou,Poplatok za kartovú transakciu,,
389,,2024-05-17,-14.9,EUR,"B1807091820-44544 17** **** 6916;Radio-Amater Schotter ,Presov ,SK ;15.05.2024 13:42:58 ;CashBack:0 EUR",Platba kartou,,
390,,2024-05-17,-0.25,EUR,Poplatok za platbu kartou,Poplatok za kartovú transakciu,,
391,,2024-05-17,-154.0,EUR,"B1806232872-44544 17** **** 6916;FACEBK* ,fb.me/ads ,IE ;15.05.2024 07:38:38 ;CashBack:0 EUR",Platba kartou,,
392,GARNI HOTEL 31 ICO: 45629102,2024-05-16,-50.0,EUR,Prenajom priestorov,Platobný príkaz na úhradu / FIT 2.0 (EB),2400046.0,
393,"MEM Agency, s.r.o. ICO: 51447321",2024-05-16,-1440.0,EUR,Technicke zabezbecenie podujati,Platobný príkaz na úhradu / FIT 2.0 (EB),20240002.0,
394,Mesto Púchov ICO: 00317748,2024-05-16,-4.83,EUR,Miestna dan,Platobný príkaz na úhradu / FIT 2.0 (EB),382024.0,
395,"SPECTRUM GROUP, a.s. ICO: 50967932",2024-05-16,-144.0,EUR,Prenajom priestorov,Platobný príkaz na úhradu / FIT 2.0 (EB),2405012.0,
396,kláštor s.r.o. ICO: 50827936,2024-05-16,-40.0,EUR,Prenajom priestorov,Platobný príkaz na úhradu / FIT 2.0 (EB),20240069.0,
397,Insane prodiction s.r.o. ICO: 52340457,2024-05-16,-4990.0,EUR,Videoprodukcia,Platobný príkaz na úhradu / FIT 2.0 (EB),20240006.0,
398,Mestské kultúrne stredisko ICO: 00355046,2024-05-16,-325.0,EUR,Prenajom priestorov,Platobný príkaz na úhradu / FIT 2.0 (EB),69.0,
399,Initiative s.r.o. ICO: 50860917,2024-05-16,-5567.69,EUR,OOH billboardy,Platobný príkaz na úhradu / FIT 2.0 (EB),2624011.0,
400,Ing. Michal Pročko ICO: 52224031,2024-05-16,-756.0,EUR,Audio-vizualne sluzby,Platobný príkaz na úhradu / FIT 2.0 (EB),14052024.0,
401,Ing. Michal Pročko ICO: 52224031,2024-05-16,-1458.0,EUR,Audio-vizualne sluzby,Platobný príkaz na úhradu / FIT 2.0 (EB),12052024.0,
402,Sketch s.r.o. ICO: 54087988,2024-05-16,-2923.79,EUR,Merch,Platobný príkaz na úhradu / FIT 2.0 (EB),7662024.0,
403,,2024-05-16,-0.25,EUR,Poplatok za platbu kartou,Poplatok za kartovú transakciu,,
404,,2024-05-16,-500.0,EUR,"B1805418093-44544 17** **** 6916;FACEBK* ,fb.me/ads ,IE ;14.05.2024 22:46:55 ;CashBack:0 EUR",Platba kartou,,
405,,2024-05-16,-0.25,EUR,Poplatok za platbu kartou,Poplatok za kartovú transakciu,,
406,,2024-05-16,-499.99,EUR,"B1805295940-44544 17** **** 6916;Adobe ,ADOBE.COM ,IE ;13.05.2024 11:10:57 ;CashBack:0 EUR",Platba kartou,,
407,,2024-05-16,-0.25,EUR,Poplatok za platbu kartou,Poplatok za kartovú transakciu,,
408,,2024-05-16,-269.99,EUR,"B1805295935-44544 17** **** 6916;Adobe ,ADOBE.COM ,IE ;13.05.2024 11:13:11 ;CashBack:0 EUR",Platba kartou,,
409,Martin Bagar ICO: 50355031,2024-05-15,-2714.0,EUR,Audio-vizualne sluzby,Platobný príkaz na úhradu / FIT 2.0 (EB),20240005.0,
410,,2024-05-14,-0.25,EUR,Poplatok za platbu kartou,Poplatok za kartovú transakciu,,
411,,2024-05-14,-500.0,EUR,"B1804526882-44544 17** **** 6916;FACEBK* ,fb.me/ads ,IE ;13.05.2024 20:41:29 ;CashBack:0 EUR",Platba kartou,,
412,,2024-05-14,-0.25,EUR,Poplatok za platbu kartou,Poplatok za kartovú transakciu,,
413,,2024-05-14,-140.0,EUR,"B1804528422-44544 17** **** 6916;FACEBK* ,fb.me/ads ,IE ;13.05.2024 22:32:09 ;CashBack:0 EUR",Platba kartou,,
414,,2024-05-14,-0.25,EUR,"Poplatok za výber kartou,2203,5,4544 17** **** 6461;ATM Recycler Retro BA ,Bratislava ,SK ;14.05.2024 18:16:40",Poplatok za kartovú transakciu,,
415,,2024-05-14,-700.0,EUR,"B4053853076-214544 17** **** 6461;ATM Recycler Retro BA ,Bratislava ,SK ;14.05.2024 18:16:40 ",Výber kartou,,
416,Mesto Trenčín ICO: 00312037,2024-05-14,-25.0,EUR,Spravny poplatok,Platobný príkaz na úhradu / FIT 2.0 (EB),5010013320.0,
417,FAMI s.r.o. ICO: 36319970,2024-05-14,-510.0,EUR,Tlacoviny,Platobný príkaz na úhradu / FIT 2.0 (EB),240300142.0,
418,,2024-05-13,-0.25,EUR,Poplatok za platbu kartou,Poplatok za kartovú transakciu,,
419,,2024-05-13,-500.0,EUR,"B1803799244-44544 17** **** 6916;FACEBK* ,fb.me/ads ,IE ;12.05.2024 17:11:37 ;CashBack:0 EUR",Platba kartou,,
420,Dávid Mariančík MARSTUDIO IČO: 50033964,2024-05-13,-800.0,EUR,Audio-vizualne sluzby,Platobný príkaz na úhradu / FIT 2.0 (EB),20240006.0,
421,ETARGET SE ICO: 35807113,2024-05-13,-24000.0,EUR,Online kampan,Platobný príkaz na úhradu / FIT 2.0 (EB),5002400321.0,
422,Mgr. Branislav Gigac ICO:55086217,2024-05-13,-2800.0,EUR,Prace na kampani,Platobný príkaz na úhradu / FIT 2.0 (EB),2024030003.0,
423,Bittner print s.r.o. ICO: 35736534,2024-05-13,-2235.12,EUR,Banner,Platobný príkaz na úhradu / FIT 2.0 (EB),1020241917.0,
424,PTA spol. s.r.o. ICO: 36680958,2024-05-13,-4407.6,EUR,Merch,Platobný príkaz na úhradu / FIT 2.0 (EB),24050601.0,
425,Ringier Slovakia Media s.r.o. ICO: 53708792,2024-05-13,-2282.4,EUR,Online kampaň,Platobný príkaz na úhradu / FIT 2.0 (EB),3824900546.0,
426,Tomáš Raffaj - IČO: 55530702,2024-05-13,-492.0,EUR,ubytovanie,Platobný príkaz na úhradu / FIT 2.0 (EB),42024.0,
427,,2024-05-12,-0.25,EUR,Poplatok za platbu kartou,Poplatok za kartovú transakciu,,
428,,2024-05-12,-81.14,EUR,"B1803510531-44544 17** **** 6916;BILLA SPOL S RO 527 ,PRESOV ,SK ;11.05.2024 09:39:56 ;CashBack:0 EUR",Platba kartou,,
429,,2024-05-12,-0.25,EUR,Poplatok za platbu kartou,Poplatok za kartovú transakciu,,
430,,2024-05-12,-12.47,EUR,"B1803020837-44544 17** **** 6916;MASO - UDENINY 3881 ,SPISSKA NOVA ,SK ;10.05.2024 10:41:11 ;CashBack:0 EUR",Platba kartou,,
431,,2024-05-12,-0.25,EUR,Poplatok za platbu kartou,Poplatok za kartovú transakciu,,
432,,2024-05-12,-330.9,EUR,"B1802888041-44544 17** **** 6916;KINEKUS, s.r.o. ,PRESOV ,SK ;10.05.2024 13:12:27 ;CashBack:0 EUR",Platba kartou,,
433,,2024-05-12,-0.25,EUR,Poplatok za platbu kartou,Poplatok za kartovú transakciu,,
434,,2024-05-12,-500.0,EUR,"B1801975921-44544 17** **** 6916;FACEBK* ,fb.me/ads ,IE ;10.05.2024 12:56:56 ;CashBack:0 EUR",Platba kartou,,
435,,2024-05-10,-0.25,EUR,Poplatok za platbu kartou,Poplatok za kartovú transakciu,,
436,,2024-05-10,-119.95,EUR,"B1801206443-44544 17** **** 6461;PB STANICA NIVY BRATISL ,BRATISLAVA ,SK ;09.05.2024 10:20:58 ;CashBack:0 EUR",Platba kartou,,
437,SLOVENSKO,2024-05-10,50000.0,EUR,prevod na TU,Bezhotovostný vklad,6.0,
438,,2024-05-09,-0.25,EUR,Poplatok za platbu kartou,Poplatok za kartovú transakciu,,
439,,2024-05-09,-500.0,EUR,"B1800617443-44544 17** **** 6916;FACEBK* ,fb.me/ads ,IE ;08.05.2024 21:18:05 ;CashBack:0 EUR",Platba kartou,,
440,"SLOVNAFT, a.s. ICO: 31322832",2024-05-09,-615.12,EUR,PHM,Platobný príkaz na úhradu / FIT 2.0 (EB),4592074642.0,
441,"Chili Peppers, s.r.o. ICO: 46354972",2024-05-09,-2040.0,EUR,Graficke prace,Platobný príkaz na úhradu / FIT 2.0 (EB),222024.0,
442,Urbárske spoločenstvo v Spišskom Štiavniku ICO: 37,2024-05-09,-500.0,EUR,Prenajom priestorov,Platobný príkaz na úhradu / FIT 2.0 (EB),2024001.0,
443,DigiSkilly s.r.o. ICO: 55632165,2024-05-09,-12000.0,EUR,Online kampan,Platobný príkaz na úhradu / FIT 2.0 (EB),2024000014.0,
444,Engerio s.r.o. ICO: 54507057,2024-05-09,-24000.0,EUR,Online kampan,Platobný príkaz na úhradu / FIT 2.0 (EB),20240275.0,
445,SENIOR GASTRO s.r.o. ICO: 45649839,2024-05-09,-500.0,EUR,Prenajom priestorov,Platobný príkaz na úhradu / FIT 2.0 (EB),202403009.0,
446,KÜHTREIBEROVÁ Kristína ICO: 30895197,2024-05-09,-290.0,EUR,Prenajom priestorov,Platobný príkaz na úhradu / FIT 2.0 (EB),20240001.0,
447,Mestské kultúrne stredisko Rimavská Sobota ICO: 00,2024-05-09,-50.0,EUR,Prenajom priestorov,Platobný príkaz na úhradu / FIT 2.0 (EB),2024068.0,
448,Rodinné centrum SLUNCE n.o ICO: 45735484,2024-05-09,-100.0,EUR,Prenajom priestorov,Platobný príkaz na úhradu / FIT 2.0 (EB),32024.0,
449,Mestské kultúrne stredisko Rimavská Sobota ICO: 00,2024-05-09,-40.0,EUR,Prenajom priestorov,Platobný príkaz na úhradu / FIT 2.0 (EB),2024069.0,
450,,2024-05-09,-0.25,EUR,Poplatok za platbu kartou,Poplatok za kartovú transakciu,,
451,,2024-05-09,-355.49,EUR,"B1799593499-44544 17** **** 6916;FACEBK* ,fb.me/ads ,IE ;07.05.2024 06:40:18 ;CashBack:0 EUR",Platba kartou,,
452,,2024-05-07,-0.25,EUR,Poplatok za platbu kartou,Poplatok za kartovú transakciu,,
453,,2024-05-07,-90.0,EUR,"B1798742062-44544 17** **** 6916;FACEBK* ,fb.me/ads ,IE ;06.05.2024 18:37:01 ;CashBack:0 EUR",Platba kartou,,
454,,2024-05-05,-0.25,EUR,Poplatok za platbu kartou,Poplatok za kartovú transakciu,,
455,,2024-05-05,-30.58,EUR,"B1797689577-44544 17** **** 6916;KAUFLAND 1430,PO,BARDEJ. ,PRESOV ,SK ;04.05.2024 12:08:02 ;CashBack:0 EUR",Platba kartou,,
456,,2024-05-05,-0.25,EUR,Poplatok za platbu kartou,Poplatok za kartovú transakciu,,
457,,2024-05-05,-76.33,EUR,"B1797689569-44544 17** **** 6916;KAUFLAND 1430,PO,BARDEJ. ,PRESOV ,SK ;04.05.2024 12:07:05 ;CashBack:0 EUR",Platba kartou,,
458,,2024-05-05,-0.25,EUR,Poplatok za platbu kartou,Poplatok za kartovú transakciu,,
459,,2024-05-05,-500.0,EUR,"B1797467244-44544 17** **** 6916;FACEBK* ,fb.me/ads ,IE ;04.05.2024 21:12:04 ;CashBack:0 EUR",Platba kartou,,
460,,2024-05-05,-60.0,EUR,"B1797328000-44544 17** **** 6916;FACEBK* ,fb.me/ads ,IE ;04.05.2024 07:04:58 ;CashBack:0 EUR",Platba kartou,,
461,,2024-05-05,-0.25,EUR,Poplatok za platbu kartou,Poplatok za kartovú transakciu,,
462,,2024-05-04,-0.25,EUR,Poplatok za platbu kartou,Poplatok za kartovú transakciu,,
463,,2024-05-04,-40.0,EUR,"B1795662817-44544 17** **** 6916;FACEBK* ,fb.me/ads ,IE ;02.05.2024 21:36:58 ;CashBack:0 EUR",Platba kartou,,
464,,2024-05-04,-0.25,EUR,Poplatok za platbu kartou,Poplatok za kartovú transakciu,,
465,,2024-05-04,-33.0,EUR,"B1795558544-44544 17** **** 6916;FACEBK* ,fb.me/ads ,IE ;02.05.2024 15:07:22 ;CashBack:0 EUR",Platba kartou,,
466,,2024-05-04,-0.25,EUR,Poplatok za platbu kartou,Poplatok za kartovú transakciu,,
467,,2024-05-04,-27.0,EUR,"B1795501311-44544 17** **** 6916;FACEBK* ,fb.me/ads ,IE ;02.05.2024 06:12:29 ;CashBack:0 EUR",Platba kartou,,
468,,2024-05-02,-0.25,EUR,Poplatok za platbu kartou,Poplatok za kartovú transakciu,,
469,,2024-05-02,-22.0,EUR,"B1795265537-44544 17** **** 6916;FACEBK* ,fb.me/ads ,IE ;01.05.2024 19:40:15 ;CashBack:0 EUR",Platba kartou,,
470,,2024-05-02,-0.25,EUR,Poplatok za platbu kartou,Poplatok za kartovú transakciu,,
471,,2024-05-02,-18.0,EUR,"B1795163462-44544 17** **** 6916;FACEBK* ,fb.me/ads ,IE ;01.05.2024 15:05:00 ;CashBack:0 EUR",Platba kartou,,
472,,2024-05-02,-0.25,EUR,Poplatok za platbu kartou,Poplatok za kartovú transakciu,,
473,,2024-05-02,-15.0,EUR,"B1795127954-44544 17** **** 6916;FACEBK* ,fb.me/ads ,IE ;01.05.2024 08:54:26 ;CashBack:0 EUR",Platba kartou,,
474,,2024-05-02,-0.25,EUR,Poplatok za platbu kartou,Poplatok za kartovú transakciu,,
475,,2024-05-02,-12.0,EUR,"B1794203848-44544 17** **** 6916;FACEBK* ,fb.me/ads ,IE ;30.04.2024 16:03:18 ;CashBack:0 EUR",Platba kartou,,
476,,2024-05-02,-0.25,EUR,Poplatok za platbu kartou,Poplatok za kartovú transakciu,,
477,,2024-05-02,-500.0,EUR,"B1794102078-44544 17** **** 6916;FACEBK* ,fb.me/ads ,IE ;30.04.2024 15:53:09 ;CashBack:0 EUR",Platba kartou,,
478,,2024-04-30,-5.0,EUR,Poplatok za vedenie účtu,Poplatok,,
479,,2024-04-30,-5.0,EUR,Zverejňovanie účtu,Poplatok,,
480,,2024-04-30,-0.25,EUR,Poplatok za platbu kartou,Poplatok za kartovú transakciu,,
481,,2024-04-30,-10.0,EUR,"B1794035206-44544 17** **** 6916;FACEBK* ,fb.me/ads ,IE ;30.04.2024 01:19:50 ;CashBack:0 EUR",Platba kartou,,
482,,2024-04-30,-3.15,EUR,"Vedenie Platobnej karty embosovanej,2315,5,Karta č. 4544 17** **** 6461Poplatok za Platobnú kartu",Kartový poplatok,,
483,Dávid Mariančík MARSTUDIO IČO: 50033964,2024-04-30,-800.0,EUR,Audio-vizualne sluzby,Platobný príkaz na úhradu / FIT 2.0 (EB),20240005.0,
484,"Regionpress s.r.o, IČO: 36252417",2024-04-30,-3144.0,EUR,Letáky,Platobný príkaz na úhradu / FIT 2.0 (EB),974240004.0,
485,SLOVENSKO,2024-04-30,50000.0,EUR,prevod na TU,Bezhotovostný vklad,5.0,
486,,2024-04-29,-0.25,EUR,Poplatok za platbu kartou,Poplatok za kartovú transakciu,,
487,,2024-04-29,-500.0,EUR,"B1792729960-44544 17** **** 6916;FACEBK* ,fb.me/ads ,IE ;28.04.2024 16:36:24 ;CashBack:0 EUR",Platba kartou,,
488,Insane production sro. IČO:52340457,2024-04-29,-8000.0,EUR,Videoprodukcia,Platobný príkaz na úhradu / FIT 2.0 (EB),2020240001.0,
489,Michal Babčan,2024-04-29,-1500.0,EUR,Grafické práce,Platobný príkaz na úhradu / FIT 2.0 (EB),82024.0,
490,,2024-04-28,-0.25,EUR,Poplatok za platbu kartou,Poplatok za kartovú transakciu,,
491,,2024-04-28,-8.0,EUR,"B1792121211-44544 17** **** 6916;FACEBK* ,fb.me/ads ,IE ;27.04.2024 19:33:26 ;CashBack:0 EUR",Platba kartou,,
492,,2024-04-28,-0.25,EUR,Poplatok za platbu kartou,Poplatok za kartovú transakciu,,
493,,2024-04-28,-5.0,EUR,"B1791138963-44544 17** **** 6916;FACEBK* ,fb.me/ads ,IE ;26.04.2024 06:33:08 ;CashBack:0 EUR",Platba kartou,,
494,,2024-04-28,-0.25,EUR,Poplatok za platbu kartou,Poplatok za kartovú transakciu,,
495,,2024-04-28,-6.0,EUR,"B1791110472-44544 17** **** 6916;FACEBK* ,fb.me/ads ,IE ;26.04.2024 12:25:36 ;CashBack:0 EUR",Platba kartou,,
496,,2024-04-26,-0.25,EUR,Poplatok za platbu kartou,Poplatok za kartovú transakciu,,
497,,2024-04-26,-4.0,EUR,"B1790357009-44544 17** **** 6916;FACEBK* ,fb.me/ads ,IE ;25.04.2024 21:15:20 ;CashBack:0 EUR",Platba kartou,,
498,,2024-04-26,-0.25,EUR,Poplatok za platbu kartou,Poplatok za kartovú transakciu,,
499,,2024-04-26,-3.0,EUR,"B1790355523-44544 17** **** 6916;FACEBK* ,fb.me/ads ,IE ;25.04.2024 19:10:03 ;CashBack:0 EUR",Platba kartou,,
500,,2024-04-26,-0.25,EUR,Poplatok za platbu kartou,Poplatok za kartovú transakciu,,
501,,2024-04-26,-2.0,EUR,"B1790284284-44544 17** **** 6916;FACEBK* ,fb.me/ads ,IE ;25.04.2024 08:39:15 ;CashBack:0 EUR",Platba kartou,,
502,,2024-04-26,-0.25,EUR,Poplatok za platbu kartou,Poplatok za kartovú transakciu,,
503,,2024-04-26,-2.0,EUR,"B1790274461-44544 17** **** 6916;FACEBK* ,fb.me/ads ,IE ;25.04.2024 15:19:23 ;CashBack:0 EUR",Platba kartou,,
504,,2024-04-26,-0.25,EUR,Poplatok za platbu kartou,Poplatok za kartovú transakciu,,
505,,2024-04-26,-0.25,EUR,Poplatok za platbu kartou,Poplatok za kartovú transakciu,,
506,,2024-04-26,-2.0,EUR,"B1790276122-44544 17** **** 6916;FACEBK* ,fb.me/ads ,IE ;25.04.2024 07:01:38 ;CashBack:0 EUR",Platba kartou,,
507,,2024-04-26,-2.0,EUR,"B1790264610-44544 17** **** 6916;FACEBK* ,fb.me/ads ,IE ;25.04.2024 16:59:05 ;CashBack:0 EUR",Platba kartou,,
508,,2024-04-26,-0.25,EUR,Poplatok za platbu kartou,Poplatok za kartovú transakciu,,
509,,2024-04-26,-2.0,EUR,"B1790254051-44544 17** **** 6916;FACEBK* ,fb.me/ads ,IE ;25.04.2024 13:24:50 ;CashBack:0 EUR",Platba kartou,,
510,,2024-04-26,-0.25,EUR,Poplatok za platbu kartou,Poplatok za kartovú transakciu,,
511,,2024-04-26,-2.0,EUR,"B1790208968-44544 17** **** 6916;FACEBK* ,fb.me/ads ,IE ;25.04.2024 10:34:04 ;CashBack:0 EUR",Platba kartou,,
512,,2024-04-25,-0.25,EUR,Poplatok za platbu kartou,Poplatok za kartovú transakciu,,
513,,2024-04-25,-2.0,EUR,"B1789527162-44544 17** **** 6916;FACEBK* ,fb.me/ads ,IE ;24.04.2024 22:13:04 ;CashBack:0 EUR",Platba kartou,,
514,,2024-04-25,-0.25,EUR,Poplatok za platbu kartou,Poplatok za kartovú transakciu,,
515,,2024-04-25,-2.0,EUR,"B1789528099-44544 17** **** 6916;FACEBK* ,fb.me/ads ,IE ;24.04.2024 23:55:19 ;CashBack:0 EUR",Platba kartou,,
516,,2024-04-25,-0.25,EUR,Poplatok za platbu kartou,Poplatok za kartovú transakciu,,
517,,2024-04-25,-480.0,EUR,"B1789341202-44544 17** **** 6916;FACEBK* ,fb.me/ads ,IE ;24.04.2024 10:54:28 ;CashBack:0 EUR",Platba kartou,,
518,Bittner print s.r.o. ICO: 35736534,2024-04-24,-168.0,EUR,Letaky,Platobný príkaz na úhradu / FIT 2.0 (EB),1020233687.0,
519,Bittner print s.r.o. ICO: 35736534,2024-04-24,-924.0,EUR,Letaky,Platobný príkaz na úhradu / FIT 2.0 (EB),1020233883.0,
520,TLAČIAREŇ VK print ICO: 44666926,2024-04-24,-72.0,EUR,Letak,Platobný príkaz na úhradu / FIT 2.0 (EB),2024027.0,
521,Mastské kultúrne stredisko ICO: 00186660,2024-04-24,-500.0,EUR,Prenajom priestorov,Platobný príkaz na úhradu / FIT 2.0 (EB),240237.0,
522,Mesto Námestovo ICO: 00314676,2024-04-24,-10.0,EUR,Rozhlas,Platobný príkaz na úhradu / FIT 2.0 (EB),1314400065.0,
523,Mesto Námestovo ICO: 00314676,2024-04-24,-360.0,EUR,Prenajom priestorov,Platobný príkaz na úhradu / FIT 2.0 (EB),1313400066.0,
524,"KOHA, s.r.o. ICO:46836055",2024-04-24,-150.0,EUR,Prenajom priestorov,Platobný príkaz na úhradu / FIT 2.0 (EB),2024002.0,
525,Finančné riaditeľstvo Slovenskej republiky ICO: 42,2024-04-24,-45.2,EUR,DPH3/2024,Platobný príkaz na úhradu / FIT 2.0 (EB),1100032024.0,
526,"MunicipalRealEstat sro,IČO:46313834",2024-04-24,-194.4,EUR,Prenajom priestorov,Platobný príkaz na úhradu / FIT 2.0 (EB),2452076.0,
527,Mestské kultúrne stredisko ICO: 00059404,2024-04-24,-100.0,EUR,Prenajom priestorov,Platobný príkaz na úhradu / FIT 2.0 (EB),20240069.0,
528,Slovnaft a.s. - IČO: 31322832,2024-04-24,-226.05,EUR,PHM,Platobný príkaz na úhradu / FIT 2.0 (EB),3082067322.0,
529,,2024-04-23,-400.0,EUR,"B4026518551-214544 17** **** 6461;ATM Recycler Retro BA ,Bratislava ,SK ;23.04.2024 18:11:46 ",Výber kartou,,
530,,2024-04-23,-0.25,EUR,"Poplatok za výber kartou,2203,5,4544 17** **** 6461;ATM Recycler Retro BA ,Bratislava ,SK ;23.04.2024 18:11:46",Poplatok za kartovú transakciu,,
531,,2024-04-21,-0.25,EUR,Poplatok za platbu kartou,Poplatok za kartovú transakciu,,
532,,2024-04-21,-37.3,EUR,"B1786670039-44544 17** **** 6916;KAUFLAND 1430,PO,BARDEJ. ,PRESOV ,SK ;20.04.2024 11:16:07 ;CashBack:0 EUR",Platba kartou,,
533,,2024-04-21,-0.25,EUR,Poplatok za platbu kartou,Poplatok za kartovú transakciu,,
534,,2024-04-21,-320.0,EUR,"B1785539338-44544 17** **** 6916;FACEBK YJY8F3C7S2 ,fb.me/ads ,IE ;19.04.2024 23:23:29 ;CashBack:0 EUR",Platba kartou,,
535,,2024-04-18,-0.25,EUR,Poplatok za platbu kartou,Poplatok za kartovú transakciu,,
536,,2024-04-18,-210.0,EUR,"B1784434061-44544 17** **** 6916;kiwi.com 516857660 ,Brno, Star* L ,CZ ;17.04.2024 12:09:59 ;CashBack:0 EUR",Platba kartou,,
537,Wellit development sro ICO:47583207,2024-04-18,-299.5,EUR,Programátorské služby,Platobný príkaz na úhradu / FIT 2.0 (EB),20240303.0,
538,,2024-04-18,-210.0,EUR,"B1782879534-44544 17** **** 6916;FACEBK 8HEE93Q7S2 ,fb.me/ads ,IE ;16.04.2024 19:41:55 ;CashBack:0 EUR",Platba kartou,,
539,,2024-04-18,-0.25,EUR,Poplatok za platbu kartou,Poplatok za kartovú transakciu,,
540,,2024-04-15,-0.25,EUR,Poplatok za platbu kartou,Poplatok za kartovú transakciu,,
541,,2024-04-15,-140.0,EUR,"B1781229103-44544 17** **** 6916;FACEBK JJ3GQ3Y6S2 ,fb.me/ads ,IE ;14.04.2024 10:45:55 ;CashBack:0 EUR",Platba kartou,,
542,,2024-04-14,-0.25,EUR,Poplatok za platbu kartou,Poplatok za kartovú transakciu,,
543,,2024-04-14,-80.07,EUR,"B1780749404-44544 17** **** 6916;KAUFLAND 1430,PO,BARDEJ. ,PRESOV ,SK ;13.04.2024 19:19:45 ;CashBack:0 EUR",Platba kartou,,
544,,2024-04-13,-0.25,EUR,Poplatok za platbu kartou,Poplatok za kartovú transakciu,,
545,,2024-04-13,-54.99,EUR,"B1779878419-44544 17** **** 6916;NAY ELEKTRODOM PRESOV ,LUBOTICE ,SK ;12.04.2024 12:46:02 ;CashBack:0 EUR",Platba kartou,,
546,,2024-04-13,-0.25,EUR,Poplatok za platbu kartou,Poplatok za kartovú transakciu,,
547,,2024-04-13,-419.11,EUR,"B1779390704-44544 17** **** 6916;EUROGASTROP Kapusany ,Kapusany ,SK ;12.04.2024 12:28:27 ;CashBack:0 EUR",Platba kartou,,
548,,2024-04-13,-0.25,EUR,Poplatok za platbu kartou,Poplatok za kartovú transakciu,,
549,,2024-04-13,-37.36,EUR,"B4010890560-214544 17** **** 6916;LIDL SLOVENSKO prevadz ,PRESOV ,;12.04.2024 11:41:36 ;CashBack:0 EUR",Platba kartou,,
550,,2024-04-11,-0.25,EUR,Poplatok za platbu kartou,Poplatok za kartovú transakciu,,
551,,2024-04-11,-90.0,EUR,"B1777546927-44544 17** **** 6916;FACEBK TX9833C7S2 ,fb.me/ads ,IE ;10.04.2024 11:52:44 ;CashBack:0 EUR",Platba kartou,,
552,HV print. spol. s.r.o. ICO: 31332862,2024-04-11,-494.02,EUR,Etikety,Platobný príkaz na úhradu / FIT 2.0 (EB),2024040341.0,
553,HV print. spol. s.r.o. ICO: 31332862,2024-04-11,-23.66,EUR,Etikety,Platobný príkaz na úhradu / FIT 2.0 (EB),2024030330.0,
554,X print s.r.o. ICO: 35742097,2024-04-11,-324.0,EUR,Letaky,Platobný príkaz na úhradu / FIT 2.0 (EB),240362.0,
555,"OIL JPM, s.r.o. ICO: 31644945",2024-04-11,-290.0,EUR,Prenajom,Platobný príkaz na úhradu / FIT 2.0 (EB),4240082.0,
556,Tlačiareň Kubík s.r.o. ICO: 47751011,2024-04-11,-2298.0,EUR,Merch samolepky,Platobný príkaz na úhradu / FIT 2.0 (EB),240100501.0,
557,,2024-04-11,-0.25,EUR,Poplatok za platbu kartou,Poplatok za kartovú transakciu,,
558,,2024-04-11,-280.0,EUR,"B1777206713-44544 17** **** 6916;Anton Janata ,Bratislava - ,SK ;09.04.2024 20:30:20 ;CashBack:0 EUR",Platba kartou,,
559,,2024-04-10,-0.25,EUR,"Poplatok za výber kartou,2203,5,4544 17** **** 6461;ATM Recycler VIVO BA II. ,Bratislava ,SK ;10.04.2024 18:58:45",Poplatok za kartovú transakciu,,
560,,2024-04-10,-200.0,EUR,"B4008532816-214544 17** **** 6461;ATM Recycler VIVO BA II. ,Bratislava ,SK ;10.04.2024 18:58:45 ",Výber kartou,,
561,"Plotbase, s.r.o. IČO: 45674515",2024-04-09,-742.9,EUR,"Roll up, pult",Platobný príkaz na úhradu / FIT 2.0 (EB),112277.0,
562,,2024-04-08,-0.25,EUR,Poplatok za platbu kartou,Poplatok za kartovú transakciu,,
563,,2024-04-08,-13.11,EUR,"B1775308942-44544 17** **** 6916;FACEBK N5UQV2Q7S2 ,fb.me/ads ,IE ;07.04.2024 07:34:26 ;CashBack:0 EUR",Platba kartou,,
564,,2024-04-07,-0.25,EUR,Poplatok za platbu kartou,Poplatok za kartovú transakciu,,
565,,2024-04-07,-60.0,EUR,"B1774611701-44544 17** **** 6916;FACEBK P2GZ5547S2 ,fb.me/ads ,IE ;06.04.2024 15:01:39 ;CashBack:0 EUR",Platba kartou,,
566,,2024-04-06,-0.25,EUR,Poplatok za platbu kartou,Poplatok za kartovú transakciu,,
567,,2024-04-06,-37.79,EUR,"B1774056712-44544 17** **** 6916;KAUFLAND 1120, PO, LEVO ,PRESOV ,SK ;05.04.2024 11:59:53 ;CashBack:0 EUR",Platba kartou,,
568,,2024-04-06,-0.25,EUR,Poplatok za platbu kartou,Poplatok za kartovú transakciu,,
569,,2024-04-06,-6.01,EUR,"B1773707583-44544 17** **** 6916;PAGURKO Masiarstvo ,Presov ,SK ;05.04.2024 12:26:51 ;CashBack:0 EUR",Platba kartou,,
570,Matěj Horník ICO: 52206572,2024-04-04,-2200.0,EUR,Socialne siete,Platobný príkaz na úhradu / FIT 2.0 (EB),424.0,
571,Martin Bagar ICO: 50355031,2024-04-04,-2700.0,EUR,Video produkcia,Platobný príkaz na úhradu / FIT 2.0 (EB),20240004.0,
572,Slovnaft a.s. - IČO: 31322832,2024-04-04,-16.0,EUR,PHM,Platobný príkaz na úhradu / FIT 2.0 (EB),3082057463.0,
573,KRYSTYNEK s.r.o. IČO: 47933909,2024-04-03,-840.0,EUR,Fotografovanie,Platobný príkaz na úhradu / FIT 2.0 (EB),2024014.0,
574,Mgr. Branislav Gigac IČO: 55086217,2024-04-03,-2700.0,EUR,Prace na kampani,Platobný príkaz na úhradu / FIT 2.0 (EB),2024030002.0,
575,,2024-03-31,-5.0,EUR,Zverejňovanie účtu,Poplatok,,
576,,2024-03-31,-5.0,EUR,Poplatok za vedenie účtu,Poplatok,,
577,,2024-03-28,-0.25,EUR,Poplatok za platbu kartou,Poplatok za kartovú transakciu,,
578,,2024-03-28,-40.0,EUR,"B1767849982-44544 17** **** 6916;FACEBK 5SGYH2C7S2 ,fb.me/ads ,IE ;27.03.2024 12:33:20 ;CashBack:0 EUR",Platba kartou,,
579,Michal Babčan,2024-03-27,-1000.0,EUR,Grafické práce,Platobný príkaz na úhradu / FIT 2.0 (EB),42024.0,
580,,2024-03-22,-0.25,EUR,Poplatok za platbu kartou,Poplatok za kartovú transakciu,,
581,,2024-03-22,-33.0,EUR,"B1763054511-44544 17** **** 6916;FACEBK XDZEK2U6S2 ,fb.me/ads ,IE ;21.03.2024 20:11:18 ;CashBack:0 EUR",Platba kartou,,
582,Ivana Súkenníková ICO: 53253345,2024-03-20,-450.0,EUR,Styling na fotenie,Platobný príkaz na úhradu / FIT 2.0 (EB),20240012.0,
583,,2024-03-17,-0.25,EUR,Poplatok za platbu kartou,Poplatok za kartovú transakciu,,
584,,2024-03-17,-300.0,EUR,"B1759008508-44544 17** **** 6916;PATRIOT HOTEL ,VRANOV NAD TO ,SK ;15.03.2024 19:20:20 ;CashBack:0 EUR",Platba kartou,,
585,,2024-03-16,-0.25,EUR,Poplatok za platbu kartou,Poplatok za kartovú transakciu,,
586,,2024-03-16,-27.0,EUR,"B1758086789-44544 17** **** 6916;FACEBK 3NSMR287S2 ,fb.me/ads ,IE ;15.03.2024 18:59:40 ;CashBack:0 EUR",Platba kartou,,
587,,2024-03-15,-0.25,EUR,Poplatok za platbu kartou,Poplatok za kartovú transakciu,,
588,,2024-03-15,-22.0,EUR,"B1757128464-44544 17** **** 6916;FACEBK 3LHUB447S2 ,fb.me/ads ,IE ;14.03.2024 22:12:37 ;CashBack:0 EUR",Platba kartou,,
589,Sketch s.r.o. IČO: 54087988,2024-03-15,-23957.4,EUR,reklamné a propagačné predmety,Platobný príkaz na úhradu / FIT 2.0 (EB),4172024.0,
590,,2024-03-14,-0.25,EUR,Poplatok za platbu kartou,Poplatok za kartovú transakciu,,
591,,2024-03-14,-18.0,EUR,"B1756210740-44544 17** **** 6916;FACEBK 5EYQ22C7S2 ,fb.me/ads ,IE ;13.03.2024 19:07:09 ;CashBack:0 EUR",Platba kartou,,
592,"POSTOJ MEDIA, s.r.o. ICO: 50205668",2024-03-13,-3650.0,EUR,Inzercia,Platobný príkaz na úhradu / FIT 2.0 (EB),920240001.0,
593,"MEM Agency, s.r.o. ICO: 51447321",2024-03-13,-2880.0,EUR,Techn.zabezp.podujati PACIVALE ROMA,Platobný príkaz na úhradu / FIT 2.0 (EB),20240001.0,
594,Michal Babčan,2024-03-13,-1000.0,EUR,Grafické práce,Platobný príkaz na úhradu / FIT 2.0 (EB),32024.0,
595,SLOVENSKO,2024-03-13,50000.0,EUR,prevod na TU,Bezhotovostný vklad,4.0,
596,Initiative s.r.o. IČO: 50860917,2024-03-12,-63498.96,EUR,OOH Billboardy,Platobný príkaz na úhradu / FIT 2.0 (EB),2624010.0,
597,,2024-03-11,-0.25,EUR,Poplatok za platbu kartou,Poplatok za kartovú transakciu,,
598,,2024-03-11,-15.0,EUR,"B1754005266-44544 17** **** 6916;FACEBK AA5PL2U7S2 ,fb.me/ads ,IE ;10.03.2024 20:29:31 ;CashBack:0 EUR",Platba kartou,,
599,,2024-03-11,-0.25,EUR,Poplatok za platbu kartou,Poplatok za kartovú transakciu,,
600,,2024-03-11,-12.0,EUR,"B1753932947-44544 17** **** 6916;FACEBK 7GLW62U6S2 ,fb.me/ads ,IE ;10.03.2024 10:00:01 ;CashBack:0 EUR",Platba kartou,,
601,Mgr. Branislav Gigac IČO: 55086217,2024-03-11,-2800.0,EUR,Práce na kampani,Platobný príkaz na úhradu / FIT 2.0 (EB),2024030001.0,
602,,2024-03-10,-0.25,EUR,Poplatok za platbu kartou,Poplatok za kartovú transakciu,,
603,,2024-03-10,-10.0,EUR,"B1753307861-44544 17** **** 6916;FACEBK EZWNK2U7S2 ,fb.me/ads ,IE ;09.03.2024 21:02:55 ;CashBack:0 EUR",Platba kartou,,
604,,2024-03-10,-0.25,EUR,Poplatok za platbu kartou,Poplatok za kartovú transakciu,,
605,,2024-03-10,-8.0,EUR,"B1753202173-44544 17** **** 6916;FACEBK KKUAK2U7S2 ,fb.me/ads ,IE ;09.03.2024 13:36:40 ;CashBack:0 EUR",Platba kartou,,
606,,2024-03-10,-0.25,EUR,Poplatok za platbu kartou,Poplatok za kartovú transakciu,,
607,,2024-03-10,-6.0,EUR,"B1753168295-44544 17** **** 6916;FACEBK ZVFJ5447S2 ,fb.me/ads ,IE ;09.03.2024 06:28:34 ;CashBack:0 EUR",Platba kartou,,
608,,2024-03-10,-0.25,EUR,Poplatok za platbu kartou,Poplatok za kartovú transakciu,,
609,,2024-03-10,-5.0,EUR,"B1752320723-44544 17** **** 6916;FACEBK 345SD2Y6S2 ,fb.me/ads ,IE ;08.03.2024 21:32:20 ;CashBack:0 EUR",Platba kartou,,
610,,2024-03-10,-0.25,EUR,Poplatok za platbu kartou,Poplatok za kartovú transakciu,,
611,,2024-03-10,-3.0,EUR,"B1752303503-44544 17** **** 6916;FACEBK NGMG4447S2 ,fb.me/ads ,IE ;08.03.2024 07:33:42 ;CashBack:0 EUR",Platba kartou,,
612,,2024-03-10,-0.25,EUR,Poplatok za platbu kartou,Poplatok za kartovú transakciu,,
613,,2024-03-10,-3.0,EUR,"B1752288701-44544 17** **** 6916;FACEBK YTC3J2U7S2 ,fb.me/ads ,IE ;08.03.2024 10:24:03 ;CashBack:0 EUR",Platba kartou,,
614,,2024-03-10,-0.25,EUR,Poplatok za platbu kartou,Poplatok za kartovú transakciu,,
615,,2024-03-10,-0.25,EUR,Poplatok za platbu kartou,Poplatok za kartovú transakciu,,
616,,2024-03-10,-4.0,EUR,"B1752223576-44544 17** **** 6916;FACEBK RC57UZP7S2 ,fb.me/ads ,IE ;08.03.2024 18:31:27 ;CashBack:0 EUR",Platba kartou,,
617,,2024-03-10,-4.0,EUR,"B1752222010-44544 17** **** 6916;FACEBK N8MU4447S2 ,fb.me/ads ,IE ;08.03.2024 15:14:27 ;CashBack:0 EUR",Platba kartou,,
618,,2024-03-08,-0.25,EUR,Poplatok za platbu kartou,Poplatok za kartovú transakciu,,
619,,2024-03-08,-2.0,EUR,"B1752097277-44544 17** **** 6916;FACEBK BCZETZP7S2 ,fb.me/ads ,IE ;08.03.2024 03:02:24 ;CashBack:0 EUR",Platba kartou,,
620,,2024-03-08,-0.25,EUR,Poplatok za platbu kartou,Poplatok za kartovú transakciu,,
621,,2024-03-08,-2.0,EUR,"B1751448503-44544 17** **** 6916;FACEBK LK4Z3447S2 ,fb.me/ads ,IE ;07.03.2024 20:30:37 ;CashBack:0 EUR",Platba kartou,,
622,,2024-03-08,-2.0,EUR,"B1751448271-44544 17** **** 6916;FACEBK SK6W52L7S2 ,fb.me/ads ,IE ;07.03.2024 21:30:37 ;CashBack:0 EUR",Platba kartou,,
623,,2024-03-08,-2.0,EUR,"B1751450408-44544 17** **** 6916;FACEBK WV744447S2 ,fb.me/ads ,IE ;07.03.2024 22:42:08 ;CashBack:0 EUR",Platba kartou,,
624,,2024-03-08,-0.25,EUR,Poplatok za platbu kartou,Poplatok za kartovú transakciu,,
625,,2024-03-08,-0.25,EUR,Poplatok za platbu kartou,Poplatok za kartovú transakciu,,
626,,2024-03-08,-0.25,EUR,Poplatok za platbu kartou,Poplatok za kartovú transakciu,,
627,,2024-03-08,-2.0,EUR,"B1751449973-44544 17** **** 6916;FACEBK VCFZTZB7S2 ,fb.me/ads ,IE ;07.03.2024 19:17:35 ;CashBack:0 EUR",Platba kartou,,
628,,2024-03-08,-2.0,EUR,"B1751384304-44544 17** **** 6916;FACEBK YWURTZB7S2 ,fb.me/ads ,IE ;07.03.2024 14:32:21 ;CashBack:0 EUR",Platba kartou,,
629,,2024-03-08,-0.25,EUR,Poplatok za platbu kartou,Poplatok za kartovú transakciu,,
630,,2024-03-08,-2.0,EUR,"B1751385010-44544 17** **** 6916;FACEBK RJ5NG287S2 ,fb.me/ads ,IE ;07.03.2024 16:15:13 ;CashBack:0 EUR",Platba kartou,,
631,,2024-03-08,-0.25,EUR,Poplatok za platbu kartou,Poplatok za kartovú transakciu,,
632,,2024-03-08,-0.25,EUR,Poplatok za platbu kartou,Poplatok za kartovú transakciu,,
633,,2024-03-08,-2.0,EUR,"B1751308521-44544 17** **** 6916;FACEBK 6U7WPZF7S2 ,fb.me/ads ,IE ;07.03.2024 17:49:46 ;CashBack:0 EUR",Platba kartou,,
634,Initiative s.r.o. IČO: 50860917,2024-03-07,-768.1,EUR,OOH Citylighty,Platobný príkaz na úhradu / FIT 2.0 (EB),2624009.0,
635,Initiative s.r.o. IČO: 50860917,2024-03-07,-5743.33,EUR,OOH Billboardy,Platobný príkaz na úhradu / FIT 2.0 (EB),2624008.0,
636,SLOVENSKO,2024-03-06,50000.0,EUR,prevod na TU,Bezhotovostný vklad,3.0,
637,Valovič Tomáš,2024-03-06,-0.1,EUR,Vratenie daru,Platobný príkaz na úhradu / FIT 2.0 (EB),,
638,"Petit Press,a.s. - divízia Bratislava ICO: 3579025",2024-03-06,-7812.0,EUR,Inzercia,Platobný príkaz na úhradu / FIT 2.0 (EB),2422100010.0,
639,FOCUS ICO 17336325,2024-03-06,-11484.0,EUR,Prieskum,Platobný príkaz na úhradu / FIT 2.0 (EB),20242013.0,
640,Jaroslav Balara,2024-03-06,-1.5,EUR,Vratenie daru,Platobný príkaz na úhradu / FIT 2.0 (EB),,
641,Obec Zohor ICO: 00322741,2024-03-06,-194.6,EUR,"Prenajom priestorov, rozhlas",Platobný príkaz na úhradu / FIT 2.0 (EB),9913400002.0,
642,Initiative s. r. o. IČO: 50860917,2024-03-06,-10515.08,EUR,OOH Bigboardy,Platobný príkaz na úhradu / FIT 2.0 (EB),2624007.0,
643,Marek Ostrochovsky,2024-03-06,-0.01,EUR,Vratenie daru,Platobný príkaz na úhradu / FIT 2.0 (EB),,
644,Michalovic David,2024-03-06,-5.0,EUR,Vratenie daru,Platobný príkaz na úhradu / FIT 2.0 (EB),,
645,,2024-02-29,-5.0,EUR,Zverejňovanie účtu,Poplatok,,
646,,2024-02-29,-3.1,EUR,Poplatok za vedenie účtu,Poplatok,,
647,SLOVENSKO,2024-02-27,50000.0,EUR,prevod na TU,Bezhotovostný vklad,2.0,
648,Initiative s. r. o. IČO: 50860917,2024-02-26,-4604.04,EUR,OOH Reklama v MHD,Platobný príkaz na úhradu / FIT 2.0 (EB),2624006.0,
649,Initiative s. r. o. IČO: 50860917,2024-02-26,-3259.87,EUR,OOH prelep billboardov,Platobný príkaz na úhradu / FIT 2.0 (EB),2624005.0,
650,Initiative s. r. o. IČO: 50860917,2024-02-26,-4230.58,EUR,OOH Billboardy,Platobný príkaz na úhradu / FIT 2.0 (EB),2624004.0,
651,Jaroslav Balara,2024-02-26,1.5,EUR,"Suma 1,5 ? je vyska mojho rodicovskeho prispevku.Dakujem, neprosim?",Bezhotovostný vklad,,
652,Valovič Tomáš,2024-02-20,0.1,EUR,Igor na hrad,Bezhotovostný vklad,,
653,Marek Ostrochovsky,2024-02-16,0.01,EUR,"coho ste sa chytili, to ste dojebali???",Bezhotovostný vklad,,
654,Initiative s.r.o. IČO: 42287511,2024-02-15,-9172.34,EUR,OOH citylighty,Platobný príkaz na úhradu / FIT 2.0 (EB),2624003.0,
655,SLOVENSKO,2024-02-14,50000.0,EUR,prevod na TU,Bezhotovostný vklad,1.0,
656,Michalovic David,2024-02-13,5.0,EUR,Vela stastia,Bezhotovostný vklad - okamžitá platba,,
657,,2024-02-12,-50.0,EUR,"Vedenie Platobnej karty embosovanej,2029,5,Karta č. 4544 17** **** 6916Poplatok za expresné vydanie",Kartový poplatok,,