index,account_name,date,amount,currency,message,tx_type,vs,ss
0,,2024-07-11,-0.25,EUR,Poplatok za platbu kartou,Poplatok za kartovú transakciu,,
1,,2024-07-11,-750.0,EUR,"B1853442707-44544 17** **** 0646;FACEBK *PEL4V749S2 ,fb.me/ads ,IE ;10.07.2024 09:42:38 ;CashBack:0 EUR",Platba kartou,,
2,AGENTURA SMER,2024-07-04,-160000.0,EUR,FD-861-organ.-tech.zabezpecenie volieb do EP 2024,Platobný príkaz na úhradu / FIT 2.0 (EB),42024249.0,
3,AGENTURA SMER,2024-07-04,-68163.72,EUR,FD-861-organ.-tech.zabezpecenie volieb do EP 2024,Platobný príkaz na úhradu / FIT 2.0 (EB),42024249.0,
4,SMER - sociálna demokracia,2024-07-04,60000.0,EUR,Dotacia z bezneho uctu z titulu uhrady faktury za volby do EP 2024,Bezhotovostný vklad,31801242.0,4072024.0
5,Financna sprava Bratislava,2024-07-04,-2519.7,EUR,DPH-6/2024,Platobný príkaz na úhradu / FIT 2.0 (EB),1100062024.0,202406.0
6,,2024-07-02,-0.25,EUR,Poplatok za platbu kartou,Poplatok za kartovú transakciu,,
7,,2024-07-02,-304.54,EUR,"B1846052917-44544 17** **** 9281;GOOGLE *ADS6073399833 ,cc@google.com ,IE ;01.07.2024 16:41:43 ;CashBack:0 EUR",Platba kartou,,
8,,2024-06-30,-5.0,EUR,Zverejňovanie účtu,Poplatok,,
9,,2024-06-30,-5.0,EUR,Poplatok za vedenie účtu,Poplatok,,
10,,2024-06-30,-3.5,EUR,"Vedenie Platobnej karty embosovanej,2315,5,Karta č. 4544 17** **** 0646Poplatok za Platobnú kartu",Kartový poplatok,,
11,Coop Jednota Krupina,2024-06-19,-200.07,EUR,FD-798-akcia v Detve-potraviny,Platobný príkaz na úhradu / FIT 2.0 (EB),2024560361.0,
12,,2024-06-10,-0.25,EUR,Poplatok za platbu kartou,Poplatok za kartovú transakciu,,
13,,2024-06-10,-375.85,EUR,"B1827067063-44544 17** **** 0646;FACEBK *TDY935G8S2 ,fb.me/ads ,IE ;09.06.2024 16:00:45 ;CashBack:0 EUR",Platba kartou,,
14,JM Communication,2024-06-07,-37989.0,EUR,FD-740-medialny priestor,Platobný príkaz na úhradu / FIT 2.0 (EB),2024015.0,
15,,2024-06-06,-0.25,EUR,Poplatok za platbu kartou,Poplatok za kartovú transakciu,,
16,,2024-06-06,-500.0,EUR,"B1823554185-44544 17** **** 9281;GOOGLE *ADS6073399833 ,cc@google.com ,IE ;05.06.2024 14:02:38 ;CashBack:0 EUR",Platba kartou,,
17,,2024-06-06,-0.25,EUR,Poplatok za platbu kartou,Poplatok za kartovú transakciu,,
18,,2024-06-06,-750.0,EUR,"B1823541064-44544 17** **** 0646;FACEBK *CSW9U448S2 ,fb.me/ads ,IE ;05.06.2024 14:23:29 ;CashBack:0 EUR",Platba kartou,,
19,,2024-06-06,-0.25,EUR,Poplatok za platbu kartou,Poplatok za kartovú transakciu,,
20,,2024-06-06,-500.0,EUR,"B1823480165-44544 17** **** 9281;GOOGLE *ADS6073399833 ,cc@google.com ,IE ;05.06.2024 21:03:44 ;CashBack:0 EUR",Platba kartou,,
21,Financna sprava Bratislava,2024-06-06,-5003.19,EUR,DPH-5/2024,Platobný príkaz na úhradu / FIT 2.0 (EB),1100052024.0,202405.0
22,,2024-06-06,-0.25,EUR,Poplatok za platbu kartou,Poplatok za kartovú transakciu,,
23,,2024-06-06,-500.0,EUR,"B1823263361-44544 17** **** 9281;GOOGLE *ADS6073399833 ,cc@google.com ,IE ;05.06.2024 01:35:45 ;CashBack:0 EUR",Platba kartou,,
24,,2024-06-06,-0.25,EUR,Poplatok za platbu kartou,Poplatok za kartovú transakciu,,
25,,2024-06-06,-750.0,EUR,"B1822931774-44544 17** **** 0646;FACEBK *XV489649S2 ,fb.me/ads ,IE ;04.06.2024 23:17:18 ;CashBack:0 EUR",Platba kartou,,
26,,2024-06-06,-0.25,EUR,Poplatok za platbu kartou,Poplatok za kartovú transakciu,,
27,,2024-06-06,-750.0,EUR,"B1822746460-44544 17** **** 0646;FACEBK *DBLWZ5Q8S2 ,fb.me/ads ,IE ;04.06.2024 11:45:10 ;CashBack:0 EUR",Platba kartou,,
28,,2024-06-06,-0.25,EUR,Poplatok za platbu kartou,Poplatok za kartovú transakciu,,
29,,2024-06-06,-500.0,EUR,"B1822697858-44544 17** **** 9281;GOOGLE *ADS6073399833 ,cc@google.com ,IE ;04.06.2024 16:26:34 ;CashBack:0 EUR",Platba kartou,,
30,,2024-06-04,-0.25,EUR,Poplatok za platbu kartou,Poplatok za kartovú transakciu,,
31,,2024-06-04,-500.0,EUR,"B1822278946-44544 17** **** 9281;GOOGLE *ADS6073399833 ,cc@google.com ,IE ;04.06.2024 00:57:54 ;CashBack:0 EUR",Platba kartou,,
32,,2024-06-04,-0.25,EUR,Poplatok za platbu kartou,Poplatok za kartovú transakciu,,
33,,2024-06-04,-500.0,EUR,"B1821932601-44544 17** **** 9281;GOOGLE *ADS6073399833 ,cc@google.com ,IE ;03.06.2024 09:23:23 ;CashBack:0 EUR",Platba kartou,,
34,,2024-06-04,-750.0,EUR,"B1821920148-44544 17** **** 0646;FACEBK *32H537U8S2 ,fb.me/ads ,IE ;03.06.2024 13:08:40 ;CashBack:0 EUR",Platba kartou,,
35,,2024-06-04,-0.25,EUR,Poplatok za platbu kartou,Poplatok za kartovú transakciu,,
36,,2024-06-04,-500.0,EUR,"B1821919881-44544 17** **** 9281;GOOGLE *ADS6073399833 ,cc@google.com ,IE ;03.06.2024 18:07:17 ;CashBack:0 EUR",Platba kartou,,
37,,2024-06-04,-0.25,EUR,Poplatok za platbu kartou,Poplatok za kartovú transakciu,,
38,,2024-06-03,-0.25,EUR,Poplatok za platbu kartou,Poplatok za kartovú transakciu,,
39,,2024-06-03,-750.0,EUR,"B1821438514-44544 17** **** 0646;FACEBK *MTXSR4G8S2 ,fb.me/ads ,IE ;02.06.2024 21:17:54 ;CashBack:0 EUR",Platba kartou,,
40,,2024-06-03,-0.25,EUR,Poplatok za platbu kartou,Poplatok za kartovú transakciu,,
41,,2024-06-03,-500.0,EUR,"B1821438421-44544 17** **** 9281;GOOGLE *ADS6073399833 ,cc@google.com ,IE ;02.06.2024 20:43:53 ;CashBack:0 EUR",Platba kartou,,
42,,2024-06-03,-0.25,EUR,Poplatok za platbu kartou,Poplatok za kartovú transakciu,,
43,,2024-06-03,-750.0,EUR,"B1821425261-44544 17** **** 0646;FACEBK *8FQPP4L8S2 ,fb.me/ads ,IE ;02.06.2024 09:35:36 ;CashBack:0 EUR",Platba kartou,,
44,,2024-06-03,-0.25,EUR,Poplatok za platbu kartou,Poplatok za kartovú transakciu,,
45,,2024-06-03,-500.0,EUR,"B1821397194-44544 17** **** 9281;GOOGLE *ADS6073399833 ,cc@google.com ,IE ;02.06.2024 14:42:57 ;CashBack:0 EUR",Platba kartou,,
46,,2024-06-02,-0.25,EUR,Poplatok za platbu kartou,Poplatok za kartovú transakciu,,
47,,2024-06-02,-500.0,EUR,"B1820829231-44544 17** **** 9281;GOOGLE *ADS6073399833 ,cc@google.com ,IE ;02.06.2024 00:53:57 ;CashBack:0 EUR",Platba kartou,,
48,,2024-06-02,-0.25,EUR,Poplatok za platbu kartou,Poplatok za kartovú transakciu,,
49,,2024-06-02,-750.0,EUR,"B1820714770-44544 17** **** 0646;FACEBK *PDG3Z6U8S2 ,fb.me/ads ,IE ;01.06.2024 20:00:42 ;CashBack:0 EUR",Platba kartou,,
50,,2024-06-02,-750.0,EUR,"B1820705668-44544 17** **** 0646;FACEBK *RB6XV5Q8S2 ,fb.me/ads ,IE ;01.06.2024 09:12:17 ;CashBack:0 EUR",Platba kartou,,
51,,2024-06-02,-0.25,EUR,Poplatok za platbu kartou,Poplatok za kartovú transakciu,,
52,,2024-06-02,-500.0,EUR,"B1820705214-44544 17** **** 9281;GOOGLE *ADS6073399833 ,cc@google.com ,IE ;01.06.2024 15:26:50 ;CashBack:0 EUR",Platba kartou,,
53,,2024-06-02,-0.25,EUR,Poplatok za platbu kartou,Poplatok za kartovú transakciu,,
54,,2024-06-02,-0.25,EUR,Poplatok za platbu kartou,Poplatok za kartovú transakciu,,
55,,2024-06-02,-500.0,EUR,"B1820618381-44544 17** **** 9281;GOOGLE *ADS6073399833 ,cc@google.com ,IE ;01.06.2024 18:27:43 ;CashBack:0 EUR",Platba kartou,,
56,,2024-06-02,-0.25,EUR,Poplatok za platbu kartou,Poplatok za kartovú transakciu,,
57,,2024-06-02,-500.0,EUR,"B1819859254-44544 17** **** 9281;GOOGLE *ADS6073399833 ,cc@google.com ,IE ;31.05.2024 23:38:37 ;CashBack:0 EUR",Platba kartou,,
58,,2024-06-02,-0.25,EUR,Poplatok za platbu kartou,Poplatok za kartovú transakciu,,
59,,2024-06-02,-170.29,EUR,"B1819757012-44544 17** **** 0646;FACEBK *55NGM448S2 ,fb.me/ads ,IE ;31.05.2024 16:02:34 ;CashBack:0 EUR",Platba kartou,,
60,,2024-06-02,-0.25,EUR,Poplatok za platbu kartou,Poplatok za kartovú transakciu,,
61,,2024-06-02,-750.0,EUR,"B1819756409-44544 17** **** 0646;FACEBK *B5HJN4G8S2 ,fb.me/ads ,IE ;31.05.2024 07:16:49 ;CashBack:0 EUR",Platba kartou,,
62,,2024-06-02,-0.25,EUR,Poplatok za platbu kartou,Poplatok za kartovú transakciu,,
63,,2024-06-02,-750.0,EUR,"B1819702544-44544 17** **** 0646;FACEBK *UT4QM448S2 ,fb.me/ads ,IE ;31.05.2024 20:08:36 ;CashBack:0 EUR",Platba kartou,,
64,,2024-06-01,-0.25,EUR,Poplatok za platbu kartou,Poplatok za kartovú transakciu,,
65,,2024-06-01,-750.0,EUR,"B1818969257-44544 17** **** 0646;FACEBK *QECRK4L8S2 ,fb.me/ads ,IE ;30.05.2024 07:35:27 ;CashBack:0 EUR",Platba kartou,,
66,,2024-06-01,-0.25,EUR,Poplatok za platbu kartou,Poplatok za kartovú transakciu,,
67,,2024-06-01,-750.0,EUR,"B1818912173-44544 17** **** 0646;FACEBK *HKNBW6U8S2 ,fb.me/ads ,IE ;30.05.2024 19:02:26 ;CashBack:0 EUR",Platba kartou,,
68,,2024-05-31,-5.0,EUR,Poplatok za vedenie účtu,Poplatok,,
69,,2024-05-31,-5.0,EUR,Zverejňovanie účtu,Poplatok,,
70,,2024-05-31,-3.5,EUR,"Vedenie Platobnej karty embosovanej,2315,5,Karta č. 4544 17** **** 0646Poplatok za Platobnú kartu",Kartový poplatok,,
71,,2024-05-31,-0.25,EUR,Poplatok za platbu kartou,Poplatok za kartovú transakciu,,
72,,2024-05-31,-750.0,EUR,"B1818091408-44544 17** **** 0646;FACEBK *Q5ZDJ448S2 ,fb.me/ads ,IE ;29.05.2024 10:30:18 ;CashBack:0 EUR",Platba kartou,,
73,,2024-05-31,-0.25,EUR,Poplatok za platbu kartou,Poplatok za kartovú transakciu,,
74,,2024-05-31,-750.0,EUR,"B1818042089-44544 17** **** 0646;FACEBK *VMV4K4L8S2 ,fb.me/ads ,IE ;29.05.2024 20:28:28 ;CashBack:0 EUR",Platba kartou,,
75,,2024-05-30,-0.25,EUR,Poplatok za platbu kartou,Poplatok za kartovú transakciu,,
76,,2024-05-30,-750.0,EUR,"B1817181862-44544 17** **** 0646;FACEBK *SQXDK4G8S2 ,fb.me/ads ,IE ;28.05.2024 20:22:22 ;CashBack:0 EUR",Platba kartou,,
77,,2024-05-30,-0.25,EUR,Poplatok za platbu kartou,Poplatok za kartovú transakciu,,
78,,2024-05-30,-500.0,EUR,"B1817180372-44544 17** **** 9281;GOOGLE *ADS6073399833 ,cc@google.com ,IE ;28.05.2024 21:37:14 ;CashBack:0 EUR",Platba kartou,,
79,,2024-05-30,-0.25,EUR,Poplatok za platbu kartou,Poplatok za kartovú transakciu,,
80,,2024-05-30,-750.0,EUR,"B1817103947-44544 17** **** 0646;FACEBK *V8DPJ4G8S2 ,fb.me/ads ,IE ;28.05.2024 07:35:20 ;CashBack:0 EUR",Platba kartou,,
81,,2024-05-29,-0.25,EUR,Poplatok za platbu kartou,Poplatok za kartovú transakciu,,
82,,2024-05-29,-750.0,EUR,"B1816296175-44544 17** **** 0646;FACEBK *L8C4K4Y8S2 ,fb.me/ads ,IE ;27.05.2024 16:44:21 ;CashBack:0 EUR",Platba kartou,,
83,,2024-05-27,-750.0,EUR,"B1815816223-44544 17** **** 0646;FACEBK *RY78F448S2 ,fb.me/ads ,IE ;26.05.2024 20:25:10 ;CashBack:0 EUR",Platba kartou,,
84,,2024-05-27,-0.25,EUR,Poplatok za platbu kartou,Poplatok za kartovú transakciu,,
85,,2024-05-27,-0.25,EUR,Poplatok za platbu kartou,Poplatok za kartovú transakciu,,
86,,2024-05-27,-750.0,EUR,"B1815735425-44544 17** **** 0646;FACEBK *M5473588S2 ,fb.me/ads ,IE ;26.05.2024 06:37:46 ;CashBack:0 EUR",Platba kartou,,
87,,2024-05-26,-0.25,EUR,Poplatok za platbu kartou,Poplatok za kartovú transakciu,,
88,,2024-05-26,-750.0,EUR,"B1815026345-44544 17** **** 0646;FACEBK *YGXND448S2 ,fb.me/ads ,IE ;25.05.2024 16:17:24 ;CashBack:0 EUR",Platba kartou,,
89,,2024-05-25,-0.25,EUR,Poplatok za platbu kartou,Poplatok za kartovú transakciu,,
90,,2024-05-25,-750.0,EUR,"B1814301698-44544 17** **** 0646;FACEBK *JH2YC4L8S2 ,fb.me/ads ,IE ;24.05.2024 23:43:29 ;CashBack:0 EUR",Platba kartou,,
91,,2024-05-25,-750.0,EUR,"B1814017603-44544 17** **** 0646;FACEBK *3YSNE4Y8S2 ,fb.me/ads ,IE ;24.05.2024 07:02:13 ;CashBack:0 EUR",Platba kartou,,
92,,2024-05-25,-0.25,EUR,Poplatok za platbu kartou,Poplatok za kartovú transakciu,,
93,,2024-05-24,-0.25,EUR,Poplatok za platbu kartou,Poplatok za kartovú transakciu,,
94,,2024-05-24,-750.0,EUR,"B1813276652-44544 17** **** 0646;FACEBK* ,fb.me/ads ,IE ;23.05.2024 12:12:09 ;CashBack:0 EUR",Platba kartou,,
95,,2024-05-24,-0.25,EUR,Poplatok za platbu kartou,Poplatok za kartovú transakciu,,
96,,2024-05-24,-500.0,EUR,"B1813249257-44544 17** **** 9281;GOOGLE *ADS6073399833 ,cc@google.com ,IE ;23.05.2024 09:00:49 ;CashBack:0 EUR",Platba kartou,,
97,AGENTURA SMER,2024-05-24,-48312.0,EUR,Zaloh.fa c.27-reklamne predmety,Platobný príkaz na úhradu / FIT 2.0 (EB),240800006.0,
98,,2024-05-23,-750.0,EUR,"B1812302520-44544 17** **** 0646;FACEBK* ,fb.me/ads ,IE ;22.05.2024 18:10:09 ;CashBack:0 EUR",Platba kartou,,
99,,2024-05-23,-0.25,EUR,Poplatok za platbu kartou,Poplatok za kartovú transakciu,,
100,,2024-05-23,-0.25,EUR,Poplatok za platbu kartou,Poplatok za kartovú transakciu,,
101,,2024-05-23,-750.0,EUR,"B1811579496-44544 17** **** 0646;FACEBK* ,fb.me/ads ,IE ;21.05.2024 21:15:19 ;CashBack:0 EUR",Platba kartou,,
102,,2024-05-22,-0.25,EUR,Poplatok za platbu kartou,Poplatok za kartovú transakciu,,
103,,2024-05-22,-750.0,EUR,"B1810699467-44544 17** **** 0646;FACEBK* ,fb.me/ads ,IE ;20.05.2024 19:56:38 ;CashBack:0 EUR",Platba kartou,,
104,,2024-05-19,-0.25,EUR,Poplatok za platbu kartou,Poplatok za kartovú transakciu,,
105,,2024-05-19,-750.0,EUR,"B1809862642-44544 17** **** 0646;FACEBK* ,fb.me/ads ,IE ;19.05.2024 00:52:51 ;CashBack:0 EUR",Platba kartou,,
106,,2024-05-19,-0.25,EUR,Poplatok za platbu kartou,Poplatok za kartovú transakciu,,
107,,2024-05-19,-750.0,EUR,"B1808264718-44544 17** **** 0646;FACEBK* ,fb.me/ads ,IE ;17.05.2024 17:05:34 ;CashBack:0 EUR",Platba kartou,,
108,,2024-05-17,-0.25,EUR,Poplatok za platbu kartou,Poplatok za kartovú transakciu,,
109,,2024-05-17,-750.0,EUR,"B1806383122-44544 17** **** 0646;FACEBK* ,fb.me/ads ,IE ;15.05.2024 19:21:10 ;CashBack:0 EUR",Platba kartou,,
110,,2024-05-16,-0.25,EUR,Poplatok za platbu kartou,Poplatok za kartovú transakciu,,
111,,2024-05-16,-750.0,EUR,"B1805418278-44544 17** **** 0646;FACEBK* ,fb.me/ads ,IE ;14.05.2024 20:06:55 ;CashBack:0 EUR",Platba kartou,,
112,,2024-05-13,-750.0,EUR,"B1804257736-44544 17** **** 0646;FACEBK* ,fb.me/ads ,IE ;13.05.2024 01:34:13 ;CashBack:0 EUR",Platba kartou,,
113,,2024-05-13,-0.25,EUR,Poplatok za platbu kartou,Poplatok za kartovú transakciu,,
114,Financna sprava Bratislava,2024-05-13,-2703.57,EUR,DPH-4/2024,Platobný príkaz na úhradu / FIT 2.0 (EB),1100042024.0,202404.0
115,AGENTURA SMER,2024-05-13,-160000.0,EUR,Zaloha na organ.-tech.zabezpecenie volieb do EU,Platobný príkaz na úhradu / FIT 2.0 (EB),240800005.0,
116,AGENTURA SMER,2024-05-13,-160000.0,EUR,Zaloha na organ.-tech.zabezpecenie volieb do EU.,Platobný príkaz na úhradu / FIT 2.0 (EB),240800005.0,
117,AGENTURA SMER,2024-05-13,-80000.0,EUR,Zaloha na organ.-tech.zabezpecenie volieb do EU,Platobný príkaz na úhradu / FIT 2.0 (EB),240800005.0,
118,,2024-05-12,-0.25,EUR,Poplatok za platbu kartou,Poplatok za kartovú transakciu,,
119,,2024-05-12,-750.0,EUR,"B1802047013-44544 17** **** 0646;FACEBK* ,fb.me/ads ,IE ;10.05.2024 23:36:35 ;CashBack:0 EUR",Platba kartou,,
120,,2024-05-10,-0.25,EUR,Poplatok za platbu kartou,Poplatok za kartovú transakciu,,
121,,2024-05-10,-750.0,EUR,"B1800908786-44544 17** **** 0646;FACEBK* ,fb.me/ads ,IE ;09.05.2024 06:56:04 ;CashBack:0 EUR",Platba kartou,,
122,,2024-05-09,-0.25,EUR,Poplatok za platbu kartou,Poplatok za kartovú transakciu,,
123,,2024-05-09,-750.0,EUR,"B1800474672-44544 17** **** 0646;FACEBK* ,fb.me/ads ,IE ;07.05.2024 20:35:21 ;CashBack:0 EUR",Platba kartou,,
124,,2024-05-06,-0.25,EUR,Poplatok za platbu kartou,Poplatok za kartovú transakciu,,
125,,2024-05-06,-750.0,EUR,"B1798572147-44544 17** **** 0646;FACEBK* ,fb.me/ads ,IE ;06.05.2024 02:51:30 ;CashBack:0 EUR",Platba kartou,,
126,,2024-05-06,-0.25,EUR,Poplatok za platbu kartou,Poplatok za kartovú transakciu,,
127,,2024-05-06,-750.0,EUR,"B1798158181-44544 17** **** 0646;FACEBK* ,fb.me/ads ,IE ;05.05.2024 06:29:40 ;CashBack:0 EUR",Platba kartou,,
128,,2024-05-05,-0.25,EUR,Poplatok za platbu kartou,Poplatok za kartovú transakciu,,
129,,2024-05-05,-750.0,EUR,"B1797445722-44544 17** **** 0646;FACEBK* ,fb.me/ads ,IE ;04.05.2024 12:44:33 ;CashBack:0 EUR",Platba kartou,,
130,,2024-05-04,-0.25,EUR,Poplatok za platbu kartou,Poplatok za kartovú transakciu,,
131,,2024-05-04,-750.0,EUR,"B1795620955-44544 17** **** 0646;FACEBK* ,fb.me/ads ,IE ;02.05.2024 23:38:29 ;CashBack:0 EUR",Platba kartou,,
132,SMER - sociálna demokracia,2024-05-03,160000.0,EUR,Prevod financnych protriedkov z BU na volby do EU,Bezhotovostný vklad,20240305.0,
133,SMER - sociálna demokracia,2024-05-03,160000.0,EUR,Prevod financnych prostriedkov z BU na volby do EU,Bezhotovostný vklad,20240305.0,
134,SMER - sociálna demokracia,2024-05-03,160000.0,EUR,Prevod financnych prostriedkov z BU na volby do EU,Bezhotovostný vklad,20240305.0,
135,SMER - sociálna demokracia,2024-05-03,20000.0,EUR,Prevod financnych prostriedkov z BU na volby do EU,Bezhotovostný vklad,20240305.0,
136,,2024-05-02,-750.0,EUR,"B1795265821-44544 17** **** 0646;FACEBK* ,fb.me/ads ,IE ;01.05.2024 21:46:24 ;CashBack:0 EUR",Platba kartou,,
137,,2024-05-02,-0.25,EUR,Poplatok za platbu kartou,Poplatok za kartovú transakciu,,
138,AGENTURA SMER,2024-05-02,-40000.0,EUR,Zalohova fa c.23-organ.-tech.zastupenie vo volbach do EU,Platobný príkaz na úhradu / FIT 2.0 (EB),240800004.0,
139,AGENTURA SMER,2024-05-02,-160000.0,EUR,Zalohova fa c.23-organ.-tech.zastupenie vo volbach do EU,Platobný príkaz na úhradu / FIT 2.0 (EB),240800004.0,
140,,2024-05-02,-0.25,EUR,Poplatok za platbu kartou,Poplatok za kartovú transakciu,,
141,,2024-05-02,-750.0,EUR,"B1794255027-44544 17** **** 0646;FACEBK* ,fb.me/ads ,IE ;30.04.2024 23:13:09 ;CashBack:0 EUR",Platba kartou,,
142,,2024-05-02,-0.25,EUR,Poplatok za platbu kartou,Poplatok za kartovú transakciu,,
143,,2024-05-02,-17.91,EUR,"B1794108463-44544 17** **** 0646;FACEBK* ,fb.me/ads ,IE ;30.04.2024 10:02:40 ;CashBack:0 EUR",Platba kartou,,
144,,2024-04-30,-5.0,EUR,Zverejňovanie účtu,Poplatok,,
145,,2024-04-30,-5.0,EUR,Poplatok za vedenie účtu,Poplatok,,
146,,2024-04-30,-0.25,EUR,Poplatok za platbu kartou,Poplatok za kartovú transakciu,,
147,,2024-04-30,-750.0,EUR,"B1793364337-44544 17** **** 0646;FACEBK* ,fb.me/ads ,IE ;29.04.2024 08:20:52 ;CashBack:0 EUR",Platba kartou,,
148,,2024-04-30,-3.5,EUR,"Vedenie Platobnej karty embosovanej,2315,5,Karta č. 4544 17** **** 0646Poplatok za Platobnú kartu",Kartový poplatok,,
149,Actly s.r.o.,2024-04-30,-25272.0,EUR,FD-530-prieskum verejnej mienky,Platobný príkaz na úhradu / FIT 2.0 (EB),2423005.0,
150,"POKROK VK,s.r.o.",2024-04-30,-295.0,EUR,FD-463-propagacne materialy,Platobný príkaz na úhradu / FIT 2.0 (EB),102024.0,
151,,2024-04-28,-750.0,EUR,"B1792124469-44544 17** **** 0646;FACEBK* ,fb.me/ads ,IE ;27.04.2024 18:39:52 ;CashBack:0 EUR",Platba kartou,,
152,,2024-04-28,-0.25,EUR,Poplatok za platbu kartou,Poplatok za kartovú transakciu,,
153,,2024-04-28,-0.25,EUR,Poplatok za platbu kartou,Poplatok za kartovú transakciu,,
154,,2024-04-28,-750.0,EUR,"B1791228417-44544 17** **** 0646;FACEBK* ,fb.me/ads ,IE ;26.04.2024 17:16:36 ;CashBack:0 EUR",Platba kartou,,
155,,2024-04-26,-0.25,EUR,Poplatok za platbu kartou,Poplatok za kartovú transakciu,,
156,,2024-04-26,-749.97,EUR,"B1790250241-44544 17** **** 0646;FACEBK* ,fb.me/ads ,IE ;25.04.2024 14:05:10 ;CashBack:0 EUR",Platba kartou,,
157,,2024-04-25,-0.25,EUR,Poplatok za platbu kartou,Poplatok za kartovú transakciu,,
158,,2024-04-25,-750.0,EUR,"B1789254119-44544 17** **** 0646;FACEBK RT6SA4Q8S2 ,fb.me/ads ,IE ;24.04.2024 04:41:43 ;CashBack:0 EUR",Platba kartou,,
159,JM Communication,2024-04-24,-37989.0,EUR,"Zal F - 020 Ramcova zmluva, marketingove poradentvo",Platobný príkaz na úhradu / FIT 2.0 (EB),,
160,,2024-04-23,-0.25,EUR,Poplatok za platbu kartou,Poplatok za kartovú transakciu,,
161,,2024-04-23,-750.0,EUR,"B1787822554-44544 17** **** 0646;FACEBK MYWFP3C8S2 ,fb.me/ads ,IE ;22.04.2024 07:45:15 ;CashBack:0 EUR",Platba kartou,,
162,,2024-04-21,-0.25,EUR,Poplatok za platbu kartou,Poplatok za kartovú transakciu,,
163,,2024-04-21,-750.0,EUR,"B1786443357-44544 17** **** 0646;FACEBK NAZ385U8S2 ,fb.me/ads ,IE ;20.04.2024 11:18:47 ;CashBack:0 EUR",Platba kartou,,
164,,2024-04-21,-0.25,EUR,Poplatok za platbu kartou,Poplatok za kartovú transakciu,,
165,,2024-04-21,-750.0,EUR,"B1785632747-44544 17** **** 0646;FACEBK 7WCVU2L8S2 ,fb.me/ads ,IE ;19.04.2024 07:29:14 ;CashBack:0 EUR",Platba kartou,,
166,,2024-04-21,-0.25,EUR,Poplatok za platbu kartou,Poplatok za kartovú transakciu,,
167,,2024-04-21,-750.0,EUR,"B1785421375-44544 17** **** 0646;FACEBK JRS454Q8S2 ,fb.me/ads ,IE ;19.04.2024 13:40:09 ;CashBack:0 EUR",Platba kartou,,
168,,2024-04-19,-0.25,EUR,Poplatok za platbu kartou,Poplatok za kartovú transakciu,,
169,,2024-04-19,-750.0,EUR,"B1784576803-44544 17** **** 0646;FACEBK P84VW2Y8S2 ,fb.me/ads ,IE ;18.04.2024 11:26:42 ;CashBack:0 EUR",Platba kartou,,
170,,2024-04-18,-0.25,EUR,Poplatok za platbu kartou,Poplatok za kartovú transakciu,,
171,,2024-04-18,-750.0,EUR,"B1782666192-44544 17** **** 0646;FACEBK 5NW2T2G8S2 ,fb.me/ads ,IE ;16.04.2024 10:40:04 ;CashBack:0 EUR",Platba kartou,,
172,AGENTURA SMER,2024-04-15,-33748.42,EUR,FD-486-vyuctovanie reklam.zastupenie a org.-tech.zabezpecenie MDZ,Platobný príkaz na úhradu / FIT 2.0 (EB),42024139.0,
173,,2024-04-14,-0.25,EUR,Poplatok za platbu kartou,Poplatok za kartovú transakciu,,
174,,2024-04-14,-750.0,EUR,"B1780477047-44544 17** **** 0646;FACEBK SHKVX4U8S2 ,fb.me/ads ,IE ;13.04.2024 22:12:55 ;CashBack:0 EUR",Platba kartou,,
175,,2024-04-13,-0.25,EUR,Poplatok za platbu kartou,Poplatok za kartovú transakciu,,
176,,2024-04-13,-750.0,EUR,"B1779263706-44544 17** **** 0646;FACEBK ZUGL2449S2 ,fb.me/ads ,IE ;12.04.2024 16:04:17 ;CashBack:0 EUR",Platba kartou,,
177,,2024-04-13,-0.25,EUR,Poplatok za platbu kartou,Poplatok za kartovú transakciu,,
178,,2024-04-13,-750.0,EUR,"B1778470158-44544 17** **** 0646;FACEBK D8RGK2L8S2 ,fb.me/ads ,IE ;11.04.2024 17:09:34 ;CashBack:0 EUR",Platba kartou,,
179,AGENTURA SMER,2024-04-12,-48090.0,EUR,"Zalohova fa c.18-zaloha na volby do EU, merkantil",Platobný príkaz na úhradu / FIT 2.0 (EB),240800003.0,
180,,2024-04-11,-0.25,EUR,Poplatok za platbu kartou,Poplatok za kartovú transakciu,,
181,,2024-04-11,-750.0,EUR,"B1776719294-44544 17** **** 0646;FACEBK Y2L3G248S2 ,fb.me/ads ,IE ;09.04.2024 23:11:27 ;CashBack:0 EUR",Platba kartou,,
182,Financna sprava Bratislava,2024-04-10,-3048.64,EUR,DPH-3/2024,Platobný príkaz na úhradu / FIT 2.0 (EB),1100032024.0,202403.0
183,,2024-04-09,-0.25,EUR,Poplatok za platbu kartou,Poplatok za kartovú transakciu,,
184,,2024-04-09,-750.0,EUR,"B1775797895-44544 17** **** 0646;FACEBK 5VABH2G8S2 ,fb.me/ads ,IE ;08.04.2024 12:46:11 ;CashBack:0 EUR",Platba kartou,,
185,,2024-04-07,-0.25,EUR,Poplatok za platbu kartou,Poplatok za kartovú transakciu,,
186,,2024-04-07,-750.0,EUR,"B1774643485-44544 17** **** 0646;FACEBK 69F3P4U8S2 ,fb.me/ads ,IE ;06.04.2024 19:47:23 ;CashBack:0 EUR",Platba kartou,,
187,,2024-04-06,-0.25,EUR,Poplatok za platbu kartou,Poplatok za kartovú transakciu,,
188,,2024-04-06,-750.0,EUR,"B1773672535-44544 17** **** 0646;FACEBK SRXJB2L8S2 ,fb.me/ads ,IE ;05.04.2024 07:10:02 ;CashBack:0 EUR",Platba kartou,,
189,HRUSTINEC STEFAN,2024-04-02,-2300.0,EUR,FD-392-zabezpecenie kulturneho programu,Platobný príkaz na úhradu / FIT 2.0 (EB),20240008.0,
190,,2024-04-01,-243.22,EUR,"B1770874562-44544 17** **** 0646;FACEBK CXYF72G8S2 ,fb.me/ads ,IE ;31.03.2024 11:37:42 ;CashBack:0 EUR",Platba kartou,,
191,,2024-04-01,-0.25,EUR,Poplatok za platbu kartou,Poplatok za kartovú transakciu,,
192,,2024-03-31,-5.0,EUR,Zverejňovanie účtu,Poplatok,,
193,,2024-03-31,-5.0,EUR,Poplatok za vedenie účtu,Poplatok,,
194,,2024-03-31,-3.5,EUR,"Vedenie Platobnej karty embosovanej,2315,5,Karta č. 4544 17** **** 0646Poplatok za Platobnú kartu",Kartový poplatok,,
195,,2024-03-30,-0.25,EUR,Poplatok za platbu kartou,Poplatok za kartovú transakciu,,
196,,2024-03-30,-750.0,EUR,"B1769738237-44544 17** **** 0646;FACEBK VMJE62Y8S2 ,fb.me/ads ,IE ;29.03.2024 12:38:38 ;CashBack:0 EUR",Platba kartou,,
197,,2024-03-30,-0.25,EUR,Poplatok za platbu kartou,Poplatok za kartovú transakciu,,
198,,2024-03-30,-750.0,EUR,"B1768805339-44544 17** **** 0646;FACEBK EP7652Y8S2 ,fb.me/ads ,IE ;28.03.2024 11:00:22 ;CashBack:0 EUR",Platba kartou,,
199,Acjakova Anna,2024-03-27,-386.0,EUR,FD-393-MDZ-catering,Platobný príkaz na úhradu / FIT 2.0 (EB),52024.0,
200,,2024-03-25,-0.25,EUR,Poplatok za platbu kartou,Poplatok za kartovú transakciu,,
201,,2024-03-25,-750.0,EUR,"B1765572892-44544 17** **** 0646;FACEBK *7FJC74U8S2 ,fb.me/ads ,IE ;24.03.2024 19:36:00 ;CashBack:0 EUR",Platba kartou,,
202,,2024-03-21,-0.25,EUR,Poplatok za platbu kartou,Poplatok za kartovú transakciu,,
203,,2024-03-21,-750.0,EUR,"B1762184418-44544 17** **** 0646;FACEBK VNHDQZ38S2 ,fb.me/ads ,IE ;20.03.2024 23:36:33 ;CashBack:0 EUR",Platba kartou,,
204,,2024-03-21,-0.25,EUR,Poplatok za platbu kartou,Poplatok za kartovú transakciu,,
205,,2024-03-21,-750.0,EUR,"B1761214024-44544 17** **** 0646;FACEBK 3QRYB288S2 ,fb.me/ads ,IE ;19.03.2024 06:56:29 ;CashBack:0 EUR",Platba kartou,,
206,AGENTURA SMER,2024-03-19,-90000.0,EUR,Zalohova fa c.14-propagacia a organiz.-tech.zabezpecenie MDZ 2024,Platobný príkaz na úhradu / FIT 2.0 (EB),,
207,,2024-03-18,-0.25,EUR,Poplatok za platbu kartou,Poplatok za kartovú transakciu,,
208,,2024-03-18,-750.0,EUR,"B1759825507-44544 17** **** 0646;FACEBK THP7NZK8S2 ,fb.me/ads ,IE ;17.03.2024 14:36:33 ;CashBack:0 EUR",Platba kartou,,
209,,2024-03-17,-0.25,EUR,Poplatok za platbu kartou,Poplatok za kartovú transakciu,,
210,,2024-03-17,-750.0,EUR,"B1758948552-44544 17** **** 0646;FACEBK L97QB2C8S2 ,fb.me/ads ,IE ;16.03.2024 09:09:51 ;CashBack:0 EUR",Platba kartou,,
211,,2024-03-16,-0.25,EUR,Poplatok za platbu kartou,Poplatok za kartovú transakciu,,
212,,2024-03-16,-750.0,EUR,"B1758046982-44544 17** **** 0646;FACEBK BDWAJZ38S2 ,fb.me/ads ,IE ;15.03.2024 06:26:10 ;CashBack:0 EUR",Platba kartou,,
213,,2024-03-15,-750.0,EUR,"B1757075434-44544 17** **** 0646;FACEBK 93ETMZX8S2 ,fb.me/ads ,IE ;14.03.2024 06:41:53 ;CashBack:0 EUR",Platba kartou,,
214,,2024-03-15,-0.25,EUR,Poplatok za platbu kartou,Poplatok za kartovú transakciu,,
215,,2024-03-13,-0.25,EUR,Poplatok za platbu kartou,Poplatok za kartovú transakciu,,
216,,2024-03-13,-750.0,EUR,"B1756019900-44544 17** **** 0646;FACEBK TAPC5288S2 ,fb.me/ads ,IE ;13.03.2024 05:23:49 ;CashBack:0 EUR",Platba kartou,,
217,,2024-03-11,-0.25,EUR,Poplatok za platbu kartou,Poplatok za kartovú transakciu,,
218,,2024-03-11,-750.0,EUR,"B1754382874-44544 17** **** 0646;FACEBK EYDRDZ38S2 ,fb.me/ads ,IE ;11.03.2024 05:54:57 ;CashBack:0 EUR",Platba kartou,,
219,,2024-03-10,-0.25,EUR,Poplatok za platbu kartou,Poplatok za kartovú transakciu,,
220,,2024-03-10,-750.0,EUR,"B1753203954-44544 17** **** 0646;FACEBK 845LM2Q8S2 ,fb.me/ads ,IE ;09.03.2024 17:55:26 ;CashBack:0 EUR",Platba kartou,,
221,,2024-03-10,-750.0,EUR,"B1752320116-44544 17** **** 0646;FACEBK KXCLYZ78S2 ,fb.me/ads ,IE ;08.03.2024 20:41:00 ;CashBack:0 EUR",Platba kartou,,
222,,2024-03-10,-0.25,EUR,Poplatok za platbu kartou,Poplatok za kartovú transakciu,,
223,,2024-03-08,-0.25,EUR,Poplatok za platbu kartou,Poplatok za kartovú transakciu,,
224,,2024-03-08,-750.0,EUR,"B1751448939-44544 17** **** 0646;FACEBK RZ2ER249S2 ,fb.me/ads ,IE ;07.03.2024 23:28:32 ;CashBack:0 EUR",Platba kartou,,
225,,2024-03-08,-0.25,EUR,Poplatok za platbu kartou,Poplatok za kartovú transakciu,,
226,,2024-03-08,-750.0,EUR,"B1751433174-44544 17** **** 0646;FACEBK F894EZX8S2 ,fb.me/ads ,IE ;07.03.2024 06:43:05 ;CashBack:0 EUR",Platba kartou,,
227,Harcar Stefan - STEEVEPRESS,2024-03-08,-108.0,EUR,FD-267-letaky,Platobný príkaz na úhradu / FIT 2.0 (EB),20240213.0,
228,MESTSKE KULTURNE STR,2024-03-08,-700.0,EUR,FD-268-prenajom priestorov,Platobný príkaz na úhradu / FIT 2.0 (EB),1113400017.0,
229,,2024-03-07,-0.25,EUR,Poplatok za platbu kartou,Poplatok za kartovú transakciu,,
230,,2024-03-07,-750.0,EUR,"B1750616300-44544 17** **** 0646;FACEBK M5QMBZF8S2 ,fb.me/ads ,IE ;06.03.2024 06:49:00 ;CashBack:0 EUR",Platba kartou,,
231,,2024-03-05,-0.25,EUR,Poplatok za platbu kartou,Poplatok za kartovú transakciu,,
232,,2024-03-05,-750.0,EUR,"B1749015879-44544 17** **** 0646;FACEBK 9SFR7ZK8S2 ,fb.me/ads ,IE ;04.03.2024 18:28:13 ;CashBack:0 EUR",Platba kartou,,
233,Financna sprava Bratislava,2024-03-05,-2316.54,EUR,DPH-2/2024,Platobný príkaz na úhradu / FIT 2.0 (EB),1100022024.0,202402.0
234,,2024-03-04,-0.25,EUR,Poplatok za platbu kartou,Poplatok za kartovú transakciu,,
235,,2024-03-04,-750.0,EUR,"B1748536167-44544 17** **** 0646;FACEBK NTEU9ZX8S2 ,fb.me/ads ,IE ;03.03.2024 15:14:32 ;CashBack:0 EUR",Platba kartou,,
236,,2024-03-04,-8.0,EUR,Poplatok za výber hotovosti,Poplatok,,
237,,2024-03-04,-3000.0,EUR,výber hotovosti do pokladne,Výber hotovosti,,
238,,2024-03-03,-0.25,EUR,Poplatok za platbu kartou,Poplatok za kartovú transakciu,,
239,,2024-03-03,-750.0,EUR,"B1747771050-44544 17** **** 0646;FACEBK *HJNUJ249S2 ,fb.me/ads ,IE ;02.03.2024 09:05:16 ;CashBack:0 EUR",Platba kartou,,
240,,2024-03-02,-0.25,EUR,Poplatok za platbu kartou,Poplatok za kartovú transakciu,,
241,,2024-03-02,-750.0,EUR,"B1746935214-44544 17** **** 0646;FACEBK UUHP3ZK8S2 ,fb.me/ads ,IE ;01.03.2024 07:44:27 ;CashBack:0 EUR",Platba kartou,,
242,,2024-03-01,-0.25,EUR,Poplatok za platbu kartou,Poplatok za kartovú transakciu,,
243,,2024-03-01,-332.68,EUR,"B1746187219-44544 17** **** 0646;FACEBK END4C3U8S2 ,fb.me/ads ,IE ;29.02.2024 15:40:37 ;CashBack:0 EUR",Platba kartou,,
244,,2024-02-29,-5.0,EUR,Zverejňovanie účtu,Poplatok,,
245,,2024-02-29,-5.0,EUR,Poplatok za vedenie účtu,Poplatok,,
246,,2024-02-29,-0.25,EUR,Poplatok za platbu kartou,Poplatok za kartovú transakciu,,
247,,2024-02-29,-750.0,EUR,"B1745428751-44544 17** **** 0646;FACEBK 5RRJYY38S2 ,fb.me/ads ,IE ;28.02.2024 21:14:43 ;CashBack:0 EUR",Platba kartou,,
248,,2024-02-29,-0.25,EUR,Poplatok za platbu kartou,Poplatok za kartovú transakciu,,
249,,2024-02-29,-750.0,EUR,"B1745248866-44544 17** **** 0646;FACEBK *SF5H4ZX8S2 ,fb.me/ads ,IE ;28.02.2024 04:49:54 ;CashBack:0 EUR",Platba kartou,,
250,,2024-02-29,-2.9,EUR,"Vedenie Platobnej karty embosovanej,2315,5,Karta č. 4544 17** **** 0646Poplatok za Platobnú kartu",Kartový poplatok,,
251,,2024-02-28,-0.25,EUR,Poplatok za platbu kartou,Poplatok za kartovú transakciu,,
252,,2024-02-28,-750.0,EUR,"B1744515924-44544 17** **** 0646;FACEBK HUFYNZB8S2 ,fb.me/ads ,IE ;27.02.2024 10:19:47 ;CashBack:0 EUR",Platba kartou,,
253,MESTO SABINOV,2024-02-28,-38.25,EUR,FD-215-dan za uzivanie verejneho priestranstva,Platobný príkaz na úhradu / FIT 2.0 (EB),2825400171.0,
254,,2024-02-27,-0.25,EUR,Poplatok za platbu kartou,Poplatok za kartovú transakciu,,
255,,2024-02-27,-750.0,EUR,"B1743789690-44544 17** **** 0646;FACEBK 258SVY38S2 ,fb.me/ads ,IE ;26.02.2024 15:54:48 ;CashBack:0 EUR",Platba kartou,,
256,,2024-02-26,-0.25,EUR,Poplatok za platbu kartou,Poplatok za kartovú transakciu,,
257,,2024-02-26,-750.0,EUR,"B1743286910-44544 17** **** 0646;FACEBK JZ6PUY38S2 ,fb.me/ads ,IE ;25.02.2024 18:41:54 ;CashBack:0 EUR",Platba kartou,,
258,AGENTURA SMER,2024-02-26,-160000.0,EUR,Zal.fa c.11-propagacia a organiz.-tech. zabezpecenie MDZ 2024,Platobný príkaz na úhradu / FIT 2.0 (EB),240800001.0,
259,AGENTURA SMER,2024-02-26,-140000.0,EUR,Zal.fa c.11-propagacia a organiz.-tech.zabezpecenie MDZ 2024,Platobný príkaz na úhradu / FIT 2.0 (EB),240800001.0,
260,,2024-02-25,-0.25,EUR,Poplatok za platbu kartou,Poplatok za kartovú transakciu,,
261,,2024-02-25,-750.0,EUR,"B1742602006-44544 17** **** 0646;FACEBK 8S4YGZ78S2 ,fb.me/ads ,IE ;24.02.2024 20:01:28 ;CashBack:0 EUR",Platba kartou,,
262,,2024-02-25,-0.25,EUR,Poplatok za platbu kartou,Poplatok za kartovú transakciu,,
263,,2024-02-25,-750.0,EUR,"B1741709219-44544 17** **** 0646;FACEBK 4CE69249S2 ,fb.me/ads ,IE ;23.02.2024 15:29:54 ;CashBack:0 EUR",Platba kartou,,
264,,2024-02-24,-0.25,EUR,Poplatok za platbu kartou,Poplatok za kartovú transakciu,,
265,,2024-02-24,-750.0,EUR,"B1740834908-44544 17** **** 0646;FACEBK KHQ622Q8S2 ,fb.me/ads ,IE ;22.02.2024 13:36:48 ;CashBack:0 EUR",Platba kartou,,
266,,2024-02-22,-0.25,EUR,Poplatok za platbu kartou,Poplatok za kartovú transakciu,,
267,,2024-02-22,-750.0,EUR,"B1740055724-44544 17** **** 0646;FACEBK FMPRZ2U8S2 ,fb.me/ads ,IE ;21.02.2024 06:23:45 ;CashBack:0 EUR",Platba kartou,,
268,,2024-02-20,-0.25,EUR,Poplatok za platbu kartou,Poplatok za kartovú transakciu,,
269,,2024-02-20,-750.0,EUR,"B1738335214-44544 17** **** 0646;FACEBK D4BCNYK8S2 ,fb.me/ads ,IE ;19.02.2024 08:04:31 ;CashBack:0 EUR",Platba kartou,,
270,,2024-02-18,-0.25,EUR,Poplatok za platbu kartou,Poplatok za kartovú transakciu,,
271,,2024-02-18,-750.0,EUR,"B1737036884-44544 17** **** 0646;FACEBK XCLMV2U8S2 ,fb.me/ads ,IE ;17.02.2024 17:13:19 ;CashBack:0 EUR",Platba kartou,,
272,,2024-02-17,-0.25,EUR,Poplatok za platbu kartou,Poplatok za kartovú transakciu,,
273,,2024-02-17,-750.0,EUR,"B1736177721-44544 17** **** 0646;FACEBK 462V9ZB8S2 ,fb.me/ads ,IE ;16.02.2024 14:06:30 ;CashBack:0 EUR",Platba kartou,,
274,,2024-02-16,-0.25,EUR,Poplatok za platbu kartou,Poplatok za kartovú transakciu,,
275,,2024-02-16,-750.0,EUR,"B1735075801-44544 17** **** 0646;FACEBK NJGRRZP8S2 ,fb.me/ads ,IE ;15.02.2024 07:51:50 ;CashBack:0 EUR",Platba kartou,,
276,,2024-02-14,-0.25,EUR,Poplatok za platbu kartou,Poplatok za kartovú transakciu,,
277,,2024-02-14,-750.0,EUR,"B1733394925-44544 17** **** 0646;FACEBK FUEEEY38S2 ,fb.me/ads ,IE ;13.02.2024 17:55:15 ;CashBack:0 EUR",Platba kartou,,
278,SMER - sociálna demokracia,2024-02-02,160000.0,EUR,Prevod prostriedkov z bezneho uctu SMER-SD na transparentny ucet SMER-SD,Bezhotovostný vklad,2022024.0,
279,SMER - sociálna demokracia,2024-02-02,40000.0,EUR,Prevod prostriedkov z bezneho uctu SMER-SD na transparentny ucet SMER-SD,Bezhotovostný vklad,2022024.0,
280,SMER - sociálna demokracia,2024-02-02,160000.0,EUR,Prevod prostriedkov z bezneho uctu SMER-SD na transparentny ucet SMER-SD,Bezhotovostný vklad,2022024.0,
281,SMER - sociálna demokracia,2024-02-02,160000.0,EUR,Prevod prostriedkov z bezneho uctu SMER-SD na transparentny ucet SMER-SD,Bezhotovostný vklad,2022024.0,
282,SMER - sociálna demokracia,2024-02-02,160000.0,EUR,Prevod prostriedkov z bezneho uctu SMER-SD na transparentny ucet SMER-SD,Bezhotovostný vklad,2022024.0,
283,SMER - sociálna demokracia,2024-02-02,160000.0,EUR,Prevod prostriedkov z bezneho uctu SMER-SD na transparentny ucet SMER-SD,Bezhotovostný vklad,2022024.0,
284,SMER - sociálna demokracia,2024-02-02,160000.0,EUR,Prevod prostriedkov z bezneho uctu SMER-SD na transparentny ucet SMER-SD,Bezhotovostný vklad,2022024.0,